category,name,provider,theme_canonical,theme_raw,coverage,license,formats,access,url,verified_alive,doi_or_citation,time_span,notes,seen_in_passes,desc_zh,desc_en,access_status,openness,source_type,evidence,access_class,scale,feature_count,file_size
Elevation · DEM,NOAA Akutan Alaska 8/15 arc-second Coastal DEM,NOAA National Centers for Environmental Information,Island coastal DEM,"Akutan, Alaska 8/15 Arc-second Coastal Digital Elevation Model","Akutan, Alaska",U.S. public domain,"NOAA DEM grid distribution formats, metadata and download services",NOAA NCEI metadata/download landing page,https://www.ncei.noaa.gov/access/metadata/landing-page/bin/iso?id=gov.noaa.ngdc.mgg.dem%3A737,yes,"NOAA NCEI Akutan, Alaska 8/15 Arc-second Coastal Digital Elevation Model metadata record",regional island/coastal DEM release,Accepted as a named NOAA regional coastal DEM product. Kept separate from broader NOAA Coastal DEM/CUDEM/CRM rows because NOAA exposes a distinct metadata record and regional scope.,dem-v010-noaa-alaska-hawaii-caribbean,"Akutan, Alaska 8/15 Arc-second Coastal Digital Elevation Model 是 NOAA NCEI 发布的区域海岸数字高程模型，覆盖 Akutan, Alaska。它服务于海啸、风暴潮、海岸淹没、岛屿/港湾风险评估和海陆连续地形分析，是 NOAA coastal DEM 产品族中的独立区域记录。","Akutan, Alaska 8/15 Arc-second Coastal Digital Elevation Model is a regional NOAA NCEI coastal digital elevation model covering Akutan, Alaska. It supports tsunami, storm-surge, coastal inundation, island or harbor risk assessment, and land-water terrain analysis, and is treated as a distinct regional record within the NOAA coastal DEM product family.",open,public domain,official NOAA NCEI metadata/product record,"NOAA NCEI ISO metadata landing page title-confirmed as Akutan, Alaska 8/15 Arc-second Coastal Digital Elevation Model",download/metadata,8/15 arc-second,Akutan coastal DEM grid,
Elevation · DEM,NOAA Shemya Alaska 1 arc-second MHW Coastal DEM,NOAA National Centers for Environmental Information,Island coastal DEM,"Shemya, Alaska 1 arc-second MHW Coastal Digital Elevation Model","Shemya, Alaska",U.S. public domain,"NOAA DEM grid distribution formats, metadata and download services",NOAA NCEI metadata/download landing page,https://www.ncei.noaa.gov/access/metadata/landing-page/bin/iso?id=gov.noaa.ngdc.mgg.dem%3A632,yes,"NOAA NCEI Shemya, Alaska 1 arc-second MHW Coastal Digital Elevation Model metadata record",regional island/coastal DEM release,Accepted as a named NOAA regional coastal DEM product. Kept separate from broader NOAA Coastal DEM/CUDEM/CRM rows because NOAA exposes a distinct metadata record and regional scope.,dem-v010-noaa-alaska-hawaii-caribbean,"Shemya, Alaska 1 arc-second MHW Coastal Digital Elevation Model 是 NOAA NCEI 发布的区域海岸数字高程模型，覆盖 Shemya, Alaska。它服务于海啸、风暴潮、海岸淹没、岛屿/港湾风险评估和海陆连续地形分析，是 NOAA coastal DEM 产品族中的独立区域记录。","Shemya, Alaska 1 arc-second MHW Coastal Digital Elevation Model is a regional NOAA NCEI coastal digital elevation model covering Shemya, Alaska. It supports tsunami, storm-surge, coastal inundation, island or harbor risk assessment, and land-water terrain analysis, and is treated as a distinct regional record within the NOAA coastal DEM product family.",open,public domain,official NOAA NCEI metadata/product record,"NOAA NCEI ISO metadata landing page title-confirmed as Shemya, Alaska 1 arc-second MHW Coastal Digital Elevation Model",download/metadata,1 arc-second,Shemya coastal DEM grid,
Elevation · DEM,NOAA Adak Alaska 1 arc-second Coastal DEM,NOAA National Centers for Environmental Information,Island coastal DEM,"Adak, Alaska 1 arc-second Coastal Digital Elevation Model","Adak, Alaska",U.S. public domain,"NOAA DEM grid distribution formats, metadata and download services",NOAA NCEI metadata/download landing page,https://www.ncei.noaa.gov/access/metadata/landing-page/bin/iso?id=gov.noaa.ngdc.mgg.dem%3A258,yes,"NOAA NCEI Adak, Alaska 1 arc-second Coastal Digital Elevation Model metadata record",regional island/coastal DEM release,Accepted as a named NOAA regional coastal DEM product. Kept separate from broader NOAA Coastal DEM/CUDEM/CRM rows because NOAA exposes a distinct metadata record and regional scope.,dem-v010-noaa-alaska-hawaii-caribbean,"Adak, Alaska 1 arc-second Coastal Digital Elevation Model 是 NOAA NCEI 发布的区域海岸数字高程模型，覆盖 Adak, Alaska。它服务于海啸、风暴潮、海岸淹没、岛屿/港湾风险评估和海陆连续地形分析，是 NOAA coastal DEM 产品族中的独立区域记录。","Adak, Alaska 1 arc-second Coastal Digital Elevation Model is a regional NOAA NCEI coastal digital elevation model covering Adak, Alaska. It supports tsunami, storm-surge, coastal inundation, island or harbor risk assessment, and land-water terrain analysis, and is treated as a distinct regional record within the NOAA coastal DEM product family.",open,public domain,official NOAA NCEI metadata/product record,"NOAA NCEI ISO metadata landing page title-confirmed as Adak, Alaska 1 arc-second Coastal Digital Elevation Model",download/metadata,1 arc-second,Adak coastal DEM grid,
Elevation · DEM,NOAA Kawaihae Hawaii 1/3 arc-second MHW Coastal DEM,NOAA National Centers for Environmental Information,Island coastal DEM,"Kawaihae, Hawaii 1/3 arc-second MHW Coastal Digital Elevation Model","Kawaihae, Hawaii",U.S. public domain,"NOAA DEM grid distribution formats, metadata and download services",NOAA NCEI metadata/download landing page,https://www.ncei.noaa.gov/access/metadata/landing-page/bin/iso?id=gov.noaa.ngdc.mgg.dem%3A1842,yes,"NOAA NCEI Kawaihae, Hawaii 1/3 arc-second MHW Coastal Digital Elevation Model metadata record",regional island/coastal DEM release,Accepted as a named NOAA regional coastal DEM product. Kept separate from broader NOAA Coastal DEM/CUDEM/CRM rows because NOAA exposes a distinct metadata record and regional scope.,dem-v010-noaa-alaska-hawaii-caribbean,"Kawaihae, Hawaii 1/3 arc-second MHW Coastal Digital Elevation Model 是 NOAA NCEI 发布的区域海岸数字高程模型，覆盖 Kawaihae, Hawaii。它服务于海啸、风暴潮、海岸淹没、岛屿/港湾风险评估和海陆连续地形分析，是 NOAA coastal DEM 产品族中的独立区域记录。","Kawaihae, Hawaii 1/3 arc-second MHW Coastal Digital Elevation Model is a regional NOAA NCEI coastal digital elevation model covering Kawaihae, Hawaii. It supports tsunami, storm-surge, coastal inundation, island or harbor risk assessment, and land-water terrain analysis, and is treated as a distinct regional record within the NOAA coastal DEM product family.",open,public domain,official NOAA NCEI metadata/product record,"NOAA NCEI ISO metadata landing page title-confirmed as Kawaihae, Hawaii 1/3 arc-second MHW Coastal Digital Elevation Model",download/metadata,1/3 arc-second,Kawaihae coastal DEM grid,
Elevation · DEM,NOAA St. Thomas and St. John U.S. Virgin Islands Coastal DEM,NOAA National Centers for Environmental Information,Island coastal DEM,"St. Thomas and St. John, U.S. Virgin Islands Coastal Digital Elevation Model","St. Thomas and St. John, U.S. Virgin Islands",U.S. public domain,"NOAA DEM grid distribution formats, metadata and download services",NOAA NCEI metadata/download landing page,https://www.ncei.noaa.gov/access/metadata/landing-page/bin/iso?id=gov.noaa.ngdc.mgg.dem%3A677,yes,"NOAA NCEI St. Thomas and St. John, U.S. Virgin Islands Coastal Digital Elevation Model metadata record",regional island/coastal DEM release,Accepted as a named NOAA regional coastal DEM product. Kept separate from broader NOAA Coastal DEM/CUDEM/CRM rows because NOAA exposes a distinct metadata record and regional scope.,dem-v010-noaa-alaska-hawaii-caribbean,"St. Thomas and St. John, U.S. Virgin Islands Coastal Digital Elevation Model 是 NOAA NCEI 发布的区域海岸数字高程模型，覆盖 St. Thomas and St. John, U.S. Virgin Islands。它服务于海啸、风暴潮、海岸淹没、岛屿/港湾风险评估和海陆连续地形分析，是 NOAA coastal DEM 产品族中的独立区域记录。","St. Thomas and St. John, U.S. Virgin Islands Coastal Digital Elevation Model is a regional NOAA NCEI coastal digital elevation model covering St. Thomas and St. John, U.S. Virgin Islands. It supports tsunami, storm-surge, coastal inundation, island or harbor risk assessment, and land-water terrain analysis, and is treated as a distinct regional record within the NOAA coastal DEM product family.",open,public domain,official NOAA NCEI metadata/product record,"NOAA NCEI ISO metadata landing page title-confirmed as St. Thomas and St. John, U.S. Virgin Islands Coastal Digital Elevation Model",download/metadata,coastal product-specific resolution,St. Thomas and St. John coastal DEM grid,
Elevation · DEM,NOAA Lahaina Hawaii 1/3 arc-second MHW Coastal DEM,NOAA National Centers for Environmental Information,Regional coastal DEM,"Lahaina, Hawaii 1/3 arc-second MHW Coastal Digital Elevation Model","Lahaina, Hawaii",U.S. public domain,"NOAA DEM grid distribution formats, metadata and download services",NOAA NCEI metadata/download landing page,https://www.ncei.noaa.gov/access/metadata/landing-page/bin/iso?id=gov.noaa.ngdc.mgg.dem%3A239,yes,"NOAA NCEI Lahaina, Hawaii 1/3 arc-second MHW Coastal Digital Elevation Model metadata record",regional coastal DEM release,Accepted as a named NOAA regional coastal DEM product with a distinct metadata ID and verified title. Kept separate from broad NOAA collection rows and other city/island products.,dem-v011-noaa-regional-coastal,"Lahaina, Hawaii 1/3 arc-second MHW Coastal Digital Elevation Model 是 NOAA NCEI 发布的区域海岸数字高程模型，覆盖 Lahaina, Hawaii。它服务于海啸、风暴潮、海岸淹没、港口/社区风险评估和海陆连续地形分析，是 NOAA coastal DEM 产品族中的独立区域记录。","Lahaina, Hawaii 1/3 arc-second MHW Coastal Digital Elevation Model is a regional NOAA NCEI coastal digital elevation model covering Lahaina, Hawaii. It supports tsunami, storm-surge, coastal inundation, harbor or community risk assessment, and land-water terrain analysis, and is treated as a distinct regional record within the NOAA coastal DEM product family.",open,public domain,official NOAA NCEI metadata/product record,"NOAA NCEI ISO metadata landing page title-confirmed as Lahaina, Hawaii 1/3 arc-second MHW Coastal Digital Elevation Model",download/metadata,1/3 arc-second,Lahaina coastal DEM grid,
Elevation · DEM,NOAA Biloxi Mississippi Coastal DEM,NOAA National Centers for Environmental Information,Regional coastal DEM,"Biloxi, Mississippi Coastal Digital Elevation Model","Biloxi, Mississippi",U.S. public domain,"NOAA DEM grid distribution formats, metadata and download services",NOAA NCEI metadata/download landing page,https://www.ncei.noaa.gov/access/metadata/landing-page/bin/iso?id=gov.noaa.ngdc.mgg.dem%3A241,yes,"NOAA NCEI Biloxi, Mississippi Coastal Digital Elevation Model metadata record",regional coastal DEM release,Accepted as a named NOAA regional coastal DEM product with a distinct metadata ID and verified title. Kept separate from broad NOAA collection rows and other city/island products.,dem-v011-noaa-regional-coastal,"Biloxi, Mississippi Coastal Digital Elevation Model 是 NOAA NCEI 发布的区域海岸数字高程模型，覆盖 Biloxi, Mississippi。它服务于海啸、风暴潮、海岸淹没、港口/社区风险评估和海陆连续地形分析，是 NOAA coastal DEM 产品族中的独立区域记录。","Biloxi, Mississippi Coastal Digital Elevation Model is a regional NOAA NCEI coastal digital elevation model covering Biloxi, Mississippi. It supports tsunami, storm-surge, coastal inundation, harbor or community risk assessment, and land-water terrain analysis, and is treated as a distinct regional record within the NOAA coastal DEM product family.",open,public domain,official NOAA NCEI metadata/product record,"NOAA NCEI ISO metadata landing page title-confirmed as Biloxi, Mississippi Coastal Digital Elevation Model",download/metadata,coastal product-specific resolution,Biloxi coastal DEM grid,
Elevation · DEM,NOAA Panama City Florida Coastal DEM,NOAA National Centers for Environmental Information,Regional coastal DEM,"Panama City, Florida Coastal Digital Elevation Model","Panama City, Florida",U.S. public domain,"NOAA DEM grid distribution formats, metadata and download services",NOAA NCEI metadata/download landing page,https://www.ncei.noaa.gov/access/metadata/landing-page/bin/iso?id=gov.noaa.ngdc.mgg.dem%3A243,yes,"NOAA NCEI Panama City, Florida Coastal Digital Elevation Model metadata record",regional coastal DEM release,Accepted as a named NOAA regional coastal DEM product with a distinct metadata ID and verified title. Kept separate from broad NOAA collection rows and other city/island products.,dem-v011-noaa-regional-coastal,"Panama City, Florida Coastal Digital Elevation Model 是 NOAA NCEI 发布的区域海岸数字高程模型，覆盖 Panama City, Florida。它服务于海啸、风暴潮、海岸淹没、港口/社区风险评估和海陆连续地形分析，是 NOAA coastal DEM 产品族中的独立区域记录。","Panama City, Florida Coastal Digital Elevation Model is a regional NOAA NCEI coastal digital elevation model covering Panama City, Florida. It supports tsunami, storm-surge, coastal inundation, harbor or community risk assessment, and land-water terrain analysis, and is treated as a distinct regional record within the NOAA coastal DEM product family.",open,public domain,official NOAA NCEI metadata/product record,"NOAA NCEI ISO metadata landing page title-confirmed as Panama City, Florida Coastal Digital Elevation Model",download/metadata,coastal product-specific resolution,Panama City coastal DEM grid,
Elevation · DEM,NOAA King Cove Alaska Coastal DEM,NOAA National Centers for Environmental Information,Regional coastal DEM,"King Cove, Alaska Coastal Digital Elevation Model","King Cove, Alaska",U.S. public domain,"NOAA DEM grid distribution formats, metadata and download services",NOAA NCEI metadata/download landing page,https://www.ncei.noaa.gov/access/metadata/landing-page/bin/iso?id=gov.noaa.ngdc.mgg.dem%3A245,yes,"NOAA NCEI King Cove, Alaska Coastal Digital Elevation Model metadata record",regional coastal DEM release,Accepted as a named NOAA regional coastal DEM product with a distinct metadata ID and verified title. Kept separate from broad NOAA collection rows and other city/island products.,dem-v011-noaa-regional-coastal,"King Cove, Alaska Coastal Digital Elevation Model 是 NOAA NCEI 发布的区域海岸数字高程模型，覆盖 King Cove, Alaska。它服务于海啸、风暴潮、海岸淹没、港口/社区风险评估和海陆连续地形分析，是 NOAA coastal DEM 产品族中的独立区域记录。","King Cove, Alaska Coastal Digital Elevation Model is a regional NOAA NCEI coastal digital elevation model covering King Cove, Alaska. It supports tsunami, storm-surge, coastal inundation, harbor or community risk assessment, and land-water terrain analysis, and is treated as a distinct regional record within the NOAA coastal DEM product family.",open,public domain,official NOAA NCEI metadata/product record,"NOAA NCEI ISO metadata landing page title-confirmed as King Cove, Alaska Coastal Digital Elevation Model",download/metadata,coastal product-specific resolution,King Cove coastal DEM grid,
Elevation · DEM,NOAA La Push Washington 1/3 arc-second MHW Coastal DEM,NOAA National Centers for Environmental Information,Regional coastal DEM,"La Push, Washington 1/3 arc-second MHW Coastal Digital Elevation Model","La Push, Washington",U.S. public domain,"NOAA DEM grid distribution formats, metadata and download services",NOAA NCEI metadata/download landing page,https://www.ncei.noaa.gov/access/metadata/landing-page/bin/iso?id=gov.noaa.ngdc.mgg.dem%3A247,yes,"NOAA NCEI La Push, Washington 1/3 arc-second MHW Coastal Digital Elevation Model metadata record",regional coastal DEM release,Accepted as a named NOAA regional coastal DEM product with a distinct metadata ID and verified title. Kept separate from broad NOAA collection rows and other city/island products.,dem-v011-noaa-regional-coastal,"La Push, Washington 1/3 arc-second MHW Coastal Digital Elevation Model 是 NOAA NCEI 发布的区域海岸数字高程模型，覆盖 La Push, Washington。它服务于海啸、风暴潮、海岸淹没、港口/社区风险评估和海陆连续地形分析，是 NOAA coastal DEM 产品族中的独立区域记录。","La Push, Washington 1/3 arc-second MHW Coastal Digital Elevation Model is a regional NOAA NCEI coastal digital elevation model covering La Push, Washington. It supports tsunami, storm-surge, coastal inundation, harbor or community risk assessment, and land-water terrain analysis, and is treated as a distinct regional record within the NOAA coastal DEM product family.",open,public domain,official NOAA NCEI metadata/product record,"NOAA NCEI ISO metadata landing page title-confirmed as La Push, Washington 1/3 arc-second MHW Coastal Digital Elevation Model",download/metadata,1/3 arc-second,La Push coastal DEM grid,
Elevation · DEM,NOAA Garibaldi Oregon Coastal DEM,NOAA National Centers for Environmental Information,Regional coastal DEM,"Garibaldi, Oregon Coastal Digital Elevation Model","Garibaldi, Oregon",U.S. public domain,"NOAA DEM grid distribution formats, metadata and download services",NOAA NCEI metadata/download landing page,https://www.ncei.noaa.gov/access/metadata/landing-page/bin/iso?id=gov.noaa.ngdc.mgg.dem%3A249,yes,"NOAA NCEI Garibaldi, Oregon Coastal Digital Elevation Model metadata record",regional coastal DEM release,Accepted as a named NOAA regional coastal DEM product with a distinct metadata ID and verified title. Kept separate from broad NOAA collection rows and other city/island products.,dem-v011-noaa-regional-coastal,"Garibaldi, Oregon Coastal Digital Elevation Model 是 NOAA NCEI 发布的区域海岸数字高程模型，覆盖 Garibaldi, Oregon。它服务于海啸、风暴潮、海岸淹没、港口/社区风险评估和海陆连续地形分析，是 NOAA coastal DEM 产品族中的独立区域记录。","Garibaldi, Oregon Coastal Digital Elevation Model is a regional NOAA NCEI coastal digital elevation model covering Garibaldi, Oregon. It supports tsunami, storm-surge, coastal inundation, harbor or community risk assessment, and land-water terrain analysis, and is treated as a distinct regional record within the NOAA coastal DEM product family.",open,public domain,official NOAA NCEI metadata/product record,"NOAA NCEI ISO metadata landing page title-confirmed as Garibaldi, Oregon Coastal Digital Elevation Model",download/metadata,coastal product-specific resolution,Garibaldi coastal DEM grid,
Elevation · DEM,City of Cape Town Ground Level Map 5m DEM (CCT GLM 2019),City of Cape Town,Municipal LiDAR-derived DEM,Ground Level Map 5m DEM (CCT GLM 2019),"City of Cape Town Municipality, South Africa",City of Cape Town open data terms / public municipal data portal,"ArcGIS REST MapServer raster service, WMS/REST services via open data portal",City of Cape Town open data landing page and ArcGIS REST service,https://odp-cctegis.opendata.arcgis.com/documents/cctegis%3A%3Aground-level-map-5m-dem-cct-glm-2019/about,yes,City of Cape Town Ground Level Map 5m DEM (CCT GLM 2019) open data record; service description approved by City Council on 27 July 2023,"LiDAR2019B-derived ground-level surface; source surveys 2018-2019, council-approved 2023","Accepted as an official municipal bare-earth raster DEM. The REST service describes a 5 m DEM derived from LiDAR2019B, with 30 cm vertical accuracy, SA Land Levelling Datum heights and SAGEOID2010 geoid use. CDNGI was kept as a generic portal lead only, not as a dataset row.",dem-v012-africa-official-research,City of Cape Town Ground Level Map 5m DEM 是开普敦市政府开放数据门户发布的 5 米裸地数字高程模型，由 2019B LiDAR 数据集派生。服务元数据说明该产品用于给城市规划和现状地面高程提供统一参考面，并提供 ArcGIS REST/WMS 等服务入口。,"The City of Cape Town Ground Level Map 5m DEM is an official municipal bare-earth elevation raster derived from the LiDAR2019B dataset. Its service metadata describes a 5 m reference surface for existing ground level across the City of Cape Town, exposed through the city open-data portal and ArcGIS REST/WMS services.",open,open municipal portal,official municipal open-data record and ArcGIS REST service,"Open data page title confirmed as Ground Level Map 5m DEM (CCT GLM 2019); REST service description states 5 m bare-earth DEM, LiDAR-derived source and municipal approval context.",portal/service,5 m raster DEM,municipal raster service,
Elevation · DEM,Kruger National Park Sub-meter DEM and Orthomosaics v1.0,CEDA Archive / Centre for Environmental Data Analysis,UAV/sub-meter research DEM,"Sub-meter resolution digital elevation models and orthomosaics of the Kruger National Park, South Africa, v1.0, September-October 2018","Kruger National Park, South Africa",CEDA data licence / dataset-specific terms,"CEDA archive dataset files, DEM and orthomosaic products",CEDA dataset catalogue landing page,https://catalogue.ceda.ac.uk/uuid/deab4235f1ef4cd79b73d0cbf2655bd7/,yes,CEDA catalogue UUID deab4235f1ef4cd79b73d0cbf2655bd7,September-October 2018,Accepted as a repository-backed research DEM dataset rather than a generic article. The CEDA record title explicitly identifies sub-meter DEMs and orthomosaics for Kruger National Park.,dem-v012-africa-official-research,Kruger National Park Sub-meter DEM and Orthomosaics v1.0 是 CEDA 目录发布的研究数据集，包含南非 Kruger National Park 的亚米级数字高程模型和正射镶嵌影像。它补充了全球/国家尺度 DEM 难以覆盖的保护区高分辨率地形资料，可用于生态、地貌与局地遥感分析。,"Kruger National Park Sub-meter DEM and Orthomosaics v1.0 is a CEDA catalogue dataset containing sub-meter digital elevation models and orthomosaics for Kruger National Park, South Africa. It fills a high-resolution protected-area niche not covered by global DEM products and is useful for ecological, geomorphic, and local remote-sensing analysis.",open metadata; data access via CEDA archive terms,repository access with dataset terms,research data repository record,"CEDA landing page title confirmed as Dataset Record: Sub-meter resolution digital elevation models and orthomosaics of the Kruger National Park, South Africa, v1.0, September-October 2018.",repository/download,sub-meter DEM,Kruger DEM and orthomosaic archive record,
Elevation · DEM,RCMRD South Africa SRTM 30m DEM,Regional Centre for Mapping of Resources for Development (RCMRD) / Africa GeoPortal,Regional SRTM-derived DEM,South Africa SRTM 30 meters,South Africa,Africa GeoPortal / RCMRD portal terms; derived from SRTM public mission data,ArcGIS Hub dataset/service access,RCMRD Africa GeoPortal dataset landing page,https://rcmrd.africageoportal.com/datasets/aafd352ca9044f23a78274e782dfe788/about,yes,RCMRD Africa GeoPortal item aafd352ca9044f23a78274e782dfe788,SRTM mission-derived product,Accepted as a regional institutional country extract/portal product. It is intentionally described as SRTM-derived and not as a new sensor mission; retained because the catalogue is collecting access routes and institutional derivatives as well as canonical global products.,dem-v012-africa-official-research,RCMRD South Africa SRTM 30m DEM 是 RCMRD Africa GeoPortal 提供的南非 30 米 SRTM 数字高程模型数据集。它不是新的测绘任务，而是区域机构整理的国家尺度 SRTM 派生访问入口，适合快速获取南非范围的基础地形格网。,"RCMRD South Africa SRTM 30m DEM is a South Africa country-scale SRTM-derived elevation dataset exposed through the RCMRD Africa GeoPortal. It is not a separate elevation mission, but it provides a regional institutional access route for a 30 m national DEM grid.",open,public portal,regional institutional geospatial portal record,"Africa GeoPortal page title confirmed as South Africa SRMT 30 meters, with description South Africa 30 meters SRTM Digital Elevation Model.",portal/service,30 m DEM,South Africa country SRTM DEM item,
