category,name,provider,theme_canonical,theme_raw,coverage,license,formats,access,url,verified_alive,doi_or_citation,time_span,notes,seen_in_passes,desc_zh,desc_en,access_status,openness,source_type,evidence,access_class,scale,feature_count,file_size
Elevation · DEM,HDX Morocco Elevation Model,OCHA Middle East and North Africa (ROMENA) / HDX,National SRTM-derived DEM,Morocco - Elevation Model,Morocco,Open Data Commons Attribution License (ODC-BY),GeoTIFF ZIP download via HDX,HDX dataset landing page and CKAN API resource download,https://data.humdata.org/dataset/morocco-elevation-model,yes,HDX package morocco-elevation-model; USGS/NASA SRTM source cited in metadata,dataset date 2017-03-30; metadata modified 2025-05-05,"Accepted as a national Morocco DEM distribution package on HDX/OCHA ROMENA. API metadata states Digital Elevation Model of Morocco, NASA SRTM source, 250 m resolution, ODC-BY license and GeoTIFF MAR_DEM.zip resource. It is an extract/distribution product, not a new elevation mission.",dem-v019-hdx-mena-dem,HDX Morocco Elevation Model 是 HDX/OCHA ROMENA 发布的摩洛哥全国 DEM 分发包，元数据说明来源为 USGS/NASA SRTM，分辨率约 250 米。该包采用 ODC-BY 许可，并提供 GeoTIFF ZIP 下载，适合北非人道制图和风险分析。,"HDX Morocco Elevation Model is a national Morocco DEM distribution package from HDX/OCHA ROMENA. The metadata identifies USGS/NASA SRTM as source, 250 m resolution, ODC-BY licensing, and a GeoTIFF ZIP resource for humanitarian mapping and risk analysis in North Africa.",open,ODC-BY,humanitarian data exchange package with API metadata and download resource,"HDX API package_show confirms title Morocco - Elevation Model, SRTM/250 m notes, OCHA ROMENA organization, ODC-BY license and GeoTIFF MAR_DEM.zip resource.",download/API,250 m DEM,national DEM archive,
Elevation · DEM,HDX Tunisia Elevation Model,OCHA Middle East and North Africa (ROMENA) / HDX,National SRTM-derived DEM,Tunisia_ Elevation Model,Tunisia,Open Data Commons Attribution License (ODC-BY),GeoTIFF ZIP download via HDX,HDX dataset landing page and CKAN API resource download,https://data.humdata.org/dataset/tunisia-elevation-model,yes,HDX package tunisia-elevation-model; USGS/NASA SRTM source cited in metadata,dataset date 2017-03-30; metadata modified 2025-02-24,"Accepted as a national Tunisia DEM distribution package on HDX/OCHA ROMENA. API metadata states Digital Elevation Model of Tunisia, NASA SRTM source, 250 m resolution, ODC-BY license and GeoTIFF DEM.zip resource.",dem-v019-hdx-mena-dem,HDX Tunisia Elevation Model 是 HDX/OCHA ROMENA 发布的突尼斯全国 DEM 分发包，来源说明为 USGS/NASA SRTM，分辨率约 250 米。该包采用 ODC-BY 许可，并提供 GeoTIFF ZIP 下载，是突尼斯人道和区域风险分析的开放高程入口。,"HDX Tunisia Elevation Model is a national Tunisia DEM distribution package from HDX/OCHA ROMENA. The metadata cites USGS/NASA SRTM source data, 250 m resolution, ODC-BY licensing, and a GeoTIFF ZIP download, providing an open elevation route for humanitarian and regional risk analysis.",open,ODC-BY,humanitarian data exchange package with API metadata and download resource,"HDX API package_show confirms title Tunisia_ Elevation Model, SRTM/250 m notes, OCHA ROMENA organization, ODC-BY license and GeoTIFF DEM.zip resource.",download/API,250 m DEM,national DEM archive,
Elevation · DEM,HDX Algeria Elevation Model,OCHA Middle East and North Africa (ROMENA) / HDX,National SRTM-derived DEM,Algeria - Elevation Model,Algeria,Open Data Commons Attribution License (ODC-BY),GeoTIFF ZIP download via HDX,HDX dataset landing page and CKAN API resource download,https://data.humdata.org/dataset/algeria-elevation-model,yes,HDX package algeria-elevation-model; USGS/NASA SRTM source cited in metadata,dataset date 2017-03-30; metadata modified 2025-02-24,"Accepted as a national Algeria DEM distribution package on HDX/OCHA ROMENA. API metadata states Digital Elevation Model of Algeria, NASA SRTM source, 250 m resolution, ODC-BY license and GeoTIFF DZA_DEM.zip resource.",dem-v019-hdx-mena-dem,HDX Algeria Elevation Model 是 HDX/OCHA ROMENA 发布的阿尔及利亚全国 DEM 分发包，元数据说明来源为 USGS/NASA SRTM，分辨率约 250 米。该包采用 ODC-BY 许可，并提供 GeoTIFF ZIP 下载，补充了北非开放高程数据获取路径。,"HDX Algeria Elevation Model is a national Algeria DEM distribution package from HDX/OCHA ROMENA. The metadata identifies USGS/NASA SRTM as source, 250 m resolution, ODC-BY licensing, and a GeoTIFF ZIP download, extending open elevation access coverage for North Africa.",open,ODC-BY,humanitarian data exchange package with API metadata and download resource,"HDX API package_show confirms title Algeria - Elevation Model, SRTM/250 m notes, OCHA ROMENA organization, ODC-BY license and GeoTIFF DZA_DEM.zip resource.",download/API,250 m DEM,national DEM archive,
Elevation · DEM,HDX Libya Elevation Model,OCHA Middle East and North Africa (ROMENA) / HDX,National SRTM-derived DEM,Libya - Elevation Model,Libya,Other / source-specific terms in HDX metadata,GeoTIFF ZIP download and KMZ download-links resource via HDX,HDX dataset landing page and CKAN API resource downloads,https://data.humdata.org/dataset/libya-elevation-model,yes,HDX package libya-elevation-model; USGS/NASA SRTM and SRTM 90m notes in metadata,dataset date 2000-01-01; metadata modified 2025-05-05,"Accepted as a national Libya DEM distribution package on HDX/OCHA ROMENA. API metadata notes SRTM 90m DEM with 13 5 x 5 degree tiles and also a 250 m SRTM-derived DEM, with KMZ download-links and GeoTIFF DEM.zip resources. License is marked Other, so openness is recorded conservatively.",dem-v019-hdx-mena-dem,HDX Libya Elevation Model 是 HDX/OCHA ROMENA 发布的利比亚全国 DEM 分发包，元数据同时提到 SRTM 90 米瓦片覆盖和 250 米 SRTM 派生 DEM。该包提供 KMZ 下载链接资源和 GeoTIFF ZIP 下载，但许可字段为 Other，因此目录中按公开可访问但需复核源许可处理。,"HDX Libya Elevation Model is a national Libya DEM distribution package from HDX/OCHA ROMENA. The metadata mentions SRTM 90 m tiles covering Libya and a 250 m SRTM-derived DEM, with KMZ download-link and GeoTIFF ZIP resources; because the license field is Other, source terms should be reviewed before reuse.",open metadata/download; source terms require review,"public HDX access, license marked Other",humanitarian data exchange package with API metadata and download resources,"HDX API package_show confirms title Libya - Elevation Model, SRTM 90m/250 m notes, OCHA ROMENA organization, license Other, KMZ download-links resource and GeoTIFF DEM.zip resource.",download/API,90 m tiles and 250 m DEM distribution,national DEM archive plus download-links KMZ,
Elevation · DEM,HDX Mali Elevation Model,OCHA Mali / HDX,National DEM,Mali - Elevation Model,Mali,Other / source-specific terms in HDX metadata,ERDAS Imagine ZIP download via HDX,HDX dataset landing page and CKAN API resource download,https://data.humdata.org/dataset/mali-elevation-model,yes,HDX package mali-elevation-model; WFP mosaic noted in metadata,mosaic by WFP in 2005; dataset date 2012-01-26; metadata modified 2025-04-25,"Accepted as a national Mali DEM distribution package on HDX/OCHA Mali. API metadata states the dataset represents the Digital Elevation Model, mosaic done by WFP in 2005, spatial resolution 90 m, and provides ERDAS Image ZIP resource mli_dem_0.zip. License is marked Other, so reuse terms are recorded conservatively.",dem-v020-hdx-africa-dem,HDX Mali Elevation Model 是 OCHA Mali/HDX 发布的马里全国数字高程模型分发包，元数据说明该 DEM 由 WFP 于 2005 年拼接，空间分辨率为 90 米。数据提供 ERDAS Imagine ZIP 下载；由于许可字段为 Other，目录中按公开可访问但需复核源许可处理。,"HDX Mali Elevation Model is a national Mali DEM distribution package from OCHA Mali/HDX. The metadata states that the DEM mosaic was produced by WFP in 2005 at 90 m spatial resolution and provides an ERDAS Imagine ZIP download; because the license field is Other, source terms should be reviewed before reuse.",open metadata/download; source terms require review,"public HDX access, license marked Other",humanitarian data exchange package with API metadata and download resource,"HDX API package_show confirms title Mali - Elevation Model, WFP 2005 mosaic note, 90 m spatial resolution, OCHA Mali organization, license Other and ERDAS Image mli_dem_0.zip resource.",download/API,90 m DEM,national DEM archive,
Elevation · DEM,HDX Senegal Digital Elevation Model,OCHA West and Central Africa (ROWCA) / HDX,National DEM,Senegal - Digital Elevation Model,Senegal,Creative Commons Attribution for Intergovernmental Organisations (CC BY-IGO),ARC/INFO Grid ZIP download via HDX,HDX dataset landing page and CKAN API resource download,https://data.humdata.org/dataset/senegal-elevation-model,yes,HDX package senegal-elevation-model,dataset date 2004-04-23; metadata modified 2025-04-25,"Accepted as a national Senegal DEM distribution package on HDX/OCHA ROWCA. API metadata states the dataset represents the digital elevation model of Senegal, 90 m resolution, CC BY-IGO license and ARC/INFO Grid ZIP resource sen_dem_90 m_wfp.zip.",dem-v020-hdx-africa-dem,HDX Senegal Digital Elevation Model 是 OCHA West and Central Africa/HDX 发布的塞内加尔全国数字高程模型分发包，元数据说明分辨率为 90 米。数据采用 CC BY-IGO 许可，并提供 ARC/INFO Grid ZIP 下载，是西非国家尺度人道制图和风险分析的开放高程入口。,"HDX Senegal Digital Elevation Model is a national Senegal DEM distribution package from OCHA West and Central Africa/HDX. The metadata states 90 m resolution, CC BY-IGO licensing, and an ARC/INFO Grid ZIP download, providing an open elevation route for country-scale humanitarian mapping and risk analysis in West Africa.",open,CC BY-IGO,humanitarian data exchange package with API metadata and download resource,"HDX API package_show confirms title Senegal - Digital Elevation Model, 90 m resolution note, OCHA ROWCA organization, CC BY-IGO license and ARC/INFO Grid sen_dem_90 m_wfp.zip resource.",download/API,90 m DEM,national DEM archive,
Elevation · DEM,Indonesia INDEKS_DEM_Nasional / DEMNAS raster catalog,Badan Informasi Geospasial (BIG) / Satu Data Indonesia,National DEM index and service,INDEKS_DEM_Nasional; DEMNAS raster catalog; Web Service INDEKS_DEM_Nasional,"Indonesia national land area; CKAN spatial extent around 94.75E to 141.25E, 11.25S to 6.25N","Official Data.go.id/BIG public data portal record; CKAN license_title is null and isopen=false, so reuse/licensing requires portal/BIG terms check",Web Map Service / raster catalog; Ina-Geoportal download portal access,Data.go.id dataset record with web service resource; Ina-Geoportal public download portal for BIG geospatial data,https://data.go.id/dataset/dataset/indeks_dem_nasional,yes,"Data.go.id dataset indeks_dem_nasional; metadata_created 2024-07-03, metadata_modified 2024-09-05",current national DEM index record; metadata modified 2024-09-05,"Official Indonesian national DEM index made from the raster catalog of DEMNAS data. The Data.go.id page exposes a Web Map Service resource at 1:50,000 scale and links the BIG organization; licensing is not explicit in the CKAN metadata, so this row is treated as public-access with license caveat rather than fully open-license download.",dem-v022-official-asia-national-dem,"INDEKS_DEM_Nasional 是印度尼西亚地理空间信息局（BIG）在 Satu Data Indonesia/Data.go.id 上发布的国家 DEM 索引记录，说明其由 DEMNAS 全部数据的栅格目录构建。页面提供 Web Service 资源并标注印度尼西亚 1:50,000 国家 DEM 索引，可与 Ina-Geoportal 下载入口一起作为访问线索；但 CKAN 元数据中未给出明确开放许可证，因此复用时需要再核对 BIG/门户条款。","INDEKS_DEM_Nasional is the Indonesian national DEM index record published by Badan Informasi Geospasial (BIG) through Satu Data Indonesia/Data.go.id. The record states that the index is built from the raster catalog of DEMNAS data and exposes a Web Map Service resource for the Indonesia 1:50,000 DEM index, with Ina-Geoportal as an additional public access route. The CKAN metadata does not state an explicit open license, so reuse should be checked against BIG or portal terms.",open landing page; public service/download portal with license caveat,"public access, license not explicit in CKAN record",official national open-data portal and national geospatial portal,Data.go.id title INDEKS_DEM_Nasional; notes say index is built from raster catalog of all DEMNAS data; resource text says Web Map Sevice Indeks DEM Nasional Indonesia Skala 1:50.000; organization Badan Informasi Geospasial; Ina-Geoportal download page alive.,portal/service/download,"1:50,000 index/service; DEMNAS raster catalog",5 Data.go.id resources; national raster catalog index,
Elevation · DEM,Korea NGII DEM 20240924,"National Geographic Information Institute (NGII), Ministry of Land, Infrastructure and Transport, Republic of Korea",National DEM file dataset,국토교통부 국토지리정보원_DEM_20240924; 공개 DEM; 수치표고모델,Republic of Korea,Data.go.kr portal policy license with 이용허락범위 제한 없음; free of charge,IMG file download via NGII map portal; Data.go.kr metadata distribution encodingFormat IMG,Data.go.kr official file-data record; distribution contentUrl points to NGII map portal total-search/download route,https://www.data.go.kr/data/15059920/fileData.do,yes,Data.go.kr dataset 15059920; dateCreated/datePublished 2024-09-24; dateModified 2025-06-17,published 2024-09-24; modified 2025-06-17,"Official Korean public-data record for NGII DEM. The page metadata identifies NGII as creator, IMG as distribution format, free-of-charge access, and unrestricted usage scope; the NGII map portal content URL may reject automated checks but is retained as the stated download route in the evidence rather than as the catalog landing URL.",dem-v022-official-asia-national-dem,韩国 NGII DEM 20240924 是韩国国土交通部国土지理정보원（NGII）通过 Data.go.kr 发布的公开 DEM 文件数据。记录显示数据格式为 IMG，费用为免费，利用许可范围为“限制 없음”，并给出 NGII 地图门户作为下载分发入口；自动验活采用稳定的 Data.go.kr 落地页。,"Korea NGII DEM 20240924 is an official public DEM file dataset from the National Geographic Information Institute under Korea’s Ministry of Land, Infrastructure and Transport. The Data.go.kr record identifies IMG as the distribution format, free-of-charge access, and an unrestricted usage scope, with the NGII map portal listed as the download route. The stable Data.go.kr landing page is used as the verified catalog URL.",open landing page; free file-data record; NGII portal route may require interactive access,free public-data portal record with unrestricted usage scope stated on Data.go.kr,official national public-data portal,Data.go.kr title 국토교통부 국토지리정보원_DEM_20240924; JSON-LD creator 국토교통부 국토지리정보원; dateCreated 2024-09-24; dateModified 2025-06-17; distribution encodingFormat IMG; page text 비용부과유무 무료 and 이용허락범위 제한 없음.,portal/download,national DEM file dataset; IMG distribution,file-data distribution record,
Elevation · DEM,TINITALY 1.1 10 m Digital Elevation Model of Italy,Istituto Nazionale di Geofisica e Vulcanologia (INGV),National high-resolution DEM,"TINITALY, digital elevation model of Italy with a 10 meters cell size, Version 1.1",Italy national territory,Creative Commons Attribution 4.0 International (CC BY 4.0) according to INGV/DataCite record for Version 1.1,GeoTIFF / TIFF tiles,"INGV dataset record, DOI landing page, and TINITALY download area",https://data.ingv.it/dataset/185,yes,"10.13127/tinitaly/1.1; Tarquini S., Isola I., Favalli M., Battistini A., Dotta G. (2023), TINITALY Version 1.1",Version 1.1 published 2023; TINITALY national DEM compilation,INGV dataset page documents TINITALY as a 10 m cell-size DEM of Italy and cites Version 1.1 DOI 10.13127/tinitaly/1.1. The dataset is arranged as square tiles and the INGV record lists tif/tiff as available data encoding formats; TINITALY download pages provide the data-access route.,dem-v023-europe-official-dem,TINITALY 1.1 是 INGV 发布的意大利全国 10 m 分辨率数字高程模型，适合地形、水文、地貌和环境分析。INGV 记录给出 Version 1.1 DOI、GeoTIFF/TIFF 编码格式以及 TINITALY 下载入口，并说明数据以 50 km 方形瓦片组织；许可按 INGV/DataCite 记录为 CC BY 4.0。,"TINITALY 1.1 is a 10 m cell-size digital elevation model of Italy published by INGV for terrain, hydrologic, geomorphologic, and environmental applications. The INGV record provides the Version 1.1 DOI, GeoTIFF/TIFF encoding formats, and the TINITALY download route, with the database organized as square tiles. The INGV/DataCite record lists the dataset under CC BY 4.0.",open,open with attribution under CC BY 4.0,official research-institute dataset record and DOI,"INGV data record title TINITALY, a digital elevation model of Italy with a 10 meters cell size; Version 1.1 DOI 10.13127/tinitaly/1.1; text says database arranged in 193 square tiles having 50 km side; available formats tif, tiff; TINITALY download area verified alive.",download/DOI,10 m cell size,193 square tiles,
Elevation · DEM,Digital Earth Australia Intertidal 2.1.0,Geoscience Australia / Digital Earth Australia,National coastal intertidal elevation model,DEA Intertidal ga_s2ls_intertidal_cyear_3; annual 10 m intertidal elevation and exposure product,"Australia exposed intertidal zone, approximately 112E-154E and 44S-9S",Creative Commons Attribution 4.0 International (CC BY 4.0),continental 10 m GeoTIFF layers; AWS cloud access; ELVIS download; NCI; WMS,"DEA Knowledge Hub product page, Geoscience Australia DEA Intertidal page, AWS streaming, ELVIS download, NCI access, WMS, code examples",https://knowledge.dea.ga.gov.au/data/product/dea-intertidal/,yes,"10.26186/149403; Bishop-Taylor, R., Phillips, C., Newey, V., Sagar, S. (2024). Digital Earth Australia Intertidal. Geoscience Australia, Canberra.",2016 to 2024 coverage in v2.1.0; annual updates ongoing; issued 2024 with April 2026 update noted on GA page,"Current DEA Intertidal product supersedes the older NIDEM concept. It provides annual continental-scale elevation, exposure, tidal-attribute, and quality layers for Australia's exposed intertidal zone using combined Sentinel-2 and Landsat DEA Collection 3 surface reflectance products. Files can be very large, so DEA recommends cloud streaming from AWS; ELVIS download, NCI, WMS, and examples are also advertised.",dem-v024-gee-dea-intertidal,Digital Earth Australia Intertidal 2.1.0 是 Geoscience Australia/DEA 发布的澳大利亚潮间带年度高程与暴露产品，利用 Sentinel-2 与 Landsat 数据生成 10 m 分辨率 GeoTIFF 图层。产品覆盖 2016-2024 年并持续年度更新，提供 AWS 云端流式访问、ELVIS 下载、NCI、WMS 和代码示例，许可为 CC BY 4.0。,"Digital Earth Australia Intertidal 2.1.0 is Geoscience Australia’s annual 10 m elevation and exposure product for Australia’s exposed intertidal zone. It combines Sentinel-2 and Landsat DEA Collection 3 data into continental GeoTIFF layers covering 2016-2024, with ongoing annual updates. Access routes include AWS cloud streaming, ELVIS download, NCI, WMS, and code examples under CC BY 4.0.",open,open with attribution under CC BY 4.0,official national product page and research-data record; GEE deprecated NIDEM used as discovery lead,"DEA Knowledge Hub says Version 2.1.0, derivative raster, 10 m resolution, 2016 to 2024 coverage, yearly ongoing updates, 4 core product layers plus tidal and QA layers as continental 10 m GeoTIFFs, AWS/ELVIS/NCI/WMS access, DOI 10.26186/149403, and CC BY 4.0; GA page notes annual update and last update April 2026.",download/cloud/WMS,10 m annual intertidal elevation layers,"15 bands: elevation, elevation_uncertainty, tidal attributes, and quality layers",up to 15 GB per large file according to DEA guidance
Elevation · DEM,Malta Digital Terrain Model 2018 1m,Malta Planning Authority / INSPIRE Geoportal,National high-resolution LiDAR DTM,Digital Terrain Model 2018; 1m resolution DTM covering the Maltese Islands,Maltese Islands,INSPIRE metadata states no limitations to public access and no conditions to access and use; Malta source portal should be checked for any additional national terms,INSPIRE/WCS coverage service; grid terrain-only DTM,INSPIRE Geoportal metadata and WCS GetCapabilities service; original Malta data.gov.mt/MSDI portal exists but is Cloudflare-blocked for automated checks,https://inspire-geoportal.ec.europa.eu/srv/api/records/ee525322-be6d-4577-b174-1aa415b2f661,yes,INSPIRE citation identifier https://malta.coverage.wetransform.eu/ee525322-be6d-4577-b174-1aa415b2f661; publication 2024-03-01; survey/creation 2018-02-17,airborne LiDAR survey on 2018-02-17; INSPIRE publication 2024-03-01,"INSPIRE record describes a terrain-only Digital Terrain Model in 1 m resolution covering the Maltese Islands, interpolated from the airborne LiDAR survey conducted as part of ERDF156 on 2018-02-17. The record provides a WCS GetCapabilities endpoint and states no public access limitations or access/use conditions. Original Malta data.gov.mt and MSDI URLs returned Cloudflare 403 to automated checks, so the INSPIRE record is used as canonical verified URL.",dem-v025-europe-insider-official-dem,Malta Digital Terrain Model 2018 是马耳他规划局通过 INSPIRE 体系发布的全国 1 m 分辨率地形-only DTM，覆盖马耳他群岛。元数据说明该产品由 2018 年 2 月 17 日 ERDF156 项目的航空 LiDAR 测量插值得到，并提供 WCS 服务入口；记录注明无公开访问限制和无访问/使用条件。,Malta Digital Terrain Model 2018 is a national 1 m terrain-only DTM for the Maltese Islands published through the INSPIRE infrastructure by the Malta Planning Authority. The metadata states that it was interpolated from an airborne LiDAR survey conducted for the ERDF156 project on 17 February 2018 and exposes a WCS access route. The INSPIRE record states no public-access limitations and no access/use conditions.,open verified metadata/service record; original national portal blocks automated checks,public INSPIRE access with no limitations/conditions stated in metadata,official INSPIRE metadata record and WCS service,"INSPIRE title Digital Terrain Model 2018; description says 1m resolution covering the Maltese Islands, terrain only, interpolated from airborne LIDAR survey conducted on 17th February 2018; Malta Planning Authority contact; WCS GetCapabilities endpoint; access constraints no limitations to public access; use constraints no conditions to access and use.",metadata/service/WCS,1 m resolution,national grid coverage,
Elevation · DEM,Slovakia LiDAR DMR v 5.0_SR 1m Digital Relief Model,"Geodetický a kartografický ústav Bratislava (GKÚ) / Úrad geodézie, kartografie a katastra SR",National high-resolution LiDAR DTM,LiDAR - DMR v 5.0_SR (S-JTSK JTSK03_Bpv); Digitálny model reliéfu DMR5.0,"Slovakia; metadata extent about 16.83E-22.57E, 47.73N-49.61N",CC BY 4.0 Creative Commons Attribution; metadata also states Žiadne obmedzenia (no restrictions),ESRI GRID raster at 1 x 1 m; x-ascii-grid; image/tiff; WMS view service,"GeoCloud/RPI metadata record, Slovak geoportal provision page, and ZBGIS DMR WMS service",https://data.geocloud.sk/gmd/c310bf1e-68a0-43b9-9955-c7dad13a93aa,yes,data.gov.sk/set/data/so/c310bf1e-68a0-43b9-9955-c7dad13a93aa; metadata revision 2025-04-01,aerial laser scanning 2017-11-13 to 2022-06-25; metadata revision 2025-04-01,"The Slovak DMR5.0 relief model is derived from classified airborne laser scanning point clouds using class 02 Relief/Ground. The GeoCloud XML states ESRI GRID output at 1 x 1 m resolution, x-ascii-grid and image/tiff distribution formats, a WMS view service, CC BY 4.0 attribution terms, and no restrictions.",dem-v025-europe-insider-official-dem,Slovakia LiDAR DMR v 5.0_SR 是斯洛伐克 GKÚ 发布的全国 1 m 数字地形/地貌模型，由航空激光扫描点云中 02 Relief/Ground 类插值得到。GeoCloud 元数据说明输出为 1 x 1 m ESRI GRID，并提供 x-ascii-grid、TIFF 和 WMS 服务，许可为 CC BY 4.0 且标注无使用限制。,"Slovakia LiDAR DMR v 5.0_SR is a national 1 m digital relief/terrain model published by GKÚ and derived from airborne laser scanning point clouds classified as class 02 Relief/Ground. The GeoCloud metadata states ESRI GRID output at 1 x 1 m resolution, x-ascii-grid and TIFF formats, a WMS view service, CC BY 4.0 attribution terms, and no restrictions.",open,open with attribution under CC BY 4.0,official national metadata XML and geoportal service record,GeoCloud XML title LiDAR - DMR v 5.0_SR; description says DMR5.0 was created from aerial laser scanning point clouds using class 02 Relief/Ground; output is ESRI GRID raster at 1 x 1 m; formats x-ascii-grid and image/tiff; WMS GetCapabilities URL; CC BY Creative Commons Attribution 4.0; Žiadne obmedzenia; scan dates 2017-11-13 to 2022-06-25.,metadata/download/service/WMS,1 x 1 m raster,national raster coverage,
