category,name,provider,theme_canonical,theme_raw,coverage,license,formats,access,url,verified_alive,doi_or_citation,time_span,notes,seen_in_passes,desc_zh,desc_en,access_status,openness,source_type,evidence,access_class,scale,feature_count,file_size
Elevation · DEM,Hamburg DGM1 Digital Terrain Model,"Freie und Hansestadt Hamburg, Landesbetrieb Geoinformation und Vermessung (LGV)",City-state 1 m digital terrain model,Digitales Höhenmodell Hamburg DGM 1,"Free and Hanseatic City of Hamburg, Germany",Datenlizenz Deutschland - Namensnennung - Version 2.0 (dl-de/by-2-0),ASCII XYZ ZIP full-city downloads; WMS GetCapabilities / map service; CKAN/DCAT metadata XML/JSON/RDF,"Hamburg Transparency Portal dataset page and CKAN API, DCAT/RDF XML metadata, WMS Digitales Höhenmodell Hamburg DGM 1, and daten-hamburg.de ZIP downloads",https://suche.transparenz.hamburg.de/dataset/digitales-hoehenmodell-hamburg-dgm-16,yes,Hamburg Transparency Portal package digitales-hoehenmodell-hamburg-dgm-16 / dataset ec21e503-6fa5-456f-bb57-3269b0d1faaf,"Dataset publication 2024-08-09; source data from Hamburg-wide 3D laser scan flights in 2010, 2020, and 2022, with point updates from photogrammetric products where documented","Accepted as a city-state 1 m bare-earth digital terrain/elevation model. The latest Hamburg Transparency Portal package supersedes older Hamburg DGM1 package variants from 2014/2016; those archived package URLs were used only as historical evidence and are not separate rows. The current CKAN package lists WMS GetCapabilities, full-city ASCII ZIP downloads for multiple years, and tile overview resources. The official description states that DGM1 is derived from airborne laser scanning or photogrammetric products, covers Hamburg with 1 m grid spacing, uses ETRS89_UTM32 position status 310 and heights over Normalhöhennull according to DE_DHHN2016_NH, and is licensed under DL-DE BY 2.0 with attribution to Hamburg LGV.",dem-v049-hamburg-dgm1-dtm,Hamburg DGM1 是德国汉堡市州 LGV 发布的 1 米数字地形/高程模型，覆盖自由汉萨城汉堡。数据由航空激光扫描或摄影测量产品派生，来源包括 2010、2020 和 2022 年全域 3D 激光扫描飞行；官方透明门户提供 CKAN 元数据、WMS 服务和全市 ASCII XYZ ZIP 下载，许可证为德国数据署名许可 DL-DE BY 2.0。,"Hamburg DGM1 is the 1 m digital terrain/elevation model published by Hamburg's Landesbetrieb Geoinformation und Vermessung for the Free and Hanseatic City of Hamburg. It is derived from airborne laser scanning or photogrammetric products, with source data from citywide 3D laser scan flights in 2010, 2020, and 2022. The Hamburg Transparency Portal provides CKAN/DCAT metadata, WMS access, and full-city ASCII XYZ ZIP downloads under the German DL-DE BY 2.0 attribution license.",open,"DL-DE BY 2.0 open data license with attribution to Freie und Hansestadt Hamburg, Landesbetrieb Geoinformation und Vermessung (LGV)","official city-state transparency/open-data portal, CKAN API, DCAT/RDF metadata, WMS service, and direct ZIP downloads","Hamburg Transparency Portal dataset `digitales-hoehenmodell-hamburg-dgm-16` and CKAN package_show identify `Digitales Höhenmodell Hamburg DGM 1`, license `Datenlizenz Deutschland - Namensnennung - 2.0`, provider LGV, WMS GetCapabilities `https://geodienste.hamburg.de/HH_WMS_DGM1?SERVICE=WMS&REQUEST=GetCapabilities`, and multiple full-city ASCII ZIP downloads. The dataset description states that it is a derived statewide/citywide digital terrain model with 1 m grid spacing for Hamburg, derived from Airborne Laserscanning or photogrammetric products, with source data from Hamburg-wide 3D laser scan flights in 2010, 2020, and 2022, ETRS89_UTM32, and DE_DHHN2016_NH heights over Normalhöhennull. XML/RDF metadata repeats WMS and ZIP resources.",download/service/WMS/ZIP/CKAN,1 m grid spacing,full Hamburg DGM1 tile/download collection; CKAN package lists 12 resources in the inspected current package,full-city ASCII ZIP downloads are multi-GB; inspected current package lists examples from about 2.1 GB to 3.2 GB
Elevation · DEM,Hamburg bDOM Image-Based Digital Surface Model,"Freie und Hansestadt Hamburg, Landesbetrieb Geoinformation und Vermessung (LGV)",City-state image-based digital surface model,Digitales Höhenmodell Hamburg - bDOM / bildbasiertes Digitales Oberflächenmodell,"Free and Hanseatic City of Hamburg, Germany, excluding the Hamburg Wadden Sea area according to the transparency portal description",Datenlizenz Deutschland - Namensnennung - Version 2.0 (dl-de/by-2-0),ASCII full-city downloads for 2018 and 2020; CKAN/DCAT metadata XML/JSON/RDF; MetaVer HTML metadata,"Hamburg Transparency Portal dataset page and CKAN API, DCAT/RDF XML metadata, archived ASCII download resources, and MetaVer metadata page",https://suche.transparenz.hamburg.de/dataset/digitales-hoehenmodell-hamburg-bdom,yes,Hamburg Transparency Portal package digitales-hoehenmodell-hamburg-bdom / dataset 59e8316a-2fce-44f9-89a9-6a35e7e2bb2a; older package digitales-hohenmodell-hamburg-bdom / dataset 66f003fa-e2b7-49c0-8a89-4c3f524a126b,Photogrammetric image flight reference: spring 2020; package publication 2021-11-26; resources include 2018 and 2020 bDOM ASCII downloads,"Hamburg bDOM is distinct from the v049 Hamburg DGM1 terrain model. DGM1 is a bare-earth terrain/elevation model, while bDOM is an image-based digital surface model that represents the earth surface and objects such as structures at the time of aerial-image acquisition. The transparency portal describes bDOM as derived by image correlation, usually Dense Image Matching, from oriented digital aerial images and as an intermediate product in the TrueDOP production process. The newer package `digitales-hoehenmodell-hamburg-bdom` is used as canonical; older spelling variant `digitales-hohenmodell-hamburg-bdom` was treated as a historical package variant for the same product. Although resource names contain `dom1_xyz`, the title and description identify the product as bDOM. Downloads are large ASCII resources, not WMS services in the inspected package.",dem-v050-hamburg-bdom-image-based-dsm,Hamburg bDOM 是汉堡 LGV 发布的图像相关数字表面模型，覆盖自由汉萨城汉堡（不含汉堡瓦登海区域）。它由定向数字航摄影像通过影像相关 / Dense Image Matching 推导，表达摄影测量飞行时刻的地表及建筑等对象，是 TrueDOP 生产流程中的中间产品；透明门户提供 2018 和 2020 年全市 ASCII 下载，许可证为 DL-DE BY 2.0。,"Hamburg bDOM is the image-based digital surface model published by Hamburg LGV for the Free and Hanseatic City of Hamburg, excluding the Hamburg Wadden Sea area. It is derived from oriented digital aerial imagery by image correlation, typically Dense Image Matching, and represents the earth surface plus objects such as structures at the time of aerial image acquisition. The Transparency Portal provides full-city ASCII downloads for 2018 and 2020 under the DL-DE BY 2.0 attribution license.",open,"DL-DE BY 2.0 open data license with attribution to Freie und Hansestadt Hamburg, Landesbetrieb Geoinformation und Vermessung (LGV)","official city-state transparency/open-data portal, CKAN API, DCAT/RDF metadata, direct archive downloads, and MetaVer metadata","Hamburg Transparency Portal package `digitales-hoehenmodell-hamburg-bdom` and CKAN package_show identify `Digitales Höhenmodell Hamburg - bDOM`, license `Datenlizenz Deutschland - Namensnennung - 2.0`, provider LGV, and resources `Download Digitales Höhenmodel Hamburg - bDOM, 2018` and `2020` in ASCII format. The description states that bDOM is a derived, area-wide digital surface model with 1 m grid spacing for Hamburg excluding the Wadden Sea, that it describes the earth surface and objects such as structures as regular georeferenced height points at the time of a photogrammetric image flight (spring 2020), and that it is generated by image correlation / Dense Image Matching from oriented digital aerial images. The portal page and XML metadata repeat ETRS89_UTM32 / EPSG:25832 and DE_DHHN2016_NH reference information plus DL-DE BY 2.0 licensing.",download/CKAN/ASCII/metadata,1 m grid spacing image-based DSM,full Hamburg bDOM ASCII surface-model downloads for 2018 and 2020 in the inspected package,approximately 3.3 GB for 2018 ASCII and 3.5 GB for 2020 ASCII
Elevation · DEM,Berlin ATKIS DGM1 Digital Terrain Model,"Senatsverwaltung für Stadtentwicklung, Bauen und Wohnen Berlin / GDI Berlin",City-state 1 m digital terrain model,ATKIS® DGM - Digitales Geländemodell / DGM1 Berlin,"Berlin, Germany, with approximately 250 m buffer into Brandenburg according to the official metadata",Datenlizenz Deutschland - Zero - Version 2.0 (dl-zero-de/2.0),ATOM download feed for DGM1 tile packages; WMS visualization service; PDF documentation; 2 km x 2 km sheet/tile structure,"Berlin.de product page, GDI Berlin CSW dataset record, GDI Berlin service metadata/API record, WMS GetCapabilities, ATOM download feed, and DGM1 PDF documentation",https://www.berlin.de/sen/stadt/stadtdaten/geoinformation/landesvermessung/geotopographie-atkis/dgm-digitale-gelaendemodelle/,yes,GDI Berlin CSW dataset f0e8ff09-2887-3446-9c53-81dbc45af03c; service record b0485f06-a39e-3cc2-b5e0-be7fcd425dab; ATOM feed fa02f9e1-a0df-3be1-b0aa-bc624c0c7ff5,"Source laser-scan acquisition in Q1 2021; updates by stereoscopic evaluation of image flights 03/2022, 04/2023, 03/2025, and 08/2025 according to CSW dataset record; ATOM feed updated 2025-12-18","Berlin DGM1 is a bare-earth digital terrain model, distinct from future Berlin DOM/bDOM surface-model candidates. Official metadata states that the DGM describes the earth surface without natural objects such as vegetation and artificial objects such as buildings. It is provided as a regular 1 m raster in 2 km x 2 km sheets, with an approximately 250 m buffer into Brandenburg. The Berlin.de page says the underlying height information was acquired by airborne laser scanning in the first quarter of 2021 and updated photogrammetrically. The CSW dataset record adds stereoscopic image-flight updates in 03/2022, 04/2023, 03/2025, and 08/2025. Use is governed by Datenlizenz Deutschland Zero 2.0.",dem-v051-berlin-atkis-dgm1-dtm,Berlin ATKIS DGM1 是德国柏林 GDI/Senatsverwaltung 发布的 1 米数字地形模型，表达不含植被、建筑等自然和人工对象的裸地地表。官方页面和 CSW 元数据说明数据以 2 km x 2 km 图幅组织，覆盖柏林并向勃兰登堡延伸约 250 米缓冲区，基础高程由 2021 年第一季度航空激光扫描获取，并通过 2022、2023、2025 年影像飞行立体测图更新；可通过 ATOM 下载和 WMS 服务访问，许可证为 DL-DE Zero 2.0。,"Berlin ATKIS DGM1 is the 1 m digital terrain model published by GDI Berlin / the Senate Department for Urban Development, Building and Housing. It represents the bare earth surface without natural objects such as vegetation or artificial objects such as buildings, organized in 2 km x 2 km sheets and extending about 250 m into Brandenburg. Official records describe airborne laser scanning acquisition in early 2021 and photogrammetric/stereoscopic updates from 2022, 2023, and 2025, with access through ATOM download and WMS services under DL-DE Zero 2.0.",open,DL-DE Zero 2.0; official metadata states no access restrictions and unrestricted use under the German Zero license,"official city-state product page, CSW catalogue records, ATOM download feed, WMS service, and PDF documentation","Berlin.de product page states ATKIS DGM contains height information as a 1 m regular raster, based on airborne laser scanning in Q1 2021 and photogrammetric updates, using ETRS89/UTM Zone 33N (EPSG:25833) and DHHN2016 (EPSG:7837), with DGM1 datasets in 2 km x 2 km sheets and an ATOM download service. GDI Berlin CSW dataset record `f0e8ff09-2887-3446-9c53-81dbc45af03c` states that DGM describes the earth surface without vegetation or buildings, has 1 m grid spacing in 2 km x 2 km sheet cuts, extends about 250 m into Brandenburg, and provides ATOM, WMS, PDF, and product-page links. WMS GetCapabilities and ATOM feed returned HTTP 200 and repeat DL-DE Zero 2.0 licensing.",download/service/ATOM/WMS/PDF,1 m grid spacing; 2 km x 2 km sheets,"Berlin DGM1 tile collection via ATOM feed, with WMS layers for DGM, shaded relief, and contours",
Elevation · DEM,Berlin ATKIS DOM1 Digital Surface Model,"Senatsverwaltung für Stadtentwicklung, Bauen und Wohnen Berlin / GDI Berlin",City-state 1 m airborne-laserscanning digital surface model,DOM - Digitales Oberflächenmodell / DOM1 Berlin,"Berlin, Germany, with approximately 250 m buffer into Brandenburg according to official metadata",Datenlizenz Deutschland - Zero - Version 2.0 (dl-zero-de/2.0),ATOM download feed for DOM tile packages; WMS visualization/service access including image and GetFeatureInfo formats; PDF documentation; 2 km x 2 km sheet/tile structure,"Berlin.de product page, GDI Berlin CSW/API dataset record, WMS GetCapabilities, ATOM download feed, and DOM1 PDF documentation",https://www.berlin.de/sen/stadt/stadtdaten/geoinformation/landesvermessung/geotopographie-atkis/dom-digitales-oberflaechenmodell/,yes,GDI Berlin CSW/API dataset ffa05de2-fd1e-4b70-b5b2-3e53e52f47ea; WMS service record b0e8e83e-e61a-3a37-8515-f6205c2bfe92; ATOM feed registry links under gdi.berlin.de/data/dom/atom/,"Airborne laser-scanning flights on 2021-02-24, 2021-02-25, and 2021-03-02 according to CSW source metadata; ATOM feed updated 2025-08-07; metadata date 2026-04-23","Berlin DOM1 is a digital surface model and is distinct from the v051 Berlin DGM1 bare-earth terrain model. The CSW abstract and WMS capabilities state that DOM represents the earth surface together with natural objects such as vegetation and artificial objects such as buildings. It is organized as a 1 m regular raster in 2 km x 2 km sheets and extends about 250 m into Brandenburg. Official CSW metadata gives the source airborne laser-scanning flight dates as 24 February 2021, 25 February 2021, and 2 March 2021. Use is governed by Datenlizenz Deutschland Zero 2.0.",dem-v052-berlin-dom1-and-bdom-surface-models,Berlin ATKIS DOM1 是德国柏林 GDI/Senatsverwaltung 发布的 1 米数字表面模型，表达地表及植被、建筑等自然和人工对象的高程。官方 CSW、ATOM 和 WMS 元数据说明数据按 2 km x 2 km 图幅组织，覆盖柏林并向勃兰登堡延伸约 250 米缓冲区，来源为空中激光扫描飞行（2021 年 2 月 24/25 日和 3 月 2 日）；可通过 ATOM 下载和 WMS 服务访问，许可证为 DL-DE Zero 2.0。,"Berlin ATKIS DOM1 is the 1 m digital surface model published by GDI Berlin / the Senate Department for Urban Development, Building and Housing. Unlike the bare-earth DGM1, it represents the earth surface together with natural objects such as vegetation and artificial objects such as buildings. Official CSW, ATOM, and WMS records describe 2 km x 2 km sheets covering Berlin with an approximately 250 m buffer into Brandenburg, sourced from airborne laser-scanning flights in February and March 2021, with ATOM download and WMS service access under DL-DE Zero 2.0.",open,DL-DE Zero 2.0; official metadata states no access restrictions and unrestricted use under the German Zero license,"official city-state product page, CSW/API catalogue record, ATOM download feed, WMS service, and PDF documentation","Berlin.de product page identifies the DOM as the official digital surface model from airborne laser scanning. GDI Berlin CSW/API dataset record `ffa05de2-fd1e-4b70-b5b2-3e53e52f47ea` states that the DOM describes the earth surface with all natural objects such as vegetation and artificial objects such as structures, has 1 m grid spacing in 2 km x 2 km sheets, extends about 250 m into Brandenburg, and links ATOM download, WMS, PDF, preview, and product-page resources. The CSW source field records airborne laser-scanning flights on 2021-02-24, 2021-02-25, and 2021-03-02. WMS GetCapabilities repeats the same abstract, DL-DE Zero 2.0 license, no access restrictions, and service formats; the ATOM feed repeats the license and download-route metadata.",download/service/ATOM/WMS/PDF,1 m grid spacing; 2 km x 2 km sheets,"Berlin DOM1 tile collection via ATOM feed, with WMS layers for DOM rendering and related derived views",
Elevation · DEM,Berlin bDOM Image-Based Digital Surface Model,"Senatsverwaltung für Stadtentwicklung, Bauen und Wohnen Berlin / GDI Berlin",City-state 1 m image-based digital surface model,bDOM - bildbasiertes Digitales Oberflächenmodell,"Berlin, Germany, according to official GDI Berlin metadata bounding box",Datenlizenz Deutschland - Zero - Version 2.0 (dl-zero-de/2.0),ATOM download feed for bDOM tile packages; WMS visualization/service access including image and GetFeatureInfo formats; PDF documentation; 2 km x 2 km sheet/tile structure,"Berlin.de product page, GDI Berlin CSW/API dataset record, GDI Berlin service metadata/API record, WMS GetCapabilities, ATOM download feed, and bDOM documentation PDF",https://www.berlin.de/sen/stadt/stadtdaten/geoinformation/landesvermessung/geotopographie-atkis/bdom-digitales-bildbasiertes-oberflaechenmodell/,yes,GDI Berlin CSW/API dataset c1eac52b-cc96-404e-9584-82e8c064d7d8; service record 967420e0-3ac3-3caf-8421-bf0a2ecc544d; ATOM feed entry 1bc23b5c-acc8-3132-ba2e-e22f1be03206,"Generated from aerial-image data acquired on 2026-03-05, 2026-03-06, and 2026-03-09 according to CSW metadata; ATOM feed updated 2026-05-27; dataset metadata date 2026-06-01","Berlin bDOM is distinct from both the v051 Berlin DGM1 bare-earth terrain model and the v052 DOM1 airborne-laserscanning surface model. The official metadata defines bDOM as an image-based digital surface model representing the earth surface with natural and artificial objects in a regular 1 m raster and 2 km x 2 km sheet cuts. The CSW source field states that the current bDOM was generated from aerial-image data acquired on 5, 6, and 9 March 2026. Official access routes include ATOM download, WMS service, API/CSW records, PDF documentation, and the Berlin.de product page; use is governed by Datenlizenz Deutschland Zero 2.0.",dem-v052-berlin-dom1-and-bdom-surface-models,Berlin bDOM 是柏林 GDI/Senatsverwaltung 发布的 1 米图像基数字表面模型，表达地表及植被、建筑等自然和人工对象的高程。它与 DGM1 裸地模型和激光雷达 DOM1 不同，官方 CSW 元数据说明当前 bDOM 由 2026 年 3 月 5、6、9 日航摄影像数据生成，按 2 km x 2 km 图幅组织；可通过 ATOM 下载、WMS、CSW/API 和文档页面访问，许可证为 DL-DE Zero 2.0。,"Berlin bDOM is the 1 m image-based digital surface model published by GDI Berlin / the Senate Department for Urban Development, Building and Housing. It represents the earth surface together with natural and artificial objects, but is separate from the bare-earth DGM1 and the airborne-laserscanning DOM1 product. Official CSW metadata states that the current bDOM was generated from aerial-image data acquired on 5, 6, and 9 March 2026, organized in 2 km x 2 km sheets with ATOM download, WMS, CSW/API, and documentation access under DL-DE Zero 2.0.",open,DL-DE Zero 2.0; official metadata states no access restrictions and unrestricted use under the German Zero license,"official city-state product page, CSW/API catalogue records, ATOM download feed, WMS service, and PDF documentation","GDI Berlin CSW/API dataset record `c1eac52b-cc96-404e-9584-82e8c064d7d8` identifies `bDOM - bildbasiertes Digitales Oberflächenmodell`, states that it describes the earth surface with natural objects such as vegetation and artificial objects such as structures, provides a 1 m regular raster in 2 km x 2 km sheets, and links ATOM, WMS, PDF, product-page, and preview resources. The source field states that bDOM was generated from aerial-image data from flights on 2026-03-05, 2026-03-06, and 2026-03-09. The bDOM ATOM feed repeats DL-DE Zero 2.0 licensing and the download route; WMS GetCapabilities and service record `967420e0-3ac3-3caf-8421-bf0a2ecc544d` repeat the title, abstract, provider, CRS EPSG:25833, service formats, and no-access-restriction statement.",download/service/ATOM/WMS/PDF,1 m grid spacing; 2 km x 2 km sheets,"Berlin bDOM tile collection via ATOM feed, with WMS layers for bDOM rendering and related derived views",
Elevation · DEM,Brandenburg BB-BE DGM 1m Digital Terrain Model,Landesvermessung und Geobasisinformation Brandenburg (LGB) / GeoBasis-DE,State 1 m digital terrain model with download and OGC services,Digitales Geländemodell / BB-BE DGM 1m,"Brandenburg, Germany, with Berlin included in the BB-BE service footprint according to WMS/WCS metadata",Datenlizenz Deutschland - Namensnennung - Version 2.0 (dl-de/by-2-0),GeoTIFF tile downloads; XYZ tile downloads; WMS cached map service; WMTS cached map service; WCS coverage service with GeoTIFF/image formats; REST elevation API JSON/OpenAPI,"LGB product information page, GeoBroker product metadata, open download directory with GeoTIFF and XYZ subdirectories, WMS/WMTS/WCS services, and REST elevation API specification",https://geobroker.geobasis-bb.de/gbss.php?MODE=GetProductInformation&PRODUCTID=518094b9-d294-4e99-aeb2-550592a00682,yes,GeoBroker product 518094b9-d294-4e99-aeb2-550592a00682; WMS/WCS BB-BE DGM 1m services; LGB open-data download directory data.geobasis-bb.de/geobasis/daten/dgm/,Open download directory last-modified marker 2026-06-02 for tif/xyz directories; WMS/WCS describe current BB-BE DGM 1m service; acquisition/update recency varies by tile and is documented through LGB actuality maps/PDFs linked from the download page,"Accepted as the Brandenburg/LGB 1 m digital terrain model collection. The LGB download directory states that the Digitales Geländemodell single tiles are statewide and licensed under DL-DE BY 2.0 with provider GeoBasis-DE/LGB; it links GeoBroker metadata, product information, tile overview, laser-scan actuality, photogrammetric post-processing actuality, and Geoportal Brandenburg metadata. WMS and WCS capabilities describe BB-BE DGM 1m as a digital terrain model with 1 m ground resolution for Brandenburg with Berlin. This row is distinct from the Berlin DGM1/DOM1/bDOM rows because its canonical provider and distribution are Brandenburg LGB/GeoBasis-DE and because BB-BE service attribution requires adding Geoportal Berlin attribution when Berlin data are used.",dem-v053-brandenburg-bb-be-dgm-1m,Brandenburg BB-BE DGM 1m 是德国勃兰登堡州测绘与地理基础信息局（LGB/GeoBasis-DE）发布的 1 米数字地形模型集合。官方开放目录提供 GeoTIFF 和 XYZ 单瓦片下载，WMS/WMTS/WCS 服务和 REST 高程 API 提供服务化访问；WMS/WCS 元数据说明覆盖勃兰登堡并包含柏林区域，使用 DL-DE BY 2.0 署名许可。,"Brandenburg BB-BE DGM 1m is the 1 m digital terrain model collection published by Landesvermessung und Geobasisinformation Brandenburg (LGB / GeoBasis-DE). The official open-data directory provides GeoTIFF and XYZ tile downloads, while WMS, WMTS, WCS, and a REST elevation API provide service access. WMS/WCS metadata describe the product as a 1 m DGM for Brandenburg with Berlin included in the service footprint, licensed under DL-DE BY 2.0 attribution terms.",open,"DL-DE BY 2.0 open data license with attribution to GeoBasis-DE/LGB; service metadata notes that when Berlin data are used, attribution should also include Geoportal Berlin under dl-de/by-2-0","official state mapping-agency product metadata, GeoBroker product record, open download directory, OGC WMS/WMTS/WCS services, and REST elevation API","The LGB open download directory `https://data.geobasis-bb.de/geobasis/daten/dgm/` identifies `Digitales Geländemodell` single tiles statewide, DL-DE BY 2.0 licensing, provider GeoBasis-DE/LGB, and `tif/` plus `xyz/` subdirectories. GeoBroker product metadata uses product ID `518094b9-d294-4e99-aeb2-550592a00682`. WCS GetCapabilities states `BB DGM 1m`, describes a digital terrain model with 1 m ground resolution for Brandenburg with Berlin, lists WCS versions 2.0.1/1.1.1/1.0.0, GeoTIFF and image formats, EPSG:25833/25832/4326 and other CRS support, and DL-DE BY 2.0 attribution terms. WMS GetCapabilities describes `WMS BB-BE DGM 1m Cache` as a cached map service based on the 1 m laser-scan digital terrain model for Brandenburg with Berlin and repeats provider, licensing, and attribution requirements. The REST elevation API specification states that it returns interpolated elevation data for geospatial features.",download/service/GeoTIFF/XYZ/WMS/WMTS/WCS/REST,1 m ground resolution,statewide single-tile DGM collection with GeoTIFF and XYZ directories; BB-BE WMS/WCS/WMTS service layers for DGM and hillshade,
