category,name,provider,theme_canonical,theme_raw,coverage,license,formats,access,url,verified_alive,doi_or_citation,time_span,notes,seen_in_passes,desc_zh,desc_en,access_status,openness,source_type,evidence,access_class,scale,feature_count,file_size
Elevation · DEM,HDMA North America Digital Elevation Model,USGS / Hydrologic Derivatives for Modeling and Applications project,Continental hydrologic DEM,HDMA North America DEM,North America,U.S. public domain,raster grids and USGS data release files,USGS ScienceBase/data catalog download,https://data.usgs.gov/datacatalog/data/USGS%3A591b53d4e4b0a7fdb43c8d20,yes,USGS HDMA North America DEM data release citation,continental hydrologic derivatives data release,"Accepted as a hydrologic modelling DEM/data release product, distinct from general-purpose USGS 3DEP DEMs.",dem-v003-hydrology-literature,HDMA North America DEM 是 USGS Hydrologic Derivatives for Modeling and Applications 项目中的北美数字高程模型数据发布。它面向水文建模和派生地形分析，与一般 3DEP 高程产品用途不同，适合作为大陆尺度水文 DEM 记录。,"The HDMA North America DEM is a USGS data-release product from the Hydrologic Derivatives for Modeling and Applications project. It is designed for hydrologic modelling and derived terrain analysis rather than as a general 3DEP elevation product, making it a distinct continental hydrologic DEM record.",open,public domain,official USGS data catalog/data release,USGS data catalog HDMA North America DEM record,download,continental hydrologic DEM grid,North America raster coverage,
Elevation · DEM,HDMA South America Digital Elevation Model,USGS / Hydrologic Derivatives for Modeling and Applications project,Continental hydrologic DEM,HDMA South America DEM,South America,U.S. public domain,raster grids and USGS data release files,USGS ScienceBase/data catalog download,https://data.usgs.gov/datacatalog/data/USGS%3A5920dd83e4b0ac16dbdf3a4d,yes,USGS HDMA South America DEM data release citation,continental hydrologic derivatives data release,Accepted separately from ANADEM because this is a USGS HDMA data-release product with different lineage and hydrologic derivative context.,dem-v003-hydrology-literature,HDMA South America DEM 是 USGS HDMA 项目的南美数字高程模型数据发布，用于大陆尺度水文建模和地形派生分析。它与 ANADEM 同属南美水文地形方向，但数据发布机构、处理体系和引用路径不同。,"The HDMA South America DEM is a USGS HDMA data-release product for continental-scale hydrologic modelling and terrain derivative analysis. It is related in theme to ANADEM but has a different publication lineage, processing context, and official citation path, so it is kept as a separate canonical row.",open,public domain,official USGS data catalog/data release,USGS data catalog HDMA South America DEM record,download,continental hydrologic DEM grid,South America raster coverage,
Elevation · DEM,Ireland Open Topographic LiDAR Data,Geological Survey Ireland / Government of Ireland,National/regional lidar DTM,Open Topographic LiDAR Data,Ireland,Creative Commons Attribution 4.0 International / Government of Ireland open data terms,"LAS/LAZ point cloud, DTM/DSM rasters and derivatives depending on survey package",data.gov.ie dataset record and GeoHive LiDAR access routes,https://data.gov.ie/dataset/open-topographic-lidar-data,yes,Government of Ireland Open Topographic LiDAR Data dataset record,multiple open topographic lidar survey collections,"Accepted as Ireland collection-level open lidar/elevation record; GeoHive LiDAR page is a supporting access route, not a separate row in v004.",dem-v004-europe-official,Ireland Open Topographic LiDAR Data 是爱尔兰政府开放数据门户中的地形激光雷达数据集合，包含点云以及可用于 DEM/DTM/DSM 的高程产品和派生资料。它是爱尔兰开放高分辨率地形数据的重要入口，适合洪水、地貌、基础设施、生态和三维应用。,"Ireland Open Topographic LiDAR Data is a Government of Ireland open-data collection for topographic lidar holdings, including point clouds and elevation products or derivatives usable for DEM, DTM, and DSM workflows. It is a key open high-resolution terrain entry point for Ireland, supporting flood, geomorphology, infrastructure, ecology, and 3D applications.",open,open under Irish open data/CC BY style terms,official government open data record,data.gov.ie Open Topographic LiDAR Data record; GeoHive LiDAR support page,download/portal,survey-dependent high-resolution lidar products,Ireland lidar/elevation collections,
Elevation · DEM,Northern Ireland OSNI Open Data 10m Digital Terrain Model,Ordnance Survey of Northern Ireland / Department of Finance Northern Ireland,National/regional DEM,10m Digital Terrain Model height data,Northern Ireland,Open Government Licence / OSNI Open Data terms,grid/raster download products,nidirect OSNI open data download guidance,https://www.nidirect.gov.uk/articles/10m-digital-terrain-model-height-data,yes,OSNI Open Data 10m DTM product guidance,OSNI open data terrain product,Official 10 m DTM for Northern Ireland; kept separate from England/Scotland/Wales lidar entries because provider and product boundary differ.,dem-v004-uk-ireland,Northern Ireland OSNI Open Data 10m DTM 是北爱尔兰官方开放数据中的 10 m 数字地形模型产品。它为北爱尔兰地形制图、水文、规划、环境分析和基础地理应用提供稳定的开放高程数据。,"The Northern Ireland OSNI Open Data 10m DTM is the official 10 m digital terrain model product available through Northern Ireland open-data routes. It provides stable open elevation data for terrain mapping, hydrology, planning, environmental analysis, and base geographic applications across Northern Ireland.",open,open under OGL/OSNI Open Data terms,official government product guidance,nidirect 10m Digital Terrain Model height data page,download,10 m,Northern Ireland raster terrain model,
Elevation · DEM,Portugal Continental LiDAR Digital Terrain and Surface Models,Direcao-Geral do Territorio Portugal,National high-resolution DEM/DSM,Modelos Digitais LiDAR MDT/MDS Portugal Continental,Mainland Portugal,Portuguese open geodata terms / DGT access terms,GeoTIFF digital terrain and surface models,DGT digital models and LiDAR project pages,https://www.dgterritorio.gov.pt/atividades/cartografia/cartografia-topografica/modelos-digitais,yes,DGT Modelos Digitais / LiDAR Portugal Continental documentation,mainland Portugal LiDAR-derived digital model releases,Official DGT page states LiDAR-derived digital terrain and surface models with 0.5 m and 2 m products; accepted as national high-resolution DEM/DSM family.,dem-v004-europe-official,葡萄牙 DGT 的数字模型页面提供葡萄牙大陆基于 LiDAR 的数字地形模型和数字表面模型，包含 GeoTIFF 等栅格产品。它是葡萄牙高分辨率开放地形和表面高程数据的官方入口，可用于洪水、城市、海岸、工程和三维分析。,"Portugal’s DGT digital models page provides LiDAR-derived digital terrain and digital surface models for mainland Portugal, including GeoTIFF raster products. It is the official entry point for high-resolution Portuguese terrain and surface elevation data and supports flood, urban, coastal, engineering, and 3D workflows.",open,open/available under DGT Portuguese geodata terms,official national mapping agency product page,DGT Modelos Digitais page and LiDAR Portugal Continental documentation,download,0.5 m and 2 m LiDAR-derived products,Mainland Portugal raster coverage,
Elevation · DEM,Poland Digital Elevation Model (DEM),Head Office of Geodesy and Cartography Poland / Geoportal.gov.pl,National DEM,Digital Elevation Model DEM Poland,Poland,Polish open geodata/public data terms,raster grids and geoportal download/services,Geoportal.gov.pl DEM product page and map download services,https://www.geoportal.gov.pl/en/data/digital-elevation-model-dem/,yes,Geoportal.gov.pl Digital Elevation Model documentation,national DEM products with ongoing updates,Official Polish DEM entry point; lidar point cloud source products are adjacent and should be catalogued separately only when they expose DEM/DTM products.,dem-v004-europe-official,Poland Digital Elevation Model 是波兰国家 Geoportal.gov.pl 提供的官方数字高程模型入口。它为波兰全国地形、水文、规划、环境和基础制图提供开放或公共访问的高程数据和服务。,"Poland’s Digital Elevation Model page on Geoportal.gov.pl is the official national entry point for DEM data. It provides public/open access routes for Polish terrain, hydrology, planning, environmental, and base mapping workflows. Lidar source data are adjacent and should be split only where DEM/DTM product boundaries are clear.",open,open/public under Polish geodata terms,official national geoportal product page,Geoportal.gov.pl Digital Elevation Model page,download/service,national DEM products at portal-specified resolutions,Poland raster coverage,
Elevation · DEM,Czech Republic DMR 5G Digital Terrain Model,"Czech Office for Surveying, Mapping and Cadastre",National high-resolution DEM,Digital Terrain Model of the Czech Republic 5th generation / DMR 5G,Czech Republic,CUZK open/public geodata terms; service and download terms apply,"grid/raster model, services and metadata routes",CUZK geoportal metadata and services,https://geoportal.cuzk.cz/Default.aspx?lng=EN&mode=TextMeta&side=vyskopis&metadataID=CZ-CUZK-DMR5G-ETRS89-V&mapid=8&menu=301,yes,CUZK DMR 5G metadata record,5th generation national digital terrain model,Accepted as official national DTM product with stable CUZK metadata URL; exact download mechanics and licensing should be enriched later.,dem-v004-europe-official,Czech Republic DMR 5G 是捷克测绘与地籍机构发布的第五代国家数字地形模型，提供高精度地形表达和官方元数据服务。它适合捷克地形制图、水文、工程、规划和环境分析。,"The Czech Republic DMR 5G is the fifth-generation national digital terrain model published through the Czech surveying and cadastral geoportal. It provides official high-quality terrain representation and metadata/service access for mapping, hydrology, engineering, planning, and environmental analysis.",open/public access,public/open access under CUZK terms,official national geoportal metadata record,CUZK DMR 5G metadata record,service/metadata/download,national high-resolution DTM,Czech Republic terrain model coverage,
Elevation · DEM,EuroDEM Pan-European Digital Elevation Model,EuroGeographics / Maps for Europe,Regional DEM,EuroDEM,pan-European coverage,open data terms through Maps for Europe / EuroGeographics,raster grid downloads through Maps for Europe,Maps for Europe dataset portal,https://www.mapsforeurope.org/datasets/euro-dem,yes,EuroGeographics EuroDEM / Maps for Europe dataset citation,pan-European DEM product release through Maps for Europe,Accepted separately from EU-DEM because EuroDEM is a EuroGeographics/Maps for Europe product line with different provider and distribution route.,dem-v004-europe-regional,EuroDEM 是 EuroGeographics/Maps for Europe 发布的泛欧洲数字高程模型产品。它与 Copernicus EU-DEM 来源和分发体系不同，可作为欧洲尺度地形分析、跨境制图和区域模型的另一个开放 DEM 入口。,"EuroDEM is a pan-European digital elevation model distributed through EuroGeographics and Maps for Europe. It has a different provider and distribution route from Copernicus EU-DEM, making it a separate open DEM entry for European-scale terrain analysis, cross-border mapping, and regional modelling.",open,open through Maps for Europe terms,official pan-European dataset portal,Maps for Europe EuroDEM dataset page,download/portal,pan-European DEM grid,Europe raster coverage,
Elevation · DEM,Latvia Digital Height Models,Latvian Geospatial Information Agency,National DEM/DSM,Digital height models of Latvia,Latvia,Latvian public geodata/open data terms,raster height models and related downloads/services,LGIA digital height models page,https://www.lgia.gov.lv/en/digital-height-models-0,yes,Latvian Geospatial Information Agency digital height models documentation,national digital height model products with updates,Official Latvian elevation product family; later split DTM/DSM/resolution variants if direct product pages are stable.,dem-v004-europe-official,Latvia Digital Height Models 是拉脱维亚地理空间信息局发布的官方高程模型产品族，覆盖拉脱维亚并提供数字高度模型相关数据。它适合波罗的海地区地形、水文、林业、基础设施和制图应用。,"Latvia Digital Height Models are the official elevation model products published by the Latvian Geospatial Information Agency. They cover Latvia and provide national height-model data for Baltic terrain, hydrology, forestry, infrastructure, and mapping applications. Later phases can split DTM, DSM, and resolution variants if stable product pages are available.",open/public access,open/public under Latvian geodata terms,official national geospatial agency product page,LGIA Digital Height Models page,download/service,national digital height model products,Latvia raster coverage,
Elevation · DEM,Lithuania GDR50LT Georeferenced Spatial Dataset with Relief Data,National Land Service / Lithuanian Spatial Information Portal,National georeferenced relief/elevation dataset,GDR50LT georeferenced public dataset relief/elevation content,Lithuania,Lithuanian open/public geodata terms,georeferenced dataset layers and portal services/downloads,Lithuanian geoportal dataset page,https://www.geoportal.lt/geoportal/web/georeferenced-public-datasets-of-the-republic-of-lithuania/gdr50lt,yes,Lithuanian geoportal GDR50LT dataset record,national georeferenced dataset release/update cycle,Accepted as an elevation/relief-related national georeferenced dataset rather than a pure DEM. A later Lithuania phase should find a stricter DTM/DEM product if available.,dem-v004-europe-official,Lithuania GDR50LT 是立陶宛空间信息门户中的国家地理参考数据集，包含与地形/起伏表达相关的高程或 relief 信息。它不是最纯粹的 DEM 产品，因此在目录中标注为 relief/elevation 相关入口；后续应继续寻找更严格的立陶宛 DTM/DEM 产品页。,"Lithuania GDR50LT is a national georeferenced public dataset exposed through the Lithuanian spatial information portal and includes relief/elevation-related content. It is not treated as a pure DEM product, so it is flagged as a relief/elevation-related national entry. A later Lithuania-focused phase should seek a stricter DTM/DEM product page if available.",open/public access,open/public under Lithuanian geodata terms,official national spatial data portal record,Lithuanian geoportal GDR50LT dataset page,download/service/portal,national georeferenced dataset scale,Lithuania georeferenced relief/elevation coverage,
Elevation · DEM,Spain MDT05 Digital Terrain Model,Instituto Geografico Nacional / CNIG Spain,National DEM,Modelo Digital del Terreno MDT05,Spain,Spanish open geodata terms / CC BY compatible terms,raster/grid downloads through CNIG and European data portal routes,data.europa.eu metadata and CNIG download route,https://data.europa.eu/data/datasets/spaignmdt05?locale=en,yes,CNIG/IGN Spain MDT05 dataset record,national 5 m terrain model release/update cycle,"Accepted as a distinct Spain 5 m DTM product, not a duplicate of MDT02. A later Spain phase should normalize all CNIG MDT02/MDT05/MDT25 direct CNIG URLs.",dem-v004-europe-official,Spain MDT05 是西班牙 IGN/CNIG 的 5 m 数字地形模型产品，与 v002 已收录的 MDT02 是不同分辨率产品。它适合全国范围地形、水文、规划、环境和中高分辨率制图，后续可继续补充 MDT25 和直接 CNIG 链接。,"Spain MDT05 is the 5 m digital terrain model product from Spain’s IGN/CNIG and is distinct from the MDT02 2 m product already catalogued. It supports national terrain, hydrology, planning, environmental, and medium-to-high-resolution mapping workflows. A later Spain phase should normalize direct CNIG URLs for MDT02, MDT05, and MDT25.",open,open under Spanish open geodata terms,official/European open data metadata record,data.europa.eu MDT05 record and CNIG/IGN product lineage,download/metadata,5 m,Spain raster coverage,
Elevation · DEM,Taiwan HyDEM Digital Elevation Model,"National Land Surveying and Mapping Center, Taiwan",National DEM,HyDEM / Taiwan digital elevation model,Taiwan,Taiwan government/open geodata terms via NLSC access routes,raster DEM products and services described by NLSC,NLSC HyDEM product page and government geospatial services,https://www.nlsc.gov.tw/EN/cp.aspx?n=20393,yes,NLSC HyDEM product documentation,national DEM product/service release maintained by NLSC,Accepted after earlier data.gov.tw DEM records repeatedly timed out under lychee. NLSC HyDEM page is the stable canonical route for v005.,dem-v005-asia-pacific,Taiwan HyDEM 是台湾内政部国土测绘中心提供的数字高程模型/高程服务入口，用于台湾地形、水文、防灾、规划和基础地理应用。本轮使用 NLSC 官方 HyDEM 页面作为稳定入口，替代此前 lychee 超时的 data.gov.tw 记录。,"Taiwan HyDEM is a digital elevation model and elevation-service entry from Taiwan’s National Land Surveying and Mapping Center. It supports terrain, hydrology, disaster-risk, planning, and base geospatial applications across Taiwan. This v005 record uses the stable NLSC HyDEM page rather than the data.gov.tw records that timed out under lychee.",open/public access,public/open under Taiwan government geodata terms,official national mapping agency product page,NLSC HyDEM product page,service/download,national DEM products/services,Taiwan raster/service coverage,
Elevation · DEM,India CartoDEM from Cartosat-1,Indian Space Research Organisation / NRSC / Government of India,National optical stereo DEM,Digital Elevation Model generated from Cartosat-1 satellite data,India,Government of India open data terms / Bhuvan and data.gov.in terms,raster DEM products through Bhuvan/data.gov.in routes,data.gov.in metadata and Bhuvan data access,https://data.gov.in/catalog/digital-elevation-model-dem-generated-cartosat-1-satellite-data-india,yes,Government of India data.gov.in Cartosat-1 DEM catalogue record,Cartosat-1 stereo-derived national DEM release,Accepted as India national optical-stereo DEM entry; Bhuvan is supporting access but data.gov.in is the cleaner metadata URL for v005.,dem-v005-asia-pacific,India CartoDEM 是基于 Cartosat-1 立体卫星数据生成的印度数字高程模型，由印度政府/NRSC 相关平台提供。它是印度国家尺度地形、遥感校正、水文、规划和环境分析的重要 DEM 来源，Bhuvan 可作为数据访问线索。,"India CartoDEM is a national digital elevation model generated from Cartosat-1 stereo satellite data and exposed through Government of India/NRSC data routes. It is an important DEM source for Indian terrain analysis, remote-sensing preprocessing, hydrology, planning, and environmental applications, with Bhuvan serving as a supporting access path.",open/public access,public/open under Government of India data terms,official government data catalogue and Bhuvan access route,data.gov.in Cartosat-1 DEM catalogue record; Bhuvan data access lead,download/portal,national CartoDEM products,India raster DEM coverage,
Elevation · DEM,USGS 3DEP 1/3 Arc-Second DEM,USGS National Geospatial Program,National DEM,USGS 3DEP 1/3 arc-second DEM,United States and territories where available,U.S. public domain,"GeoTIFF, Cloud Optimized GeoTIFF, The National Map services",USGS data catalog and National Map download/services,https://data.usgs.gov/datacatalog/data/USGS%3A3a81321b-c153-416f-98b7-cc8e5f0e17c3,yes,USGS 3DEP 1/3 Arc-Second DEM data catalog record,continuously maintained 3DEP DEM collection,"Product-level split from the grouped 3DEP row, focused on the common 1/3 arc-second national DEM collection.",dem-v005-usgs-product-splits,USGS 3DEP 1/3 Arc-Second DEM 是美国 3DEP 中最常用的全国尺度 DEM 产品之一，分辨率约 10 m。它通过 USGS 数据目录和 The National Map 下载/服务体系开放，适合水文、地形、环境、制图和模型预处理。,"The USGS 3DEP 1/3 Arc-Second DEM is one of the most commonly used national-scale DEM products in the 3DEP family, with roughly 10 m resolution. It is distributed through the USGS data catalog and The National Map download/service ecosystem for hydrology, terrain, environmental, mapping, and model-preprocessing workflows.",open,public domain,official USGS data catalog record,USGS data catalog 1/3 Arc-Second DEM record,download/service/cloud,1/3 arc-second / about 10 m,U.S. national DEM collection,
Elevation · DEM,USGS 3DEP 1 Arc-Second DEM,USGS National Geospatial Program,National DEM,USGS 3DEP 1 arc-second DEM,United States and broader 3DEP coverage where available,U.S. public domain,"GeoTIFF, COG, The National Map services",USGS data catalog and National Map download/services,https://data.usgs.gov/datacatalog/data/USGS%3A35f9c4d4-b113-4c8d-8691-47c428c29a5b,yes,USGS 3DEP 1 Arc-Second DEM data catalog record,continuously maintained 3DEP DEM collection,Product-level split from grouped 3DEP for the common 1 arc-second DEM product.,dem-v005-usgs-product-splits,USGS 3DEP 1 Arc-Second DEM 是美国 3DEP 系列中的约 30 m DEM 产品，适合低数据量全国/区域建模和历史工作流复现。它属于美国公共领域数据，可通过 USGS 数据目录和 The National Map 获取。,"The USGS 3DEP 1 Arc-Second DEM is the roughly 30 m DEM product in the 3DEP family, useful for lower-volume national/regional modelling and legacy workflow reproduction. It is U.S. public-domain data distributed through the USGS data catalog and The National Map.",open,public domain,official USGS data catalog record,USGS data catalog 1 Arc-Second DEM record,download/service/cloud,1 arc-second / about 30 m,U.S. DEM collection,
Elevation · DEM,USGS 3DEP 1/9 Arc-Second DEM,USGS National Geospatial Program,National high-resolution DEM,USGS 3DEP 1/9 arc-second DEM,United States where high-resolution source data are available,U.S. public domain,"GeoTIFF, COG, The National Map services",USGS data catalog and National Map download/services,https://data.usgs.gov/datacatalog/data/USGS%3A40e52270-5c4b-497d-987f-827e374becff,yes,USGS 3DEP 1/9 Arc-Second DEM data catalog record,3DEP high-resolution DEM collection where available,"Product-level split for the roughly 3 m DEM collection, distinct from 1 m holdings and the S1M product.",dem-v005-usgs-product-splits,USGS 3DEP 1/9 Arc-Second DEM 是 3DEP 中约 3 m 分辨率的高分辨率 DEM 产品，覆盖取决于源数据可用性。它介于 1 m 产品和 1/3 arc-second 产品之间，适合较精细的地形、水文、工程和生态分析。,"The USGS 3DEP 1/9 Arc-Second DEM is a roughly 3 m high-resolution DEM collection whose coverage depends on source data availability. It sits between 1 m products and the 1/3 arc-second collection and supports finer terrain, hydrologic, engineering, and ecological analysis.",open,public domain,official USGS data catalog record,USGS data catalog 1/9 Arc-Second DEM record,download/service/cloud,1/9 arc-second / about 3 m,U.S. high-resolution DEM collection,
Elevation · DEM,CanElevation Canada Cloud DEM Collection,Natural Resources Canada / AWS Open Data,National elevation cloud collection,CanElevation DEM / HRDEM / MRDEM cloud collection,Canada,"Open Government Licence - Canada, dataset-specific NRCan terms","Cloud Optimized GeoTIFF, GeoTIFF, cloud object storage",AWS Open Data registry and NRCan CanElevation routes,https://registry.opendata.aws/canelevation-dem/,yes,CanElevation AWS Open Data registry and NRCan elevation product citations,cloud collection of Canadian elevation products with updates,"Portal/cloud-collection row complementary to existing CDEM and HRDEM rows; accepted because it documents a machine-friendly open cloud access route, not as a replacement for canonical product rows.",dem-v005-canada-cloud,CanElevation Canada Cloud DEM Collection 是加拿大自然资源部相关高程产品在 AWS Open Data 中的云端集合入口，面向 CDEM、HRDEM/MRDEM 等机器友好访问。它补充了已收录的 CDEM 和 HRDEM 产品行，强调云优化下载和分析路径。,"The CanElevation Canada Cloud DEM Collection is the AWS Open Data registry entry for Canadian elevation products such as CDEM, HRDEM, and MRDEM. It complements the existing CDEM and HRDEM product rows by documenting machine-friendly cloud access and cloud-optimized download/analysis routes rather than replacing the canonical product records.",open,open under OGL-Canada and product-specific NRCan terms,official/open cloud data registry and national elevation collection,AWS Open Data CanElevation DEM registry; NRCan CanElevation product lineage,cloud/download,multiple Canadian DEM resolutions,Canada elevation cloud collection,
