category,name,provider,theme_canonical,theme_raw,coverage,license,formats,access,url,verified_alive,doi_or_citation,time_span,notes,seen_in_passes,desc_zh,desc_en,access_status,openness,source_type,evidence,access_class,scale,feature_count,file_size
Elevation · DEM,High Mountain Asia 8-meter DEM Mosaics Derived from Optical Imagery Version 1,NASA National Snow and Ice Data Center Distributed Active Archive Center (NSIDC DAAC),Regional high-mountain optical stereo DEM,HMA_DEM8m_MOS; 8-meter DEM mosaics derived from optical imagery,"High Mountain Asia glacier and snow regions; about 26N-46N, 67E-103E, from Tien Shan and Hindu Kush to Eastern Himalaya",NASA Earthdata/NSIDC open data access with required data citation and acknowledgment; free NASA Earthdata Login required for download,PNG and GeoTIFF,"NSIDC DAAC data access tool, Earthdata Login download/filtering, metadata record, DOI landing page",https://nsidc.org/data/hma_dem8m_mos/versions/1,yes,"10.5067/KXOVQ9L172S2; Shean, D. (2017). High Mountain Asia 8-meter DEM Mosaics Derived from Optical Imagery. HMA_DEM8m_MOS, Version 1. NASA NSIDC DAAC.",28 January 2002 to 24 November 2016,This NSIDC product contains 8-meter DEM mosaics of High Mountain Asia glacier and snow regions generated from very-high-resolution commercial satellite imagery. It aggregates the HMA optical-stereo DEM production into mosaic products for regional use.,dem-v026-nsidc-hma-literature-dem,High Mountain Asia 8-meter DEM Mosaics 是 NASA NSIDC DAAC 发布的 HMA 冰川和积雪区 8 m DEM 镶嵌产品，由 GeoEye、QuickBird 和 WorldView 等高分辨率商业卫星影像生成。数据覆盖约 2002-01-28 至 2016-11-24，可通过 NSIDC/Earthdata 以 GeoTIFF/PNG 访问，下载需要免费 Earthdata Login 并按 DOI 引用。,"High Mountain Asia 8-meter DEM Mosaics is a NASA NSIDC DAAC product of 8 m DEM mosaics for HMA glacier and snow regions, generated from very-high-resolution commercial imagery including GeoEye, QuickBird, and WorldView. It covers approximately 28 January 2002 to 24 November 2016 and is available as GeoTIFF/PNG through NSIDC/Earthdata with a free Earthdata Login and required DOI citation.",open with free NASA Earthdata Login for data download,open NASA DAAC research data with citation requirement and free account access,official NASA DAAC dataset and DOI,NSIDC page says this data set contains 8-meter DEM mosaics of high mountain Asia glacier and snow regions generated from very-high-resolution commercial satellite imagery; formats PNG and GeoTIFF; temporal coverage 2002-01-28 to 2016-11-24; spatial resolution 8 m; DOI 10.5067/KXOVQ9L172S2. Announcement page states the three HMA data sets cover Tien Shan and Hindu Kush to Eastern Himalaya and were generated from DigitalGlobe very-high-resolution imagery.,download/DOI/metadata,8 m spatial resolution,regional DEM products for HMA glacier and snow regions,
Elevation · DEM,High Mountain Asia 8-meter DEMs Derived from Along-track Optical Imagery Version 1,NASA National Snow and Ice Data Center Distributed Active Archive Center (NSIDC DAAC),Regional high-mountain optical stereo DEM,HMA_DEM8m_AT; along-track optical stereo DEMs,"High Mountain Asia glacier and snow regions; about 26N-46N, 67E-103E, from Tien Shan and Hindu Kush to Eastern Himalaya",NASA Earthdata/NSIDC open data access with required data citation and acknowledgment; free NASA Earthdata Login required for download,PNG and GeoTIFF,"NSIDC DAAC data access tool, Earthdata Login download/filtering, metadata record, DOI landing page",https://nsidc.org/data/hma_dem8m_at/versions/1,yes,"10.5067/GSACB044M4PK; Shean, D. (2017). High Mountain Asia 8-meter DEMs Derived from Along-track Optical Imagery. HMA_DEM8m_AT, Version 1. NASA NSIDC DAAC.",28 January 2002 to 24 November 2016,This NSIDC product contains 8-meter DEMs of High Mountain Asia glacier and snow regions generated from very-high-resolution commercial stereoscopic satellite imagery using along-track image geometry.,dem-v026-nsidc-hma-literature-dem,High Mountain Asia 8-meter Along-track DEM 是 NASA NSIDC DAAC 发布的 HMA 区域 8 m DEM 产品，面向冰川和积雪区，由高分辨率商业立体卫星影像的 along-track 几何生成。页面给出 GeoTIFF/PNG 格式、2002-2016 时间范围、8 m 空间分辨率和 DOI，可通过 Earthdata 下载。,"High Mountain Asia 8-meter Along-track DEM is a NASA NSIDC DAAC 8 m DEM product for HMA glacier and snow regions generated from very-high-resolution commercial stereoscopic imagery using along-track geometry. The landing page lists GeoTIFF/PNG formats, 2002-2016 temporal coverage, 8 m resolution, and a DOI, with download through Earthdata.",open with free NASA Earthdata Login for data download,open NASA DAAC research data with citation requirement and free account access,official NASA DAAC dataset and DOI,NSIDC page says this data set contains 8-meter DEMs of high mountain Asia glacier and snow regions generated from very-high-resolution commercial stereoscopic satellite imagery; formats PNG and GeoTIFF; temporal coverage 2002-01-28 to 2016-11-24; spatial resolution 8 m; DOI 10.5067/GSACB044M4PK. Announcement page states the three HMA data sets cover Tien Shan and Hindu Kush to Eastern Himalaya and were generated from DigitalGlobe very-high-resolution imagery.,download/DOI/metadata,8 m spatial resolution,regional DEM products for HMA glacier and snow regions,
Elevation · DEM,High Mountain Asia 8-meter DEMs Derived from Cross-track Optical Imagery Version 1,NASA National Snow and Ice Data Center Distributed Active Archive Center (NSIDC DAAC),Regional high-mountain optical stereo DEM,HMA_DEM8m_CT; cross-track optical stereo DEMs,"High Mountain Asia glacier and snow regions; about 26N-46N, 67E-103E, from Tien Shan and Hindu Kush to Eastern Himalaya",NASA Earthdata/NSIDC open data access with required data citation and acknowledgment; free NASA Earthdata Login required for download,PNG and GeoTIFF,"NSIDC DAAC data access tool, Earthdata Login download/filtering, metadata record, DOI landing page",https://nsidc.org/data/hma_dem8m_ct/versions/1,yes,"10.5067/0MCWJJH5ABYO; Shean, D. (2017). High Mountain Asia 8-meter DEMs Derived from Cross-track Optical Imagery. HMA_DEM8m_CT, Version 1. NASA NSIDC DAAC.",28 January 2002 to 24 November 2016,This NSIDC product contains 8-meter DEMs of High Mountain Asia glacier and snow regions generated from very-high-resolution commercial stereo satellite imagery using cross-track image geometry.,dem-v026-nsidc-hma-literature-dem,High Mountain Asia 8-meter Cross-track DEM 是 NASA NSIDC DAAC 发布的 HMA 区域 8 m DEM 产品，利用高分辨率商业 cross-track 立体卫星影像生成，服务于高山亚洲冰川和积雪区地形研究。页面列出 GeoTIFF/PNG、2002-2016 时间覆盖、8 m 分辨率和 DOI，数据通过 Earthdata 获取。,"High Mountain Asia 8-meter Cross-track DEM is a NASA NSIDC DAAC 8 m DEM product for HMA glacier and snow regions generated from very-high-resolution commercial cross-track stereo imagery. The landing page lists GeoTIFF/PNG formats, 2002-2016 coverage, 8 m resolution, and DOI-backed Earthdata access.",open with free NASA Earthdata Login for data download,open NASA DAAC research data with citation requirement and free account access,official NASA DAAC dataset and DOI,NSIDC page says this data set contains 8-meter DEMs of high mountain Asia glacier and snow regions generated from very-high-resolution commercial stereo satellite imagery; formats PNG and GeoTIFF; temporal coverage 2002-01-28 to 2016-11-24; spatial resolution 8 m; DOI 10.5067/0MCWJJH5ABYO. Announcement page states the three HMA data sets cover Tien Shan and Hindu Kush to Eastern Himalaya and were generated from DigitalGlobe very-high-resolution imagery.,download/DOI/metadata,8 m spatial resolution,regional DEM products for HMA glacier and snow regions,
Elevation · DEM,Chile CIREN DEM Isla de Pascua y Juan Fernández,Centro de Información de Recursos Naturales (CIREN) / Geoportal de Chile,Island high-resolution DEM,DEM Isla de Pascua y Juan Fernández; Modelo Digital de Elevación,"Isla de Pascua and Juan Fernández, Chile; metadata extent about 110.569W-77.253W, 35.109S-25.862S","Geoportal de Chile public geospatial catalog download; explicit open license not stated on the metadata page, so reuse should cite CIREN/Geoportal and check national catalog terms",TIFF downloadable files; WGS84 UTM zone 12S for Pascua and WGS84 UTM zone 17S for Juan Fernández,Geoportal de Chile metadata page and direct catalog download URL,https://geoportal.cl/geoportal/catalog/35972/DEM%20Isla%20de%20Pascua%20y%20Juan%20Fern%C3%A1ndez,yes,Geoportal de Chile catalog record 35972; publication date 2021-10-27; CIREN,published 2021-10-27; Pascua DEM derived from contours and QuickBird shoreline; Juan Fernández DEM product date per catalog record,"Geoportal de Chile describes a DEM for Isla de Pascua with 4 m pixels made from contour lines, with the zero-meter coastline digitized from a QuickBird orthoimage, and a Juan Fernández DEM with 2 m pixels. The catalog states TIFF format and altitudes referenced to mean sea level, with a direct downloadable TIFF resource.",dem-v027-latin-america-official-dem,Chile CIREN DEM Isla de Pascua y Juan Fernández 是智利国家 Geoportal 发布的岛屿高分辨率 DEM。元数据说明 Isla de Pascua DEM 为 4 m 像元，由等高线和 QuickBird 正射影像海岸线生成；Juan Fernández DEM 为 2 m 像元，文件格式为 TIFF，高程以平均海平面为基准，并提供直接下载入口。,"Chile CIREN DEM Isla de Pascua y Juan Fernández is a high-resolution island DEM record published through Geoportal de Chile. The metadata describes a 4 m Isla de Pascua DEM derived from contours and a QuickBird shoreline, plus a 2 m Juan Fernández DEM. Files are provided as TIFF with elevations referenced to mean sea level and a direct download resource is listed.",open metadata and direct download verified; license terms require catalog/provider check,public catalog download with attribution/terms caveat,official national geospatial catalog record,"Geoportal de Chile title DEM Isla de Pascua y Juan Fernández; description says Pascua DEM pixel 4 m from contours and QuickBird coastline, Juan Fernández DEM pixel 2 m, WGS84 UTM projections, TIFF files, altitude values from mean sea level, publication date 2021-10-27, organization CIREN, and direct TIFF download URL.",metadata/download,4 m pixel for Isla de Pascua; 2 m pixel for Juan Fernández,two island DEM coverages,
Elevation · DEM,Chile CIREN DEM ALOS PALSAR Región de Los Ríos,Centro de Información de Recursos Naturales (CIREN) / Geoportal de Chile,Regional radar-derived DEM,DEM Alos Palsar Región de Los Ríos; 12.5 m ALOS PALSAR DEM regional mosaic,"Región de Los Ríos, Chile; metadata extent about 73.838W-71.425W, 40.645S-39.166S","Geoportal de Chile public geospatial catalog download; explicit open license not stated on the metadata page, so reuse should cite CIREN/Geoportal and check national catalog terms",JPG2000 16-bit regional DEM download; source ALOS PALSAR 12.5 m pixel DEM; EGM2008 geoid adjustment to mean sea level,Geoportal de Chile metadata page and direct catalog download URL,https://geoportal.cl/geoportal/catalog/35432/DEM%20Alos%20Palsar%20Regi%C3%B3n%20de%20Los%20R%C3%ADos,yes,Geoportal de Chile catalog record 35432; publication date 2016-04-22; CIREN,published 2016-04-22; based on ALOS PALSAR mission imagery from 2006-2011 and regional processing,"Geoportal de Chile states that ALOS PALSAR DEM products at 12.5 m pixel size were downloaded, mosaicked regionally, adjusted from geoidal height to mean sea level using EGM2008, clipped to the regional ODEPA boundary, and exported as 16-bit JPG2000. This row records the Los Ríos regional DEM page; the page also notes that Chile coverage is total and that 15 regional outputs were generated.",dem-v027-latin-america-official-dem,Chile CIREN DEM ALOS PALSAR Región de Los Ríos 是智利 Geoportal 上的区域 DEM 产品，基于 ALOS PALSAR 12.5 m DEM 进行区域镶嵌、EGM2008 大地水准面到平均海平面校正，并按 ODEPA 区域边界裁剪输出。该记录覆盖 Los Ríos 大区，提供 16 bit JPG2000 下载入口；页面同时说明智利整体制作了 15 个区域成果。,"Chile CIREN DEM ALOS PALSAR Región de Los Ríos is a regional DEM product in Geoportal de Chile. It is based on 12.5 m ALOS PALSAR DEM scenes that were mosaicked, adjusted from geoidal height to mean sea level with EGM2008, clipped to the ODEPA regional boundary, and exported as 16-bit JPG2000. The record covers Los Ríos and notes that 15 regional outputs were produced for Chile.",open metadata and direct download verified; license terms require catalog/provider check,public catalog download with attribution/terms caveat,official national geospatial catalog record,"Geoportal de Chile title DEM Alos Palsar Región de Los Ríos; description says ALOS PALSAR DEM has 12.5 m pixels, Chile coverage is total, scenes were mosaicked regionally, heights converted to mean sea level with EGM2008, outputs clipped to regional ODEPA boundary and exported to JPG2000 16-bit, publication date 2016-04-22, and direct file download URL.",metadata/download,"12.5 m source DEM; approximate 1:25,000 regional product scale",one regional DEM; source notes 15 Chile regional outputs,
Elevation · DEM,Rwanda 10m Digital Elevation Model,"UNDP GeoHub / Water and Sanitation Corporation (WASAC) / National Land Authority (NLA), Rwanda",National high-resolution DEM,"Digital Elevation Model (DEM) 10m resolution, Rwanda",Rwanda national coverage,Creative Commons BY 4.0,GeoHub raster dataset with preview/API/tile and file access links; elevation unit meters,"UNDP GeoHub dataset page, GeoHub Dataset API, preview/tile APIs, and WASAC GitHub hosting repository",https://geohub.data.undp.org/data/00d5add9be37e465398b081683c3ec03,yes,"UNDP GeoHub dataset 00d5add9be37e465398b081683c3ec03; created 2023-10-27, updated 2024-03-05",GeoHub record created 2023-10-27 and updated 2024-03-05; DEM source date not specified on landing page,"UNDP GeoHub states that the 10 m resolution DEM dataset of Rwanda was prepared by the National Land Authority and provided by WASAC. The page lists Creative Commons BY 4.0, public access level, national admin level, meter unit, 10 m resolution, and developer/API/file/tile access links.",dem-v028-africa-middle-east-official-dem,Rwanda 10m DEM 是 UNDP GeoHub 发布的卢旺达全国 10 m 分辨率数字高程模型，来源为 Rwanda National Land Authority 与 WASAC。GeoHub 页面标注许可为 Creative Commons BY 4.0、访问级别为 Public、单位为米，并提供数据 API、预览/瓦片和文件访问线索。,"Rwanda 10m DEM is a national 10 m digital elevation model published through UNDP GeoHub, with source attribution to Rwanda’s National Land Authority and WASAC. The GeoHub page lists Creative Commons BY 4.0 licensing, public access, meter units, national coverage, and developer/API, preview/tile, and file access routes.",open,public under Creative Commons BY 4.0,official/institutional open data hub record,"UNDP GeoHub title Digital Elevation Model (DEM) 10m resolution, Rwanda; description says prepared by National Land Authority and provided by WASAC; license Creative Commons BY 4.0; access level Public; source Water and Sanitation Corporation (WASAC), National Land Authority (NLA); unit m; admin level National; resolution 10m; created 2023-10-27, updated 2024-03-05.",download/API/cloud tiles,10 m resolution,national raster coverage,
Elevation · DEM,Kenya SRTM DEM 30meters,RCMRD SERVIR-Africa / NASA,National SRTM-derived DEM,Kenya SRTM DEM 30meters; SRTM 30 metres image for Kenya,Kenya national coverage,Open Database License (ODbL 1.0) for database; Database Contents License (DBCL 1.0) for contents,ArcGIS ImageServer; zipped download package,"RCMRD Open Data ArcGIS Hub page, ISO metadata, ArcGIS ImageServer, and zipped download",https://opendata.rcmrd.org/datasets/9a461a538cf848299b996a28cdc42ef6/about,yes,ArcGIS item/metadata identifier 9a461a538cf848299b996a28cdc42ef6; ISO metadata last update 2017-08-16,SRTM mission source data February 2000; RCMRD metadata last updated 2017-08-16,"RCMRD ISO metadata states that the product represents SRTM 30 m imagery for Kenya, created by mosaicking SRTM tiles and clipping to the country extent. It lists ODbL/DBCL licensing, credits RCMRD SERVIR-Africa and NASA, and provides both an ArcGIS ImageServer and a zipped download URL.",dem-v028-africa-middle-east-official-dem,Kenya SRTM DEM 30meters 是 RCMRD SERVIR-Africa 发布的肯尼亚全国 30 m SRTM 派生高程数据。ISO 元数据说明该数据由 SRTM 瓦片镶嵌并裁剪到肯尼亚国界范围得到，许可为 ODbL/DBCL，并提供 ArcGIS ImageServer 与 ZIP 下载入口。,"Kenya SRTM DEM 30meters is a national 30 m SRTM-derived elevation product published by RCMRD SERVIR-Africa. The ISO metadata states that it was created by mosaicking SRTM tiles and clipping them to Kenya’s country extent, with ODbL/DBCL licensing, RCMRD/NASA credits, an ArcGIS ImageServer, and a zipped download route.",open,open under ODbL/DBCL,regional official geospatial open-data portal and ISO metadata,ArcGIS ISO metadata title Kenya SRTM DEM 30meters; abstract says SRTM 30 metres image for Kenya created by mosaicking tiles and clipping to country extent; limitations of use state ODbL 1.0 and DBCL 1.0; credits RCMRD Servir-Africa and NASA; online locations include ArcGIS ImageServer and zipped download; last update 2017-08-16.,download/service/API,30 m SRTM-derived raster,national raster coverage,
Elevation · DEM,USGS 10-m Digital Elevation Model (DEM): American Samoa: Tutuila,U.S. Geological Survey (USGS) / Pacific Islands Ocean Observing System (PacIOOS),Island DEM,USGS 10-m Digital Elevation Model (DEM): American Samoa: Tutuila; usgs_dem_10m_tutuila,"Tutuila, American Samoa; bounding box about 170.84755W-170.53699W, 14.37745S-14.2193S",Free use and redistribution with non-legal-use/no-warranty limitation stated by PacIOOS metadata,"netCDF grid via THREDDS; OPeNDAP, NetCDF Subset, WCS, WMS, ISO, NCML service access; related hillshade layer",PacIOOS metadata page and THREDDS catalog/service routes: https://pae-paha.pacioos.hawaii.edu/thredds/dem.html?dataset=usgs_dem_10m_tutuila,https://www.pacioos.hawaii.edu/metadata/usgs_dem_10m_tutuila.html,yes,"PacIOOS identifier usgs_dem_10m_tutuila; citation USGS (2015), distributed by PacIOOS",created 2015-05-11; source USGS 1/3 arc-second DEM quadrangles,"A 10-meter land-surface DEM for Tutuila in American Samoa from USGS 1/3 arc-second DEM quadrangles. PacIOOS distributes it as a THREDDS netCDF grid with OPeNDAP, NetCDF Subset, WCS, WMS, ISO, and NCML service routes; the hillshade is a related image layer, not the canonical DEM row.",dem-v029-pacific-island-dem,USGS/PacIOOS 的 Tutuila 10 m DEM 是美属萨摩亚 Tutuila 岛的数值地表高程模型，来源为 USGS 1/3 角秒 DEM 图幅。PacIOOS 元数据提供 THREDDS/netCDF、OPeNDAP、NCSS、WCS、WMS、ISO 和 NCML 访问路线，并说明数据可免费使用和再分发但不适合法律用途。,"USGS/PacIOOS Tutuila 10 m DEM is a numeric land-surface elevation model for Tutuila, American Samoa, derived from USGS 1/3 arc-second DEM quadrangles. PacIOOS distributes it as a THREDDS/netCDF grid with OPeNDAP, NCSS, WCS, WMS, ISO, and NCML access routes, and states that the data may be used and redistributed for free with a non-legal-use/no-warranty limitation.",open,free use and redistribution with disclaimer; not intended for legal use,official USGS-derived institutional PacIOOS metadata and THREDDS service,"PacIOOS title USGS 10-m Digital Elevation Model (DEM): American Samoa: Tutuila; abstract says 10-meter resolution land surface DEM for Tutuila from USGS 1/3 arc-second DEM quadrangles; THREDDS catalog says data format netCDF, data type GRID, ID usgs_dem_10m_tutuila, and lists OPeNDAP, NetcdfSubset, WMS, WCS, ISO, NCML; use limitation says data may be used and redistributed for free but is not intended for legal use.",download/API/service/metadata,10 m resolution,one island DEM grid,
Elevation · DEM,USGS 10-m Digital Elevation Model (DEM): American Samoa: Tau,U.S. Geological Survey (USGS) / Pacific Islands Ocean Observing System (PacIOOS),Island DEM,USGS 10-m Digital Elevation Model (DEM): American Samoa: Tau; usgs_dem_10m_tau,"Manua Island of Tau, American Samoa; bounding box about 169.52338W-169.41588W, 14.2768S-14.20995S",Free use and redistribution with non-legal-use/no-warranty limitation stated by PacIOOS metadata,"netCDF grid via THREDDS; OPeNDAP, NetCDF Subset, WCS, WMS, ISO, NCML service access; related hillshade layer",PacIOOS metadata page and THREDDS catalog/service routes: https://pae-paha.pacioos.hawaii.edu/thredds/dem.html?dataset=usgs_dem_10m_tau,https://www.pacioos.hawaii.edu/metadata/usgs_dem_10m_tau.html,yes,"PacIOOS identifier usgs_dem_10m_tau; citation USGS (2015), distributed by PacIOOS",created 2015-05-11; source USGS 1/3 arc-second DEM quadrangles,"A 10-meter land-surface DEM for the Manua Island of Tau in American Samoa from USGS 1/3 arc-second DEM quadrangles. PacIOOS distributes it as a THREDDS netCDF grid with OPeNDAP, NetCDF Subset, WCS, WMS, ISO, and NCML service routes; the hillshade is a related image layer, not the canonical DEM row.",dem-v029-pacific-island-dem,USGS/PacIOOS 的 Taʻu 10 m DEM 是美属萨摩亚 Manua 群岛 Taʻu 岛的数值地表高程模型，来源为 USGS 1/3 角秒 DEM 图幅。PacIOOS 提供 THREDDS/netCDF、OPeNDAP、NCSS、WCS、WMS、ISO 和 NCML 访问方式，并注明数据可免费使用和再分发但不适合作为法律用途。,"USGS/PacIOOS Taʻu 10 m DEM is a numeric land-surface elevation model for the Manua island of Taʻu in American Samoa, derived from USGS 1/3 arc-second DEM quadrangles. PacIOOS distributes it as a THREDDS/netCDF grid with OPeNDAP, NCSS, WCS, WMS, ISO, and NCML access routes, and states that the data may be used and redistributed for free with a non-legal-use/no-warranty limitation.",open,free use and redistribution with disclaimer; not intended for legal use,official USGS-derived institutional PacIOOS metadata and THREDDS service,"PacIOOS title USGS 10-m Digital Elevation Model (DEM): American Samoa: Tau; abstract says 10-meter resolution land surface DEM for the Manua Island of Tau from USGS 1/3 arc-second DEM quadrangles; THREDDS catalog says data format netCDF, data type GRID, ID usgs_dem_10m_tau, and lists OPeNDAP, NetcdfSubset, WMS, WCS, ISO, NCML; use limitation says data may be used and redistributed for free but is not intended for legal use.",download/API/service/metadata,10 m resolution,one island DEM grid,
