category,name,provider,theme_canonical,theme_raw,coverage,license,formats,access,url,verified_alive,doi_or_citation,time_span,notes,seen_in_passes,desc_zh,desc_en,access_status,openness,source_type,evidence,access_class,scale,feature_count,file_size
Elevation · DEM,NASA SRTMGL1 Version 3 Global 1 arc-second DEM,NASA LP DAAC / USGS,Global radar DEM,SRTM 1 arc-second global elevation,global land between about 60N and 56S,NASA Earthdata open data; redistribution allowed with citation,"HGT, GeoTIFF via Earthdata/OpenTopography/GEE","Earthdata download, OpenTopography API, Google Earth Engine asset USGS/SRTMGL1_003",https://doi.org/10.5067/MEaSUREs/SRTM/SRTMGL1.003,yes,10.5067/MEaSUREs/SRTM/SRTMGL1.003,SRTM mission February 2000; Version 3 release,Canonical NASA/USGS 30 m land DEM backbone; GEE and OpenTopography provide common analysis/download routes.,dem-v001-global-backbone,SRTMGL1 v003 是 NASA/USGS 发布的全球 1 角秒数字高程模型，主要覆盖约北纬 60 度至南纬 56 度陆地区域。它是地形、水文、灾害、生态和遥感几何校正中最常用的开放 DEM 基线之一，可通过 NASA Earthdata、OpenTopography 和 Google Earth Engine 等渠道访问。,"SRTMGL1 v003 is the NASA/USGS 1 arc-second global digital elevation model derived from the Shuttle Radar Topography Mission. It covers most land areas between about 60N and 56S and is a core open DEM baseline for terrain analysis, hydrology, hazards, ecology, and remote-sensing preprocessing. Access routes include NASA Earthdata, OpenTopography, and the Google Earth Engine asset USGS/SRTMGL1_003.",open,open with free Earthdata account for some routes,official DOI and cloud analysis mirror,NASA DOI landing page; GEE asset USGS/SRTMGL1_003; OpenTopography global SRTM access,download/API/cloud,1 arc-second / about 30 m,global raster tiles,
Elevation · DEM,NASA SRTMGL3 Version 3 Global 3 arc-second DEM,NASA LP DAAC / USGS,Global radar DEM,SRTM 3 arc-second global elevation,global land between about 60N and 56S,NASA Earthdata open data; redistribution allowed with citation,"HGT, GeoTIFF via Earthdata/OpenTopography",Earthdata download and OpenTopography API,https://doi.org/10.5067/MEaSUREs/SRTM/SRTMGL3.003,yes,10.5067/MEaSUREs/SRTM/SRTMGL3.003,SRTM mission February 2000; Version 3 release,"Coarser 90 m companion to SRTMGL1, useful for legacy workflows and lower-volume global processing.",dem-v001-global-backbone,SRTMGL3 v003 是 NASA/USGS 的 3 角秒全球 DEM，是 30 m SRTM 产品的较粗分辨率配套版本。它适合低数据量全球制图、旧模型复现和区域尺度地形分析，仍保留 SRTM 的稳定引用与官方下载链路。,"SRTMGL3 v003 is the 3 arc-second companion to the NASA/USGS SRTM global DEM family. The product is useful for lower-volume global processing, legacy model reproduction, and regional terrain applications where 90 m resolution is sufficient. It retains official DOI-backed access through NASA Earthdata and related distribution services.",open,open with free Earthdata account for some routes,official DOI,NASA DOI landing page and Earthdata distribution,download/API,3 arc-second / about 90 m,global raster tiles,
Elevation · DEM,NASADEM HGT v001,NASA LP DAAC / JPL,Global radar DEM,NASADEM merged SRTM reprocessing,global land between about 60N and 56S,NASA Earthdata open data; redistribution allowed with citation,"HGT, GeoTIFF via Earthdata/GEE","Earthdata download, Google Earth Engine asset NASA/NASADEM_HGT/001",https://doi.org/10.5067/MEaSUREs/NASADEM/NASADEM_HGT.001,yes,10.5067/MEaSUREs/NASADEM/NASADEM_HGT.001,SRTM-era elevation with improved auxiliary processing,Reprocessed SRTM-based DEM with improved void filling and auxiliary data integration; important modern replacement for many SRTM workflows.,"dem-v001-global-backbone,gee-dem-lead",NASADEM HGT v001 是 NASA 对 SRTM 高程进行再处理后的全球 DEM，改进了空洞填补、控制数据和辅助资料融合。它常被作为 SRTMGL1 的现代替代或补充，可通过 Earthdata 和 Google Earth Engine 访问。,"NASADEM HGT v001 is NASA's reprocessed SRTM-based global elevation product, improving void filling, control, and auxiliary-data integration relative to older SRTM releases. It is commonly used as a modern replacement or complement to SRTMGL1 in terrain, hydrology, and remote-sensing workflows. Access is available through Earthdata and Google Earth Engine.",open,open with free Earthdata account for some routes,official DOI and GEE mirror,NASA DOI landing page; GEE asset NASA/NASADEM_HGT/001,download/cloud,1 arc-second / about 30 m,global raster tiles,
Elevation · DEM,ASTER Global Digital Elevation Model Version 3,NASA LP DAAC / METI / NASA,Global optical stereo DEM,ASTER GDEM v3,global land from about 83N to 83S,NASA Earthdata open data with citation,GeoTIFF,Earthdata download and Google Earth Engine asset NASA/ASTER_GED/AG100_003,https://doi.org/10.5067/ASTER/ASTGTM.003,yes,10.5067/ASTER/ASTGTM.003,ASTER stereo scenes through Version 3 release,"Optical stereo DEM complementing radar DEMs, with broader high-latitude land coverage than SRTM but different artifact characteristics.","dem-v001-global-backbone,gee-dem-lead",ASTER GDEM v3 是由 METI/NASA ASTER 立体像对生成的全球 1 角秒 DEM，覆盖约 83N 至 83S 陆地。它与 SRTM/NASADEM 具有不同误差来源和覆盖优势，常用于多源高程比较、高纬地区补充和地形制图。,"ASTER GDEM Version 3 is a global 1 arc-second DEM generated from METI/NASA ASTER stereo imagery, covering land areas from roughly 83N to 83S. It complements radar-derived DEMs such as SRTM and NASADEM with different error characteristics and broader high-latitude coverage. The product is distributed through NASA Earthdata and mirrored in cloud analysis environments.",open,open with Earthdata access and citation,official DOI and GEE mirror,NASA DOI landing page; LP DAAC ASTER GDEM record; GEE ASTER elevation assets,download/cloud,1 arc-second / about 30 m,global raster tiles,
Elevation · DEM,Copernicus DEM GLO-30,European Space Agency / Copernicus / Airbus Defence and Space,Global radar DEM,Copernicus DEM 30 m global,global land,Copernicus free and open data policy / COP-DEM terms,"GeoTIFF, COG via cloud mirrors, GEE ImageCollection","Copernicus Data Space, AWS Open Data, Google Earth Engine asset COPERNICUS/DEM/GLO30",https://developers.google.com/earth-engine/datasets/catalog/COPERNICUS_DEM_GLO30,yes,Copernicus DEM product documentation and data access citation,"WorldDEM-derived edited DEM, public release from 2019 onward","High-value 30 m global DEM derived from WorldDEM, widely used through GEE and cloud-optimized access routes; deduped against GLO-90 as separate resolution collection.","dem-v001-global-backbone,gee-dem-lead",Copernicus DEM GLO-30 是 ESA/Copernicus 基于 WorldDEM 编辑发布的全球 30 m 数字高程模型。它在 Google Earth Engine、Copernicus Data Space 和开放云镜像中使用频率很高，是当前全球 DEM 分析的重要基准之一。,"Copernicus DEM GLO-30 is a 30 m global digital elevation model released through the Copernicus programme and derived from edited WorldDEM data. It is widely used in Google Earth Engine, Copernicus Data Space, and cloud-optimized workflows. The product is one of the strongest current global DEM baselines for terrain, hazards, hydrology, and environmental modelling.",open,open under Copernicus DEM access terms,official cloud catalog and provider portal,GEE COPERNICUS/DEM/GLO30 page; Copernicus Data Space collection description; AWS registry,download/API/cloud,30 m,global raster collection,
Elevation · DEM,Copernicus DEM GLO-90,European Space Agency / Copernicus / Airbus Defence and Space,Global radar DEM,Copernicus DEM 90 m global,global land,Copernicus free and open data policy / COP-DEM terms,"GeoTIFF, COG via cloud mirrors, GEE ImageCollection","Copernicus Data Space, AWS Open Data, Google Earth Engine asset COPERNICUS/DEM/GLO90",https://registry.opendata.aws/copernicus-dem/,yes,Copernicus DEM product documentation and data access citation,"WorldDEM-derived edited DEM, public release from 2019 onward","90 m companion to GLO-30, useful for smaller global workflows and legacy-resolution comparisons.","dem-v001-global-backbone,gee-dem-lead",Copernicus DEM GLO-90 是 Copernicus 全球 DEM 的 90 m 版本，保留 WorldDEM 派生编辑成果但数据量更小。它适合全球尺度制图、模型预处理和与 SRTMGL3 等 90 m 产品比较。,"Copernicus DEM GLO-90 is the 90 m version of the Copernicus global DEM family, preserving the edited WorldDEM-derived elevation surface at a lighter data volume. It is useful for global mapping, model preprocessing, and comparisons with 90 m products such as SRTMGL3. Access is available through Copernicus, GEE, and cloud mirrors.",open,open under Copernicus DEM access terms,official cloud catalog and provider portal,AWS Open Data Copernicus DEM registry; Copernicus Data Space collection description; Digital Earth Africa COP-DEM access notes,download/API/cloud,90 m,global raster collection,
Elevation · DEM,ALOS World 3D - 30m AW3D30,JAXA EORC,Global optical stereo DEM,AW3D30 DSM,global land from about 82N to 82S,JAXA AW3D30 terms of use; free registration download,GeoTIFF,JAXA download after free registration; GEE asset JAXA/ALOS/AW3D30/V3_2,https://www.eorc.jaxa.jp/ALOS/en/dataset/aw3d30/aw3d30_e.htm,yes,JAXA ALOS World 3D - 30m product citation,"ALOS PRISM stereo archive, multiple public versions",Global DSM derived from ALOS PRISM; a key optical-stereo alternative to SRTM/ASTER/Copernicus DEM.,"dem-v001-global-backbone,gee-dem-lead",AW3D30 是 JAXA 基于 ALOS PRISM 立体观测发布的全球 30 m 数字表面模型。它提供与雷达 DEM 不同的观测几何和误差结构，常用于全球地形制图、山地分析和多 DEM 交叉验证。,"AW3D30 is JAXA's global 30 m digital surface model derived from ALOS PRISM stereo observations. It provides an optical-stereo alternative to radar DEMs, with different viewing geometry and error characteristics. The dataset is commonly used for global terrain mapping, mountain analysis, and cross-validation among DEM products.",open,free download with registration and terms,official provider portal and GEE mirror,JAXA AW3D30 landing page; GEE JAXA/ALOS/AW3D30/V3_2 page,registration-required/cloud,30 m,global raster tiles,
Elevation · DEM,MERIT DEM,University of Tokyo / Yamazaki Lab,Global corrected DEM,Multi-Error-Removed Improved-Terrain DEM,global land between about 90N and 60S,Creative Commons BY-NC 4.0 for research/education use,GeoTIFF,project download with user registration/terms,http://hydro.iis.u-tokyo.ac.jp/~yamadai/MERIT_DEM/,yes,"Yamazaki et al. 2017, Geophysical Research Letters, MERIT DEM",released 2017; based on multiple global DEM inputs,"Error-reduced DEM removing major absolute bias, stripe noise, speckle noise, and tree-height bias from existing global DEMs.",dem-v001-global-backbone,MERIT DEM 是东京大学团队发布的多误差消除全球 DEM，重点校正绝对偏差、条带噪声、斑点噪声和树高偏差等问题。它在水文建模、洪水模拟和全球地形分析中影响很大，但许可证更偏科研教育使用。,"MERIT DEM is a multi-error-removed global DEM produced by the University of Tokyo team. It corrects major biases and noise patterns in existing global DEMs, including absolute bias, stripe noise, speckle noise, and tree-height bias. The product is especially influential in hydrological modelling, flood analysis, and global terrain studies, with access governed by research-oriented terms.",open,free for research/education under stated terms,official project and peer-reviewed paper,MERIT DEM project page; Yamazaki et al. 2017 paper citation,registration-required/download,3 arc-second / about 90 m,global raster tiles,
Elevation · DEM,FABDEM,University of Bristol / University of Sheffield,Global bare-earth DEM,Forest And Buildings removed Copernicus DEM,global land between about 60N and 56S,Creative Commons Attribution 4.0 International,GeoTIFF,University of Bristol data repository download,https://data.bris.ac.uk/data/dataset/s5hqmjcdj8yo2ibzi9b4ew3sn,yes,FABDEM data repository record and Hawker et al. publication,derived from Copernicus DEM with ML removal of forests/buildings,Global bare-earth elevation estimate created by removing forest and building biases from Copernicus DEM; central for flood and exposure modelling.,dem-v001-global-backbone,FABDEM 是在 Copernicus DEM 基础上去除森林和建筑物高程偏差的全球近似裸地 DEM。它以开放数据仓库形式发布，尤其适合洪水风险、暴露度、城市与低地地形建模等需要裸地高程的应用。,"FABDEM is a global approximate bare-earth DEM generated by removing forest and building biases from Copernicus DEM. It is released through an open university data repository and is particularly valuable for flood-risk modelling, exposure assessment, urban terrain analysis, and other applications that require terrain elevation rather than surface height.",open,open under CC BY 4.0,official repository and dataset paper,University of Bristol data repository record,download,30 m,global raster tiles,
Elevation · DEM,GMTED2010 Global Multi-resolution Terrain Elevation Data,USGS / NGA,Global generalized DEM,GMTED2010,global,U.S. public domain,GeoTIFF and raster grids,USGS EROS download,https://www.usgs.gov/coastal-changes-and-impacts/gmted2010,yes,USGS GMTED2010 product citation,released 2010 as successor to GTOPO30,"Multi-resolution global elevation data at 30, 15, and 7.5 arc-second resolutions; important coarse DEM baseline.",dem-v001-global-backbone,GMTED2010 是 USGS/NGA 发布的全球多分辨率地形高程数据，提供 30、15 和 7.5 角秒等尺度。它是 GTOPO30 的后继产品，适合全球粗尺度制图、气候/环境模型和低数据量分析。,"GMTED2010 is a USGS/NGA global multi-resolution terrain elevation dataset available at 30, 15, and 7.5 arc-second resolutions. It was developed as a successor to GTOPO30 and remains useful for coarse global mapping, climate and environmental modelling, and low-volume terrain workflows.",open,public domain,official USGS product page,USGS GMTED2010 page,download,"30, 15, and 7.5 arc-second",global raster layers,
Elevation · DEM,GTOPO30 Global 30 Arc-Second Elevation,USGS EROS,Legacy global DEM,GTOPO30,global,U.S. public domain,DEM raster tiles,USGS EROS archive download,https://www.usgs.gov/centers/eros/science/usgs-eros-archive-digital-elevation-global-30-arc-second-elevation-gtopo30,yes,USGS EROS GTOPO30 archive citation,released 1996; legacy archive,Historical global 30 arc-second DEM still useful for reproducibility and legacy model comparisons.,dem-v001-global-backbone,GTOPO30 是 USGS EROS 的经典全球 30 角秒 DEM，虽然已被 GMTED2010 等产品替代，但在早期全球模型和历史研究复现中仍很重要。它作为美国公共领域数据可从 USGS 档案访问。,"GTOPO30 is the classic USGS EROS global 30 arc-second DEM. Although superseded by products such as GMTED2010, it remains important for reproducing older global models and historical studies. The archive is distributed as U.S. public-domain data through USGS.",open,public domain,official USGS archive,USGS EROS GTOPO30 archive page,download,30 arc-second / about 1 km,global raster tiles,
Elevation · DEM,EarthEnv-DEM90,EarthEnv / CGIAR-CSI / University partners,Global fused DEM,EarthEnv-DEM90,global land,open academic data with citation; terms on EarthEnv site,GeoTIFF,EarthEnv download tiles,https://www.earthenv.org/DEM.html,yes,Robinson et al. EarthEnv-DEM90 dataset citation,multi-source 90 m DEM compilation,Global 90 m DEM assembled from CGIAR-SRTM and ASTER GDEM using void filling and quality decisions.,dem-v001-global-backbone,EarthEnv-DEM90 是 EarthEnv 发布的全球 90 m 融合 DEM，综合 CGIAR-SRTM、ASTER GDEM 等来源并处理空洞与质量问题。它常用于生态、物种分布、环境建模等需要一致全球地形层的研究。,"EarthEnv-DEM90 is a global 90 m fused DEM built from sources including CGIAR-SRTM and ASTER GDEM, with void filling and quality-selection decisions. It is often used in ecology, species-distribution modelling, and environmental studies that need a consistent global terrain layer.",open,open with citation/terms,official project page and dataset citation,EarthEnv DEM page,download,90 m,global raster tiles,
Elevation · DEM,HydroSHEDS Hydrologically Conditioned DEM,WWF / USGS / HydroSHEDS project,Hydrologically conditioned DEM,HydroSHEDS elevation layers,near-global land between about 60N and 56S,HydroSHEDS free use terms with citation,"GeoTIFF, grids",HydroSHEDS download portal,https://www.hydrosheds.org/products/hydrosheds,yes,"Lehner, Verdin, and Jarvis 2008 HydroSHEDS citation",SRTM-derived hydro-conditioned elevation and drainage layers,"Accepted as a DEM-related hydrologically conditioned elevation product, not merely vector hydrography.",dem-v001-hydrology-backbone,HydroSHEDS 提供基于 SRTM 的水文条件化高程与派生水系数据，核心用途是让全球地形更适合流向、汇流和流域分析。这里收录的是其栅格高程/水文地形产品线，而不是普通水系矢量图层。,"HydroSHEDS provides SRTM-derived hydrologically conditioned elevation and drainage products designed for flow direction, accumulation, and basin analysis. This row captures the raster elevation and hydrological terrain product line rather than ordinary vector hydrography. It is a key global open source for hydrology-ready DEM workflows.",open,free under HydroSHEDS terms with citation,official product portal and paper-backed dataset,HydroSHEDS product page,download,3 arc-second and coarser products,near-global raster layers,
Elevation · DEM,NOAA ETOPO 2022 Global Relief Model,NOAA NCEI,Global topobathymetric elevation,ETOPO 2022,global land and ocean,U.S. public domain,"NetCDF, GeoTIFF",NOAA NCEI download and API,https://www.ncei.noaa.gov/products/etopo-global-relief-model,yes,NOAA NCEI ETOPO 2022 global relief model citation,"2022 release, integrating multiple topographic and bathymetric sources",Topobathymetric global relief model; adjacent to pure terrestrial DEMs but essential for global elevation including bathymetry.,dem-v001-global-backbone,ETOPO 2022 是 NOAA NCEI 发布的全球地形-水深综合起伏模型，覆盖陆地和海底。它不是纯陆地 DEM，但对全球海陆连续高程、海岸带、地球系统模型和可视化非常关键。,"ETOPO 2022 is NOAA NCEI's global topobathymetric relief model covering both land topography and ocean bathymetry. It is not a purely terrestrial DEM, but it is essential for continuous global elevation, coastal work, Earth-system modelling, and visualization. The dataset is distributed as U.S. public-domain data.",open,public domain,official NOAA product page,NOAA NCEI ETOPO product page,download/API,15 arc-second and coarser grids,global relief grids,
Elevation · DEM,GEBCO Global Bathymetric and Topographic Grid,GEBCO / IHO / IOC,Global topobathymetric elevation,GEBCO grid,global ocean and land topography,GEBCO terms; free download with attribution,"NetCDF, GeoTIFF",GEBCO download portal and Web Map Service,https://www.gebco.net/data_and_products/gridded_bathymetry_data/,yes,GEBCO Grid citation for current release,regularly updated global grid releases,Topobathymetric grid included as DEM-adjacent global elevation source for ocean/land continuity; not counted as terrestrial DEM alone.,dem-v001-global-backbone,GEBCO 全球格网是海底地形与陆地高程连续表达的重要开放数据源，常用于全球起伏、水深、海岸带和地球可视化。它更偏全球地形-水深格网，适合作为 DEM 图谱中的邻接类核心数据而非纯陆地 DEM。,"The GEBCO global grid is a major open source for continuous bathymetric and topographic elevation. It is widely used for global relief, ocean depth, coastal analysis, and Earth visualization. In this DEM atlas it is treated as a topobathymetric adjacent core dataset rather than a purely terrestrial DEM.",open,free download under GEBCO attribution terms,official GEBCO product page,GEBCO gridded bathymetry data page,download/service,global gridded bathymetry/topography releases,global grid,
Elevation · DEM,ArcticDEM,Polar Geospatial Center / NGA / NSF,Polar high-resolution DEM,ArcticDEM strips and mosaics,Arctic land areas,publicly available under PGC/NGA terms with citation,"GeoTIFF, cloud-optimized access via AWS/STAC","PGC download, AWS Open Data, STAC, Google Earth Engine community/official routes",https://www.pgc.umn.edu/data/arcticdem/,yes,Porter et al. ArcticDEM citation,"WorldView stereo-derived strips and mosaics, multiple release versions",High-resolution Arctic DEM strips and mosaics; core polar terrain dataset for cryosphere and geomorphology.,dem-v001-polar-backbone,ArcticDEM 是 PGC 基于商业卫星立体影像生成的北极高分辨率 DEM 条带与镶嵌产品。它在冰冻圈、冰川、永久冻土、极地地貌和基础制图中非常关键，可通过 PGC、AWS/STAC 等开放通道访问。,"ArcticDEM provides high-resolution Arctic DEM strips and mosaics generated from commercial satellite stereo imagery by the Polar Geospatial Center and partners. It is a core terrain dataset for cryosphere, glacier, permafrost, polar geomorphology, and mapping applications. Access routes include PGC downloads and cloud/STAC distribution.",open,publicly available with citation and terms,official PGC product page and cloud registry,PGC ArcticDEM page; AWS Open Data/STAC references,download/cloud/STAC,2 m strips; mosaic products at multiple resolutions,polar strip and mosaic raster collections,
Elevation · DEM,Reference Elevation Model of Antarctica (REMA),Polar Geospatial Center / Ohio State University / NGA / NSF,Polar high-resolution DEM,REMA strips and mosaics,Antarctica,publicly available under PGC/NGA terms with citation,"GeoTIFF, cloud-optimized access via AWS/STAC","PGC download, AWS Open Data, STAC",https://www.pgc.umn.edu/data/rema/,yes,Howat et al. REMA citation,"WorldView stereo-derived Antarctic strips and mosaics, multiple releases","Authoritative high-resolution Antarctic DEM strips and mosaics, central to ice-sheet and polar science.",dem-v001-polar-backbone,REMA 是南极参考高程模型，提供由高分辨率立体卫星影像生成的南极 DEM 条带和镶嵌数据。它是冰盖、冰架、冰川流动、极地测绘和变化检测研究中的权威基础数据。,"REMA is the Reference Elevation Model of Antarctica, providing high-resolution DEM strips and mosaics derived from stereo satellite imagery. It is an authoritative base layer for Antarctic ice-sheet, ice-shelf, glacier, polar mapping, and change-detection studies. Distribution is available through PGC and cloud/STAC channels.",open,publicly available with citation and terms,official PGC product page and cloud registry,PGC REMA page; AWS Open Data/STAC references,download/cloud/STAC,2 m strips; mosaic products at multiple resolutions,Antarctic strip and mosaic raster collections,
Elevation · DEM,EarthDEM,Polar Geospatial Center / NGA / NSF,High-resolution regional DEM,EarthDEM strips and mosaics,selected non-polar global land regions,publicly available under PGC/NGA terms with citation,"GeoTIFF, cloud/STAC where available",PGC download and cloud distribution,https://www.pgc.umn.edu/data/earthdem/,yes,EarthDEM product citation from PGC,"commercial stereo satellite DEM production, multiple regions/releases",Extends the PGC stereo DEM approach beyond the polar regions for selected global areas.,dem-v001-highres-backbone,EarthDEM 将 PGC 的高分辨率立体影像 DEM 生产体系扩展到极区之外的部分区域，提供条带和镶嵌高程数据。它适合山地、灾害、冰川以外区域的高分辨率地形分析，但覆盖并非完整全球。,"EarthDEM extends the Polar Geospatial Center's high-resolution stereo DEM production approach beyond the polar regions for selected global areas. It provides strip and mosaic elevation products suitable for high-resolution terrain analysis in mountains, hazards, and other non-polar settings, but it is not a complete global coverage dataset.",open,publicly available with citation and terms,official PGC product page,PGC EarthDEM page,download/cloud,high-resolution strip/mosaic products,regional raster collections,
Elevation · DEM,USGS 3D Elevation Program (3DEP) DEM products,USGS National Geospatial Program,National DEM,"3DEP 1m, 1/3 arc-second, 1 arc-second DEM",United States and territories,U.S. public domain,"GeoTIFF, IMG, cloud-optimized GeoTIFF, services","The National Map download, USGS services, AWS Open Data",https://www.usgs.gov/3d-elevation-program,yes,USGS 3DEP product citation,continually updated national elevation program,Canonical U.S. open elevation program with multiple DEM resolutions and lidar-derived products; row groups official 3DEP DEM collections.,dem-v001-national-backbone,USGS 3DEP 是美国官方三维高程计划，提供 1 m、1/3 角秒、1 角秒等 DEM 以及相关服务和下载。它是美国本土与属地地形、洪水、基础设施、生态和制图工作的核心开放高程源。,"USGS 3DEP is the official U.S. national elevation program, providing DEM products at resolutions such as 1 m, 1/3 arc-second, and 1 arc-second, along with services and downloads. It is the core open elevation source for terrain, flood, infrastructure, ecology, and mapping workflows across the United States and territories.",open,public domain,official agency program and download services,USGS 3DEP page; The National Map download services; USGS AWS open data references,download/API/service/cloud,1 m to 1 arc-second,national raster collections,
