category,name,provider,theme_canonical,theme_raw,coverage,license,formats,access,url,verified_alive,doi_or_citation,time_span,notes,seen_in_passes,desc_zh,desc_en,access_status,openness,source_type,evidence,access_class,scale,feature_count,file_size
Geology · Faults,SADC 2008 Geology Faults and Dykes,"Council for Geoscience, South Africa / SADC regional geology portal",Regional geological faults and dykes,SADC2008_Faults&Dykes feature layer,Southern African Development Community region,ArcGIS item license not specified; public Council for Geoscience feature service,"ArcGIS FeatureServer, JSON, GeoJSON, PBF query formats",Public ArcGIS Enterprise feature service hosted by Council for Geoscience; query endpoint supports GeoJSON,https://maps.geoscience.org.za/portal/home/item.html?id=241cd332fdac464e8d12510474c430a2,yes,"Council for Geoscience ArcGIS portal item 241cd332fdac464e8d12510474c430a2, SADC 2008 Geology Faults and Dykes",SADC 2008 geology compilation; portal item created/modified 2022 per ArcGIS metadata,"Regional polyline layer exposes fault/dyke codes and descriptions through a public FeatureServer. This pass counted 20,622 features. The portal item is public but does not state a machine-readable reuse license, so redistribution terms should be checked before republishing derived files.",fault-v012-us-state-sadc-open-services,"SADC 2008 Geology Faults and Dykes 是南非 Council for Geoscience 门户发布的南部非洲区域线要素服务，图层名为 `SADC2008_Faults&Dykes`。服务通过 ArcGIS FeatureServer 提供 JSON/GeoJSON/PBF 查询，本轮计数 20,622 条线要素，适合补足南部非洲地质断层/岩墙构造线索；但门户 item 未写明明确开放许可，二次分发前需复核条款。","SADC 2008 Geology Faults and Dykes is a regional southern-African polyline service published through the Council for Geoscience ArcGIS portal. The `SADC2008_Faults&Dykes` layer supports JSON, GeoJSON, and PBF queries and returned 20,622 features in this pass. It is valuable for southern-African geological fault and dyke structures, although the public portal item does not state a clear reuse license.",open public feature service; reuse license not stated on item,"open-access, license-to-verify",official geological survey ArcGIS Enterprise feature service,https://maps.geoscience.org.za/portal/home/item.html?id=241cd332fdac464e8d12510474c430a2 | https://maps.geoscience.org.za/portal/sharing/rest/content/items/241cd332fdac464e8d12510474c430a2?f=json | https://maps.geoscience.org.za/hosting/rest/services/Hosted/SADC_2008_Geology_Faults_and_Dykes/FeatureServer | https://maps.geoscience.org.za/hosting/rest/services/Hosted/SADC_2008_Geology_Faults_and_Dykes/FeatureServer/0 | https://maps.geoscience.org.za/hosting/rest/services/Hosted/SADC_2008_Geology_Faults_and_Dykes/FeatureServer/0/query?where=1%3D1&returnCountOnly=true&f=json,api,regional SADC 2008 geology line compilation,"20,622 line features counted from ArcGIS query",dynamic ArcGIS service
Geology · Faults,Quaternary faults offshore of California,U.S. Geological Survey Pacific Coastal and Marine Science Center,Offshore Quaternary fault traces and attributes,Quaternary faults offshore of California,"California State and Federal offshore waters, Pacific Ocean, United States",U.S. public domain / Public Domain Mark 1.0,"Shapefile polyline zip, KML, FGDC XML metadata, PDF source-reference list, ScienceBase WMS/WFS",USGS Science Data Catalog and ScienceBase data release with downloadable shapefile and KML package,https://data.usgs.gov/datacatalog/data/USGS%3A5d38b842e4b01d82ce8b9b56,yes,"Walton, M.A.L., Papesh, A.G., Johnson, S.Y., Conrad, J.E., and Brothers, D.S. (2020), Quaternary faults offshore of California, U.S. Geological Survey data release, https://doi.org/10.5066/P91RYEZ4",Source mapping/data 1982-2020; publication 2020-04-30,"Comprehensive offshore California Quaternary-fault compilation with mapped geometries, attributes, ages, slip-rate fields and source references. This v013 pass treats it as the canonical statewide offshore fault layer and defers adding individual DS 781 California State Waters map-area fault files as separate rows unless finer map-area provenance is later required.",fault-v013-usgs-offshore-cascadia-faults,Quaternary faults offshore of California 是 USGS PCMSC 发布的加州近海第四纪断层综合数据发布，覆盖加州州海域和联邦海域的近海断层系统。数据提供线状 Shapefile、KML、FGDC 元数据和源文献 PDF，包含断层几何、属性、时代、滑动速率和参考来源，适合补足陆上加州活动断层图之外的海域断层约束。,"Quaternary faults offshore of California is a USGS PCMSC data release compiling offshore Quaternary fault systems in California State and Federal waters. It provides polyline Shapefile, KML, FGDC metadata, and source-reference PDF files with fault geometries, attributes, ages, slip-rate information, and provenance. It is the strongest open statewide offshore complement to land-based California active-fault inventories.",open public USGS ScienceBase data release; direct file package verified,"open-data, public-domain",official USGS ScienceBase geospatial data release,https://data.usgs.gov/datacatalog/data/USGS%3A5d38b842e4b01d82ce8b9b56 | https://doi.org/10.5066/P91RYEZ4 | https://www.sciencebase.gov/catalog/item/5d38b842e4b01d82ce8b9b56 | https://www.sciencebase.gov/catalog/item/5d38b842e4b01d82ce8b9b56?format=json | https://www.sciencebase.gov/catalog/file/get/5d38b842e4b01d82ce8b9b56,download,"statewide offshore California compilation; MultiLineString, EPSG:4326",not counted locally; ScienceBase shapefile extension reports MultiLineString fault layer,"ScienceBase aggregate zip 4,164,517 bytes; listed KML 1,607,703 bytes and shapefile member files including 245,180-byte .shp"
Geology · Faults,Cascadia subduction zone database (2022),"U.S. Geological Survey Geology, Minerals, Energy, and Geophysics Science Center / ScienceBase",Cascadia subduction-zone earthquake-hazard and tectonic datasets,Cascadia subduction zone database: compilation of published datasets relevant to Cascadia subduction zone earthquake hazards and tectonics (2022),"Cascadia subduction zone, including Oregon, Washington, northern California and British Columbia",U.S. public domain / Public Domain Mark 1.0,"ScienceBase files, ArcGIS map package (MPK), XML metadata, ArcGIS Online web map, StoryMap, layer-level primary data links in metadata/attributes",USGS Science Data Catalog / ScienceBase data release; individual files downloadable; full MPK package is 3.21 GB and ScienceBase advises downloading individual files or subfolders,https://data.usgs.gov/datacatalog/data/USGS%3A623cf2a6d34e915b67d47586,yes,"Staisch, L.M., and Walton, M.A. (2022), Cascadia subduction zone database: compilation of published datasets relevant to Cascadia subduction zone earthquake hazards and tectonics (2022), U.S. Geological Survey data release, https://doi.org/10.5066/P9O69X6E",Compilation publication 2022-06-22; data time period listed as 2022,"Broad Cascadia hazard/tectonics compilation, not a single fault-trace layer. Accepted because it aggregates onshore and offshore geologic, paleoseismic, geophysical and instrumental datasets along the Cascadia subduction zone and provides map-package/webmap access plus layer metadata pointing to primary downloads. Distinct from the CRESCENT Cascadia CFM repository already cataloged.",fault-v013-usgs-offshore-cascadia-faults,Cascadia subduction zone database (2022) 是 USGS 将 Cascadia 俯冲带相关地质、古地震、地球物理和仪器观测数据汇编到一起的数据发布，覆盖俄勒冈、华盛顿、北加州和不列颠哥伦比亚等区域。它不是单一断层线图层，而是面向俯冲带地震危险性和构造研究的开放综合数据库，提供 ScienceBase 文件、ArcGIS 地图包、在线地图和 StoryMap。,"The Cascadia subduction zone database (2022) is a USGS compilation of published geologic, paleoseismic, geophysical, and instrumental datasets along the Cascadia margin, covering Oregon, Washington, northern California, and British Columbia. It is not a single fault-trace layer; rather, it is an open integrated database for Cascadia earthquake-hazard and tectonic studies with ScienceBase files, an ArcGIS map package, web map, and StoryMap access.","open public ScienceBase data release; full package very large, individual files and metadata accessible","open-data, public-domain",official USGS ScienceBase compilation data release,https://data.usgs.gov/datacatalog/data/USGS%3A623cf2a6d34e915b67d47586 | https://doi.org/10.5066/P9O69X6E | https://www.sciencebase.gov/catalog/item/623cf2a6d34e915b67d47586 | https://www.sciencebase.gov/catalog/item/623cf2a6d34e915b67d47586?format=json | https://usgs.maps.arcgis.com/apps/instant/basic/index.html?appid=db391c919fc143e2b5afe328d66c090c | https://geonarrative.usgs.gov/cascadia_database_storymap/,download,regional Cascadia subduction-zone compilation,not a single feature layer; multi-layer ArcGIS map package and webmap compilation,"ScienceBase lists Cascadia_Database.mpk 3,444,947,251 bytes plus 7,793,274-byte webmap access docx and 129,681-byte XML metadata"
Geology · Faults,Simplified frontal thrust splay fault geometries at the Cascadia Subduction Zone,U.S. Geological Survey Earthquake Hazards Program / ScienceBase,Offshore Cascadia frontal thrust splay fault geometries,Simplified frontal thrust splay fault geometries at the Cascadia Subduction Zone mapped using multi-channel seismic (MCS) reflection data,"Cascadia Subduction Zone, U.S. Pacific Northwest offshore margin",U.S. public domain / Public Domain Mark 1.0,"CSV fault-geometry files, CSV deformation-front file, PDF references, ScienceBase aggregate zip",USGS Science Data Catalog and ScienceBase data release with direct CSV downloads and aggregate zip,https://data.usgs.gov/datacatalog/data/USGS%3A69e7a5e8b66b0164d0f72586,yes,"Lucas, M., Ledeczi, A., Dunham, A.M., and Watt, J.T. (2026), Simplified frontal thrust splay fault geometries at the Cascadia Subduction Zone mapped using multi-channel seismic (MCS) reflection data, U.S. Geological Survey data release, https://doi.org/10.5066/P138BZRA",Data 2021-06-01 to 2024-06-01; publication 2026-05-07,Current USGS data release for six offshore frontal thrust splay faults (A-F) and a deformation-front trace. Faults A-C are mapped from CASIE21 ultra-long-offset MCS reflection data; D uses one CASIE21 line; E-F use legacy Mendocino Triple Junction data and published interpretations. The geometries were developed for 3D ground-motion simulations.,fault-v013-usgs-offshore-cascadia-faults,该 USGS 2026 数据发布提供 Cascadia 俯冲带近海前缘逆冲分支断层的简化几何，包含 A-F 六条逆冲断层和变形前缘位置。文件以 CSV 形式给出二维解释拾取、插值后的断层几何以及参考文献，主要基于 CASIE21 多道地震反射资料和 Mendocino Triple Junction 旧资料，适合三维地震动、海啸和俯冲带断层几何建模。,"This 2026 USGS data release provides simplified geometries for six offshore frontal thrust splay faults (A-F) at the Cascadia Subduction Zone, plus the deformation-front location. CSV files include 2D seismic interpretation picks and interpolated geometries used in kinematic rupture models, drawing on CASIE21 multi-channel seismic reflection data and legacy Mendocino Triple Junction data. It is a high-value current source for Cascadia 3D ground-motion, tsunami, and subduction-zone fault-geometry modeling.",open public ScienceBase data release; direct CSV files and aggregate zip verified,"open-data, public-domain",official USGS ScienceBase geophysical fault-geometry data release,https://data.usgs.gov/datacatalog/data/USGS%3A69e7a5e8b66b0164d0f72586 | https://doi.org/10.5066/P138BZRA | https://www.sciencebase.gov/catalog/item/69e7a5e8b66b0164d0f72586 | https://www.sciencebase.gov/catalog/item/69e7a5e8b66b0164d0f72586?format=json | https://www.sciencebase.gov/catalog/file/get/69e7a5e8b66b0164d0f72586,download,six offshore frontal thrust fault geometries plus deformation-front trace,6 thrust faults (A-F) plus deformation_front.csv,"ScienceBase aggregate zip 482,585 bytes; individual CSV files range from 261 bytes to 1,080,563 bytes"
Geology · Faults,New York Bight Fault Zone interpretation shapefile,U.S. Geological Survey Woods Hole Coastal and Marine Science Center,Offshore fault-zone interpretation from high-resolution seismic data,"Interpretation of the New York Bight Fault Zone on the inner-continental shelf within the New York Bight, derived from seismic data collected by the U.S. Geological Survey, 1995-1999 (Esri polyline shapefile, Geographic, WGS84)","Inner continental shelf within the New York Bight, Long Island nearshore Atlantic margin, United States",U.S. public domain / Public Domain Mark 1.0,"Esri polyline shapefile (Geographic, WGS84), USGS Open-File Report web pages and metadata","USGS Science Data Catalog links to USGS Open-File Report 02-152 data and metadata; GIS page/report URL verified, direct zip path not yet isolated in v013",https://data.usgs.gov/datacatalog/data/USGS%3Ae2869ebd-0fcf-499b-baee-288dc80f83df,yes,"Denny, J.F. (2002), Interpretation of the New York Bight Fault Zone on the inner-continental shelf within the New York Bight, USGS SDC record; associated with USGS Open-File Report 02-152. No registered DOI listed.",Seismic data 1995-05-01 to 1998-11-01; publication 2002; SDC metadata date 2024-03-18,"Accepted as a legacy but public USGS offshore fault interpretation. SDC says the New York Bight fault was clearly evident in high-resolution CHIRP, boomer and 15 cubic inch water-gun seismic records and mapped as an Esri polyline shapefile. The ScienceBase item ID form returns 404 and v013 did not locate a direct zip URL under the Open-File Report site, so future work should inspect the report media/GIS directory more deeply.",fault-v013-usgs-offshore-cascadia-faults,New York Bight Fault Zone interpretation shapefile 是 USGS Woods Hole 2002 年发布的纽约湾内陆架断层解释数据，来源于 1995-1999 年采集的 CHIRP、boomer 和小型水枪高分辨率地震资料。SDC 记录说明该断层在地震剖面中清晰可见，并被制作为 WGS84 地理坐标的 Esri 线状 Shapefile；本轮已验证 SDC 和 OFR 02-152 报告入口，但直接 zip 路径仍需后续定位。,"The New York Bight Fault Zone interpretation shapefile is a USGS Woods Hole legacy offshore-fault dataset derived from CHIRP, boomer, and small water-gun seismic data collected in 1995-1999. The SDC record states that the fault is clearly evident in the high-resolution seismic records and was mapped as an Esri polyline shapefile in geographic WGS84 coordinates. This pass verified the SDC record and OFR 02-152 report entry, while leaving direct zip-path discovery for a later follow-up.",open public USGS SDC/OFR record; direct file path needs follow-up localization,"open-data, public-domain",official USGS coastal and marine geoscience legacy GIS data record,https://data.usgs.gov/datacatalog/data/USGS%3Ae2869ebd-0fcf-499b-baee-288dc80f83df | https://pubs.usgs.gov/of/2002/of02-152/ | https://pubs.usgs.gov/of/2002/of02-152/HTML/APR.HTM,download,local offshore New York Bight inner-shelf fault-zone interpretation,not counted in v013; SDC describes an Esri polyline shapefile,not isolated in v013; SDC describes shapefile availability through OFR 02-152
Geology · Faults,QUIN 1.0 Quaternary Fault Strain Indicators Database,"Lavecchia, Bello, Andrenacci, Cirillo, Ferrarini, Vicentini, de Nardis and Brozzetti via PANGAEA",Quaternary fault-slip and strain indicators,QUaternary fault strain INdicators database - QUIN 1.0 - first release from the Apennines of central Italy,Central Italy intra-Apennine extensional belt,"PANGAEA open data; data citation required, detailed reuse terms to follow PANGAEA license/terms","PANGAEA landing page, text table, WGS84 shapefile described by metadata, Google Earth view, machine metadata JSON-LD/DataCite/ISO",PANGAEA DOI landing page with textfile and machine metadata downloads; dataset page describes release as .txt table and shapefile in WGS84,https://doi.pangaea.de/10.1594/PANGAEA.934802,yes,"Lavecchia et al. (2021), QUaternary fault strain INdicators database: QUIN 1.0 - first release from the Apennines of central Italy, PANGAEA, https://doi.org/10.1594/PANGAEA.934802; related Scientific Data paper https://doi.org/10.1038/s41597-022-01311-8",Published 2021-08-10; Quaternary fault-slip indicators over the last 2.5 Ma; DOI registered 2022-05-17,"Accepted as a fault-observation/strain-indicator dataset rather than a national fault-trace inventory. PANGAEA states QUIN 1.0 includes 3,339 fault-striation-pair records from about 455 survey sites along Quaternary hosting faults in central Italy, with geometry, kinematics, quality ranking, references and deformation-axis fields. Distinct from DISS, ITHACA, SFIT and Fault2SHA because it exposes local-scale structural observations and derived kinematic parameters.",fault-v014-quin-apennines-literature-repository-data,"QUIN 1.0 是意大利中亚平宁第四纪伸展断层带的断层擦痕/滑动指标数据库，PANGAEA 页面记录 3,339 条 Fault Striation Pair，分布在约 455 个沿断层调查站点。数据以文本表和 WGS84 Shapefile 形式发布，字段包括断层几何、运动学、质量等级、参考文献和变形轴参数；它补充的是局部构造观测和应变反演输入，而不是普通断层线清单。","QUIN 1.0 is a Quaternary fault-slip and strain-indicator database for the central Italian intra-Apennine extensional belt. PANGAEA documents 3,339 Fault Striation Pair records from about 455 survey sites along Quaternary host faults, released as a text table and WGS84 shapefile with geometry, kinematics, quality ranking, references, and deformation-axis fields. It complements fault-source catalogues with local structural observations and kinematic inputs rather than serving as a simple fault-trace inventory.",open PANGAEA DOI record with textfile/machine metadata; shapefile described in dataset metadata,"open-data repository, citation-required",peer-reviewed PANGAEA research data repository record,https://doi.pangaea.de/10.1594/PANGAEA.934802 | https://doi.org/10.1594/PANGAEA.934802 | https://doi.pangaea.de/10.1594/PANGAEA.934802?format=textfile | https://doi.pangaea.de/10.1594/PANGAEA.934802?format=metadata_jsonld | https://doi.org/10.1038/s41597-022-01311-8,download,~550 km along-strike central Italy intra-Apennine belt; WGS84 structural-observation shapefile/table,"3,339 FSP records and about 455 survey sites reported by PANGAEA metadata",not summarized on PANGAEA landing page; textfile and machine metadata endpoints verified
Geology · Faults,Quaternary-Host Faults Database 2.0 (Southern Italy),"Lavecchia, Bello, Cirillo, Pietrolungo and Brozzetti via Zenodo",Southern Apennines Quaternary host-fault traces,Q-host faults database 2.0; Quaternary faults hosting QUIN 2.0 structural sites,"Southern Apennines and northeastern Sicily, southern Italy","Zenodo open dataset; license not displayed in scraped lines, reuse terms to verify from Zenodo metadata","Zenodo ZIP package, README PDF, shapefile inside ZIP per dataset description",Zenodo DOI landing page with downloadable ZIP and README PDF,https://zenodo.org/records/10370819,yes,"Lavecchia, G., Bello, S., Cirillo, D., Pietrolungo, F., and Brozzetti, F. (2023), Quaternary-Host Faults Database 2.0 (Southern Italy), Zenodo, https://doi.org/10.5281/zenodo.10370819; supplemental to QUIN 2.0, https://doi.org/10.5281/zenodo.8414734",Published 2023-12-13; Version v2; modified 2024-07-08,"Accepted as the host-fault trace layer paired with QUIN 2.0. Zenodo describes an original GIS compilation of Quaternary faults hosting or neighboring the QUIN 2.0 structural sites, following the QUIN 1.0 host-fault approach. The Zenodo page lists a 319.3 kB data ZIP and 609.0 kB README PDF. This is distinct from broader Italy source models and from QUIN 1.0 because it extends the host-fault layer into southern Italy/Sicily.",fault-v014-quin-apennines-literature-repository-data,Quaternary-Host Faults Database 2.0 是 QUIN 2.0 的配套南意大利 host-fault 数据，记录承载或邻近 QUIN 2.0 构造站点的第四纪断层。Zenodo 页面说明该库是在 GIS 平台上编译的原始断层线数据，提供数据 ZIP 和 README PDF，适合将南亚平宁和西西里东北部的局部断层滑动观测与可制图断层迹线对应起来。,"Quaternary-Host Faults Database 2.0 is the host-fault trace companion to QUIN 2.0 for southern Italy. The Zenodo record describes an original GIS compilation of Quaternary faults hosting or neighboring QUIN 2.0 structural sites, with a data ZIP and README PDF. It is useful for linking local fault-slip observations in the southern Apennines and northeastern Sicily to mapped Quaternary fault traces.",open Zenodo landing page and download links; API returned 403 during v014 but HTML/file URLs were used for verification,"open repository dataset, license-to-verify",Zenodo research data repository record linked to Scientific Data QUIN 2.0 article,https://zenodo.org/records/10370819 | https://doi.org/10.5281/zenodo.10370819 | https://zenodo.org/records/10370819/files/Lavecchia_et_al_2023_Quaternary_Host_Faults_Database_2_Southern_Apennines.zip?download=1 | https://zenodo.org/records/10370819/files/README_Lavecchia_et_al_2023_Quaternary_Host_Faults_Database_2.0_Southern_Italy.pdf?download=1 | https://doi.org/10.5281/zenodo.8414734 | https://doi.org/10.1038/s41597-024-03008-6,download,Southern Italy / Southern Apennines host-fault GIS compilation for QUIN 2.0 structural sites,245 linear host-fault records reported by Scientific Data QUIN 2.0 article for the related HF database,Zenodo lists 319.3 kB data ZIP and 609.0 kB README PDF; total listed files 928.3 kB
Geology · Faults,Colorado NGDS Active Faults MapServer,Colorado Geological Survey / National Geothermal Data System / NBMG-hosted ArcGIS Server,Statewide active fault traces for geothermal and hazard context,COActiveFaults; ActiveFault layer; Colorado active faults data collected for the National Geothermal Data System,"Colorado, United States",Public NGDS/AASG-style ArcGIS service; explicit reuse license not stated on service metadata,"ArcGIS MapServer/Feature Layer, JSON query, WMS/WFS/KML capabilities described by service metadata",Public NBMG-hosted ArcGIS REST MapServer layer 0 with JSON query endpoint,https://web2.nbmg.unr.edu/arcgis/rest/services/CO_Data/COActiveFaults/MapServer,yes,"Colorado Geological Survey active faults data for the National Geothermal Data System; CO_Data/COActiveFaults MapServer, layer ActiveFault",NGDS-era service originally published with ArcServer 10.3 metadata; current ArcGIS REST reports version 11.5,"Accepted as a statewide active-fault feature service distinct from the already cataloged Published Faults of the Colorado Front Range (OF-03-04), which is a regional published-fault compilation. Layer metadata states the data table includes fault location, geologic setting, position accuracy, description, displacement and citations. Count query returned 427 features. Service metadata describes WMS, WFS and KML interoperability, but v015 verified ArcGIS REST JSON only.",fault-v015-ngds-active-fault-services-and-deferred-asia-leads,Colorado NGDS Active Faults MapServer 是 Colorado Geological Survey 为 National Geothermal Data System 提供的州级活动断层线服务，由 NBMG 托管在 ArcGIS Server 上。图层元数据说明属性表包含断层位置、地质背景、位置精度、描述、位移和引用信息，v015 的 count 查询返回 427 条要素；它补充的是全州活动断层/地热勘查背景服务，不同于已收录的 Colorado Front Range 区域已发表断层汇编。,"The Colorado NGDS Active Faults MapServer is a statewide active-fault line service supplied by the Colorado Geological Survey for the National Geothermal Data System and hosted on an NBMG ArcGIS Server. Layer metadata states that the table includes fault location, geologic setting, positional accuracy, description, displacement and citations, and the v015 count query returned 427 features. It complements the existing Colorado Front Range published-fault compilation with a statewide active-fault/geothermal-context service.",open public ArcGIS REST service; explicit reuse license not stated,"open-access service, license-to-verify",official/state geological survey data exposed through NGDS ArcGIS service,https://web2.nbmg.unr.edu/arcgis/rest/services/CO_Data/COActiveFaults/MapServer | https://web2.nbmg.unr.edu/arcgis/rest/services/CO_Data/COActiveFaults/MapServer/0 | https://web2.nbmg.unr.edu/arcgis/rest/services/CO_Data/COActiveFaults/MapServer/0/iteminfo | https://web2.nbmg.unr.edu/arcgis/rest/services/CO_Data/COActiveFaults/MapServer/0/query?where=1%3D1&returnCountOnly=true&f=json | https://nbmg.unr.edu/geothermal/NGDS.html,api,statewide Colorado active-fault feature layer,427 features from ArcGIS returnCountOnly query,dynamic ArcGIS MapServer/Feature Layer service
