category,name,provider,theme_canonical,theme_raw,coverage,license,formats,access,url,verified_alive,doi_or_citation,time_span,notes,seen_in_passes,desc_zh,desc_en,access_status,openness,source_type,evidence,access_class,scale,feature_count,file_size
Geology · Faults,Utah Quaternary Faults,Utah Geological Survey / Utah Geospatial Resource Center,State Quaternary faults,Quaternary faults and folds; Utah active faults; seismic-hazard source faults,"Utah, United States",Utah SGID open data; attribution requested; no constraints/warranties stated,"ArcGIS FeatureServer, GeoJSON/PBF query, SGID/Open Data download",UGRC product page; ArcGIS open-data page; FeatureServer query/extract endpoint,https://gis.utah.gov/products/sgid/geoscience/quaternary-faults/,yes,Utah Geological Survey Quaternary Fault and Fold Database and Map of Utah; UGRC SGID Utah Quaternary Faults layer,Quaternary faults; service description says incorporated formally published sources through 2025,"FeatureServer layer supports Query and Extract, JSON/GeoJSON/PBF formats, and returnCountOnly reported 19,743 line features during v003 verification.",fault-v003-us-state-open-data,"Utah Quaternary Faults 是犹他州地质调查局维护、UGRC/SGID 发布的第四纪活动断层与相关褶皱线数据。数据用于表征可能产生大地震的断层与褶皱，FeatureServer 支持查询和提取，并可返回 GeoJSON/PBF。v003 验证时服务计数接口返回 19,743 条线要素，说明这是可程序访问的开放服务而非静态说明页。","Utah Quaternary Faults is the Utah Geological Survey fault-and-fold line dataset published through UGRC/SGID. It represents faults and related folds considered potential large-earthquake sources, with FeatureServer query and extract support and JSON/GeoJSON/PBF output. During v003 verification, the count endpoint returned 19,743 line features, confirming programmatic access rather than a static documentation page.",open-service/download,open,official state geospatial open-data service,https://gis.utah.gov/products/sgid/geoscience/quaternary-faults/ | https://opendata.gis.utah.gov/datasets/utahDNR::utah-quaternary-faults/about | https://services.arcgis.com/ZzrwjTRez6FJiOq4/arcgis/rest/services/Utah_Quaternary_Faults_20201207/FeatureServer/1 | https://ugspub.nr.utah.gov/publications/data_series/ds-7/ds-7.pdf,download+service,state geologic hazard database; 2025 service lineage,"19,743 line features by FeatureServer returnCountOnly",
Geology · Faults,Quaternary faults and folds in Alaska: A digital database (MP 141),Alaska Division of Geological & Geophysical Surveys,State Quaternary faults,Alaska Quaternary faults and folds; paleoseismic parameters; active fault traces,"Alaska, United States",public state publication/download; use constraints to verify in metadata,"ESRI Shapefile, PDF report, map sheet, FGDC metadata",DGGS publication page with direct shapefile download and metadata,https://dggs.alaska.gov/pubs/id/23944,yes,"Koehler et al. (2012), Quaternary faults and folds in Alaska: A digital database, Alaska DGGS MP 141, https://doi.org/10.14509/23944",compiled 2002-2012; Quaternary faults defined as past 1.6 Ma in metadata,"DGGS page lists a free Shapefile download (432.1 kB), PDF report, statewide map sheet, metadata and readme. Metadata says it is a vector dataset of faults and folds believed to be sources of M>6 earthquakes.",fault-v003-us-state-open-data,Alaska DGGS MP 141 是阿拉斯加第四纪断层与褶皱数字数据库，汇总可能产生 M>6 地震的断层和相关褶皱，并记录最近变形年代、滑动速率、运动性质、倾向和制图可靠性等属性。出版页提供免费 Shapefile、报告、地图和元数据下载。它是美国 QFFDB 阿拉斯加部分的重要州级源资料。,"Alaska DGGS MP 141 is a digital database of Quaternary faults and folds in Alaska, compiling structures believed to be sources of M>6 earthquakes with attributes such as age of most recent deformation, slip rate, slip sense, dip direction, and mapping reliability. The publication page provides a free shapefile, report, map sheet, and metadata. It is an important state-level source for the Alaska portion of the U.S. Quaternary fault archive.",open-download,open,official state geologic survey publication/data release,https://dggs.alaska.gov/pubs/id/23944 | https://doi.org/10.14509/23944 | https://dggs.alaska.gov/metadata/MP141.faq.html | https://dggs.alaska.gov/digitaldata/readme?distID=2319,download,"statewide 1:3,700,000 map sheet; source scales vary",,432.1 kB shapefile package listed by DGGS
Geology · Faults,"Alaska Fault Trace Mapping, 2021",U.S. Geological Survey Alaska Science Center,High-resolution Alaska fault traces,ArcticDEM-derived fault and fold traces; revised active faults; newly recognized active structures,"Alaska Range, Brooks Range, Yukon and other Alaska regions within listed spatial extent",public U.S. government dataset,"USGS data release, XML metadata, digital geospatial data",Data.gov metadata; DOI landing page; USGS data release,https://catalog.data.gov/dataset/alaska-fault-trace-mapping-2021,yes,"USGS Alaska Fault Trace Mapping, 2021, DOI https://doi.org/10.5066/P9H02FXB",dataset last updated 2025-05-24 in Data.gov; based on ArcticDEM 3.0 mapping,"Data.gov states the dataset is a detailed 1:10,000 digital map based on ArcticDEM 3.0, revising known active faults/folds or identifying active structures not previously recognized.",fault-v003-us-state-open-data,"Alaska Fault Trace Mapping, 2021 是 USGS Alaska Science Center 发布的高分辨率断层与褶皱迹线数据，基于 ArcticDEM 3.0 在约 1:10,000 尺度上识别地貌线索。数据用于修订 USGS QFFDB 中已知活动断层/褶皱的位置精度，也记录部分此前未识别的活动构造。它可作为 MP 141 与 QFFDB 之外的阿拉斯加高分辨率补充线索。","Alaska Fault Trace Mapping, 2021 is a USGS Alaska Science Center high-resolution digital map of fault and fold traces interpreted from ArcticDEM 3.0 at about 1:10,000 scale. The dataset revises locations of known active faults and folds archived in the USGS Quaternary Fault and Fold Database and identifies some previously unrecognized active structures. It is a high-resolution Alaska supplement to MP 141 and the national QFFDB.",open-data release,open,official federal government data release,https://catalog.data.gov/dataset/alaska-fault-trace-mapping-2021 | https://doi.org/10.5066/P9H02FXB | https://data.usgs.gov/datacatalog/metadata/USGS.ASC370.xml,download,"1:10,000 digital mapping",,
Geology · Faults,Washington Earthquakes and Faults - Quaternary Active Faults,Washington Geological Survey / Washington Department of Natural Resources,State Quaternary active faults,Quaternary active faults; active folds; trenches; earthquake damage and catalogs,"Washington State, United States",Washington DNR open data/service terms to verify,"ArcGIS MapServer, JSON/GeoJSON/PBF query, open data map layer",Washington DNR ArcGIS open-data map; ArcGIS REST MapServer layer,https://data-wadnr.opendata.arcgis.com/maps/10322d41caef4b51a5fd56408b2f8bd5,yes,Washington Geological Survey Earthquakes and Faults database / Quaternary Active Faults layer,Quaternary active faults; major dataset update announced May 2025; service live in 2026,"ArcGIS REST service layer 12 exposes Quaternary Active Faults as polylines with JSON/GeoJSON/PBF query support; returnCountOnly reported 1,276 active-fault line features during v003 verification.",fault-v003-us-state-open-data,"Washington Earthquakes and Faults 数据库包含华盛顿州地震成因要素，其中 Quaternary Active Faults 图层记录有第四纪活动证据的断层线。WADNR/Washington Geological Survey 的 REST 服务还包括活动褶皱、探槽、地震目录和历史震害等相关层。v003 验证时活动断层图层支持 JSON/GeoJSON 查询，并返回 1,276 条线要素。","The Washington Earthquakes and Faults database contains seismogenic features for Washington State, including a Quaternary Active Faults polyline layer for faults with demonstrable Quaternary activity. The WADNR/Washington Geological Survey REST service also includes active folds, trenches, earthquake catalog layers, and historical damage. During v003 verification, the active-fault layer supported JSON/GeoJSON query output and returned 1,276 line features.",open-service/download,open,official state geospatial open-data service,https://data-wadnr.opendata.arcgis.com/maps/10322d41caef4b51a5fd56408b2f8bd5 | https://gis-qa.dnr.wa.gov/site1/rest/services/Public_Geology/Earthquakes_and_Faults/MapServer | https://gis-qa.dnr.wa.gov/site1/rest/services/Public_Geology/Earthquakes_and_Faults/MapServer/12 | https://washingtonstategeology.wordpress.com/2025/05/06/major-update-to-the-washington-quaternary-active-faults-dataset/,download+service,statewide Quaternary active-fault layer,"1,276 active-fault line features by MapServer returnCountOnly",
Geology · Faults,Mexico Quaternary Fault Database,Terra Digitalis / Universidad Nacional Autónoma de México (UNAM),National Quaternary faults,Mexican Quaternary faults; fault geometry; sense of movement; last displacement; slip rate; recurrence interval,Mexico,CC-SA 4.0 stated in GeoNode restrictions; layer license field says Not Specified,"GeoJSON, ESRI Shapefile ZIP, GML, CSV, Excel, WMS/WFS",Terra Digitalis GeoNode layer; GeoServer WFS direct download; downloadable map layer,https://desarrollo.terradigitalis.unam.mx/layers/geonode_data:geonode:fallasABC,yes,"Cid Villegas, G., Ferrari, L., and Mendoza, C. (2017), Mexico Quaternary Fault Database, Terra Digitalis 1.1(9)",published in Terra Digitalis; GeoNode publication date 2022-01-21; Quaternary fault activity fields,"GeoNode detail page states anyone can view/download the vector layer and offers Original Dataset, Shapefile, CSV, Excel and GeoJSON downloads. A direct WFS GeoJSON request returned feature content during v004 verification.",fault-v004-mexico-geonode,Mexico Quaternary Fault Database 是 UNAM Terra Digitalis/GeoNode 发布的墨西哥第四纪断层矢量图层，汇总断层几何、运动性质、活动证据、历史地震、震级、最大位移、滑动速率、复发间隔和参考文献等字段。图层页面显示 Anyone 可下载，并提供 Shapefile、GeoJSON、CSV、Excel 和 WFS 等访问方式。该库填补了墨西哥国家级第四纪断层资料的开放入口。,"The Mexico Quaternary Fault Database is a Terra Digitalis/UNAM GeoNode vector layer synthesizing Mexican Quaternary fault geometry, movement sense, activity evidence, historical earthquakes, magnitude, maximum displacement, slip rate, recurrence interval, and references. The layer page allows public downloads and offers Shapefile, GeoJSON, CSV, Excel, and WFS access. It provides a strong open national entry point for Mexican Quaternary fault data.",open-download/service,partly-open,university GeoNode geospatial data portal,https://desarrollo.terradigitalis.unam.mx/layers/geonode_data:geonode:fallasABC | https://desarrollo.terradigitalis.unam.mx/geoserver/ows?outputFormat=json&request=GetFeature&service=WFS&srs=EPSG:4326&srsName=EPSG:4326&typename=geonode:fallasABC&version=1.0.0 | https://terradigitalis.igg.unam.mx/html/ojs3/index.php/terra_digitalis/article/view/3/50,download+service,national Quaternary fault database,,
Geology · Faults,British Columbia Digital Geology - Geology Faults,Government of British Columbia / BC Geological Survey / BC Geographic Warehouse,Provincial geologic faults,bedrock geology faults; GEOL_FAULT_LINE; British Columbia Digital Geology,"British Columbia, Canada",Open Government Licence - British Columbia / Canada open data portal listing,"SHP ZIP, KML, WMS, BC Geographic Warehouse custom download",Canada Open Government portal; BC Data Catalogue; direct shapefile ZIP download,https://open.canada.ca/data/en/dataset/c94e0c13-5385-49c1-9922-822e10135fc6,yes,"Government of British Columbia, Geology Faults / British Columbia Digital Geology",2018 shapefile package; maintained provincial digital geology layer,"This is a general bedrock/geologic fault layer, not an active-fault hazard database. The open portal describes it as part of British Columbia Digital Geology and lists a direct 4.7 MB shapefile ZIP plus BC Geographic Warehouse access.",fault-v004-canada-bc-geology,British Columbia Geology Faults 是加拿大开放政府门户收录的省级地质断裂线数据，属于 British Columbia Digital Geology 的 bedrock geology 数据源。它不是活动断层危险性库，而是省域地质图框架中的一般断层线图层，适合用于地质构造背景、矿产/地质制图和与活动断层库的空间对照。门户提供直接 Shapefile ZIP、KML/WMS/BC Geographic Warehouse 等入口。,"British Columbia Geology Faults is a provincial geologic fault-line layer listed in Canada’s open data portal as part of British Columbia Digital Geology. It is not an active-fault hazard database; rather, it is a general bedrock-geology fault layer useful for structural context, geologic mapping, mineral studies, and comparison with active-fault datasets. The portal provides a direct shapefile ZIP plus KML/WMS/BC Geographic Warehouse access routes.",open-download/service,open,official government open-data portal,https://open.canada.ca/data/en/dataset/c94e0c13-5385-49c1-9922-822e10135fc6 | https://catalogue.data.gov.bc.ca/dataset/geology-faults | https://catalogue.data.gov.bc.ca/dataset/c94e0c13-5385-49c1-9922-822e10135fc6/resource/7bd13434-31dd-405f-9e21-c7b2f2e01fc3/download/geologyfaults2018.zip,download+service,"1:50,000 to 1:250,000 source compilations",,4.7 MB shapefile ZIP by HEAD check
Geology · Faults,Major faults in Iran (flt2cg),U.S. Geological Survey World Energy Project,Country major geologic faults,Iran major faults; geologic map arcs; thrust faults; petroleum province context,Iran,Public Domain / U.S. Government work,downloadable GIS data via DOI/ScienceBase; FGDC XML metadata,USGS Science Data Catalog; DOI landing page; Data.gov metadata,https://data.usgs.gov/datacatalog/data/USGS%3A60a82961d34ea221ce4e607a,yes,"Pollastro, R.M., Persits, F.M., and Steinshouer, D.W. (1999), Major faults in Iran (flt2cg), USGS data release, https://doi.org/10.5066/P9TMSOQ0",data dates 1999-09; USGS metadata updated 2021,"Accepted as a country-level major geologic fault dataset, not an active-fault inventory. The Data.gov and USGS catalog records identify access level public and geospatial downloadable GIS data.",fault-v004-iran-usgs,Major faults in Iran (flt2cg) 是 USGS World Energy Project 发布的伊朗主要断层 GIS 数据，服务于伊朗地质图、地质省和油气资源评价背景。它不是现代活动断层数据库，但提供了国家尺度主要地质断层线索，并带有公开 DOI 和 FGDC 元数据。对伊朗活动构造研究而言，它可作为基础构造框架层，而活动性判断仍需结合 Hessami 等活动断层资料或区域研究。,"Major faults in Iran (flt2cg) is a USGS World Energy Project GIS dataset of major Iranian faults used with geologic-map and petroleum-province context. It is not a modern active-fault inventory, but it provides an open country-scale structural fault layer with DOI and FGDC metadata. For Iranian active-tectonics work, it should be treated as a background structural layer and combined with dedicated active-fault studies.",public data release,open,official government data release,https://data.usgs.gov/datacatalog/data/USGS%3A60a82961d34ea221ce4e607a | https://catalog.data.gov/dataset/major-faults-in-iran-flt2cg | https://doi.org/10.5066/P9TMSOQ0 | https://data.usgs.gov/datacatalog/metadata/USGS.60a82961d34ea221ce4e607a.xml,download,country-scale geologic map / petroleum province assessment,,
Geology · Faults,SCEC Community Fault Model (CFM) v7.0,Statewide California Earthquake Center (SCEC) / Zenodo,3D active fault geometry,3D fault surfaces; fault traces; active faults; California Community Fault Model,California and adjacent offshore basins; v7.0 spans northern Mexico to southern Cascadia,BSD-3-Clause,"GOCAD tsurf, SHP, GMT, KML, metadata spreadsheets, ZIP archive, Explorer export",Zenodo DOI archive; SCEC CFM Explorer; SCEC project page,https://zenodo.org/records/13685611,yes,"Plesch, A., Marshall, S., and Shaw, J. (2024), SCEC Community Fault Model (CFM) v7.0, Zenodo, https://doi.org/10.5281/zenodo.13685611; Plesch et al. (2007)",CFM 7.0 published 2024; statewide California active-fault geometry update,"Zenodo record states CFM 7.0 contains 608 fully documented fault objects across preferred, rupture, and alternative submodels; the preferred model has 556 fault objects. Archive size is 120.1 MB.",fault-v004-scec-cfm,SCEC Community Fault Model v7.0 是加州及邻近海域活动断层的三维几何模型，整合地表迹线、地震活动、反射剖面、井资料、地质剖面和其他约束。Zenodo 归档提供 GOCAD tsurf 三维面、不同分辨率网格、Shapefile/GMT/KML 断层迹线和完整元数据；CFM Explorer 可按断层浏览和下载。v7.0 首次扩展到全加州，是二维活动断层线之外的重要三维断层几何资源。,"SCEC Community Fault Model v7.0 is a three-dimensional geometric model of active faults in California and adjacent offshore basins, constrained by surface traces, seismicity, reflection profiles, wells, geologic cross sections, and other data. The Zenodo archive provides GOCAD tsurf surfaces, multiple mesh resolutions, Shapefile/GMT/KML traces, and metadata, while the CFM Explorer supports interactive browsing and download. Version 7.0 extends coverage statewide and is a key 3D complement to 2D active-fault trace datasets.",open-download/explorer,open,DOI research data repository and web explorer,https://zenodo.org/records/13685611 | https://doi.org/10.5281/zenodo.13685611 | https://www.scec.org/science/community-fault-model/ | https://central.scec.org/research/cfm-explorer/,download+service,3D fault surfaces; statewide California v7.0,608 fully documented fault objects; 556 preferred fault objects,120.1 MB ZIP archive listed by Zenodo
Geology · Faults,SCEC Geologic Slip Rate Database (GSRD),Statewide California Earthquake Center (SCEC),Fault slip-rate observations,geologic slip rate estimates; active faults; California Nevada northern Mexico,"California, Nevada, small parts of Arizona and northern Mexico",SCEC public web database; archive DOI pending per page,"web explorer, CSV download for selected/all queried sites",SCEC database page; GSRD Explorer; CSV download through explorer selection,https://southern.scec.org/research/gsrd,yes,SCEC Geologic Slip Rate Database v2023.09; based on USGS NSHM23_EQGeoDB_v2 and UCERF3 Appendix B lineage,version 2023.09; includes studies published up to December 2020 in first release criteria,"Page says the full archive with DOI is coming soon, but the explorer already supports querying and downloading selected site metadata in CSV. Treat as open web database with evolving archive status, not a replacement for primary literature.",fault-v004-scec-gsrd,SCEC Geologic Slip Rate Database 汇总加州、内华达、亚利桑那局部和墨西哥北部活动断层的野外地质滑动速率估计，并将站点位置、滑动速率、不确定性和文献链接组织到可查询网页工具中。当前 v2023.09 初版主要继承 USGS NSHM23_EQGeoDB_v2 和 UCERF3 Appendix B 中符合条件的资料。Explorer 支持按断层名、站点名、坐标和速率范围查询，并下载 27 列元数据 CSV。,"The SCEC Geologic Slip Rate Database compiles field-derived geologic slip-rate estimates for active faults in California, Nevada, small parts of Arizona, and northern Mexico, linking site locations, rates, uncertainties, and source publications in a searchable web tool. The current v2023.09 release mainly carries forward qualifying records from USGS NSHM23_EQGeoDB_v2 and UCERF3 Appendix B. The Explorer supports searches by fault, site, location, and rate range, with CSV download of the full 27-column metadata for selected sites.",open web database; DOI archive pending,partly-open,research center web database/explorer,https://southern.scec.org/research/gsrd | https://central.scec.org/research/gsrd-explorer/ | https://doi.org/10.5066/P9AU713N | https://pubs.usgs.gov/of/2013/1165/,service+csv,regional site database,,
Geology · Faults,South East France Potentially Active Faults (SEFPAF),Université Grenoble Alpes / ASNR / BRGM collaborators via Zenodo,Regional potentially active faults,potentially active faults; seismogenic potential; structural components; seismic hazard source screening,South-East France,CC-BY-4.0,"CSV, HTML interactive map, Jupyter notebook, input CSV ZIP",Zenodo DOI record download; ESSD preprint documentation,https://zenodo.org/records/17235395,yes,"Mowbray et al. (2025), South East France Potentially Active Faults, Zenodo, https://doi.org/10.5281/zenodo.17235395; ESSD preprint https://doi.org/10.5194/essd-2025-601",dataset published 2025; ESSD discussion started 2025-12-27; potentially active fault compilation,"Accepted as a current Zenodo research dataset despite article/preprint discussion status. Zenodo API lists SEFPAF.csv, SEFPAF.html, compilation code, and INPUT.zip under CC BY 4.0.",fault-v004-france-sefpaf,SEFPAF 是东南法国潜在活动断层资料汇编，整合地质图、既有新构造数据库和断层专项研究中的结构、运动学和新构造信息，并给出重要性、文献完备度和潜在发震性等指标。Zenodo 提供 CSV 主表、交互式 HTML 地图、编译代码和输入 CSV 压缩包，许可为 CC BY 4.0。它适合作为低至中等地震活动区构建断层型震源模型和筛选重点断层的开放数据源。,"SEFPAF is a South-East France potentially active fault compilation integrating structural, kinematic, and neotectonic information from geologic maps, prior neotectonic databases, and fault-specific studies. It provides indices for importance, documentation level, and seismogenic potential. Zenodo distributes the main CSV, an interactive HTML map, compilation code, and input CSV archive under CC BY 4.0, making it useful for fault-based source-model screening in a low-to-moderate seismicity region.",open-download,open,DOI research data repository,https://zenodo.org/records/17235395 | https://doi.org/10.5281/zenodo.17235395 | https://essd.copernicus.org/preprints/essd-2025-601/ | https://doi.org/10.5194/essd-2025-601,download,regional potentially active-fault compilation,,SEFPAF.csv 2.0 MB; SEFPAF.html 21.1 MB; INPUT.zip 1.1 MB listed by Zenodo API
Geology · Faults,"Fault database for the George and NE Edward Rifts, Uganda",Zenodo; Evans (2022); University of Bristol / East African Rift collaborators,Regional active faults,George and northeast Edward Rifts active fault traces,"George and northeast Edward Rifts, Uganda / Albertine Rift, East African Rift System",CC-BY-4.0,"ESRI Shapefile ZIP, GeoJSON, KMZ, Excel slip-profile summary, slip-profile data ZIP",Zenodo DOI repository with direct file downloads,https://zenodo.org/records/6510002,yes,"Evans (2022), Fault database for the George and NE Edward Rifts, Uganda, https://doi.org/10.5281/zenodo.6510002",Zenodo publication 2022; mapped active faults and slip-profile measurements for George and NE Edward Rift study area,"Open CC-BY Zenodo data package. Files include EGR_faults.shp.zip, EGR_faults.geojson, EGR_faults.kmz, EGR_slip_profiles_summary.xlsx and slip_profile_data.zip. This is narrower and more openly downloadable than the restricted 2025 northern Western Branch EARS Zenodo record, which is deferred in v005.",fault-v005-east-african-rift-zenodo,该数据集是乌干达 George Rift 与东北 Edward Rift 的活动断层 GIS 数据包，覆盖东非裂谷 Albertine Rift 的局部区域。Zenodo 记录以 CC-BY-4.0 发布，提供 Shapefile、GeoJSON、KMZ、滑动剖面汇总表和剖面数据压缩包，适合与 Malawi、Luangwa 等东非裂谷活动断层数据做区域对比。,"This dataset provides active-fault GIS traces for the George and northeast Edward Rifts in Uganda, within the Albertine sector of the East African Rift System. The Zenodo record is released under CC-BY-4.0 and includes Shapefile, GeoJSON, KMZ, slip-profile summary, and slip-profile data files. It is useful for comparing localized Albertine Rift fault mapping with the Malawi and Luangwa active-fault datasets.",open repository download,open,DOI research repository record,https://zenodo.org/records/6510002 | https://doi.org/10.5281/zenodo.6510002 | https://zenodo.org/api/records/6510002,download,regional active-fault GIS traces,Feature count not stated in API; file package includes vector traces and slip-profile observations,EGR_faults.geojson 179.0 kB; EGR_faults.shp.zip 56.5 kB; KMZ 65.9 kB; slip_profile_data.zip 499.9 kB listed by Zenodo API
