category,name,provider,theme_canonical,theme_raw,coverage,license,formats,access,url,verified_alive,doi_or_citation,time_span,notes,seen_in_passes,desc_zh,desc_en,access_status,openness,source_type,evidence,access_class,scale,feature_count,file_size
Geology · Faults,New Zealand Community Fault Model (NZ CFM) v1.0,GNS Science / Earth Sciences New Zealand and national collaborators,3D community fault model,New Zealand two- and three-dimensional active and potentially active fault-zone model,Aotearoa New Zealand plate-boundary region,CC-BY-4.0,"XLSX parameter table, Shapefile ZIP, GOCAD T-surf ZIP, GIS projects ZIP, tectonic-domain Shapefile, CSV attributes ZIP, PDF report, Geo3D web viewer",GNS data-and-resources page with direct downloads and Geo3D viewer,https://www.gns.cri.nz/data-and-resources/new-zealand-community-fault-model/,yes,"Seebeck et al. (2022), New Zealand Community Fault Model - version 1.0, GNS Science Report 2021/57, doi:10.21420/GA7S-BS61",Version 1.0 released 2022; first 2D/3D community model for active and potentially active New Zealand fault zones,"GNS page states the model is a 2D and 3D representation of active and potentially active fault zones and is open, updatable and publicly available. Downloads include shapefile, GOCAD surfaces, parameters, GIS projects and report; page reports nearly 900 fault zones.",fault-v005-new-zealand-cfm,NZ CFM v1.0 是 GNS Science 主导的社区断层模型，表达新西兰板块边界沿线活动和潜在活动断层带的二维迹线与三维断层面。数据页提供 Shapefile、GOCAD T-surf、参数表、GIS 项目、CSV 属性和报告，并以 CC-BY-4.0 授权，适合地震源建模、地震动模拟和三维断层几何研究。,"NZ CFM v1.0 is a GNS-led community fault model representing active and potentially active fault zones along the New Zealand plate boundary in both 2D and 3D. The data page provides Shapefile, GOCAD T-surf, parameter tables, GIS projects, CSV attributes, and documentation under CC-BY-4.0. It is appropriate for earthquake-source modelling, ground-motion simulation, and 3D fault-geometry work.",open official download and viewer,open,official institutional dataset,https://www.gns.cri.nz/data-and-resources/new-zealand-community-fault-model/ | https://www.gns.cri.nz/assets/Data-and-Resources/Download-files/Community-Hazard-Model/NZ_CFM_v1_0_shapefile.zip | https://www.gns.cri.nz/assets/Data-and-Resources/Download-files/Community-Hazard-Model/SR2021-57-NZ-CFM-Version-1.0.pdf,download; viewer,"national 2D/3D active-fault model; nominal compilation scale 1:500,000-1:1,000,000 per report",Nearly 900 fault zones reported by GNS overview,Shapefile ZIP 171.6 kB; GNS report PDF 10.0 MB; other download sizes listed on GNS page
Geology · Faults,New Zealand Paleoseismic Site Database v1.0,GNS Science / Earth Sciences New Zealand,Paleoseismic sites and fault slip observations,"New Zealand paleoseismic slip-rate, earthquake-timing and single-event-displacement site database",Aotearoa New Zealand active faults,GNS terms / likely institutional open download; page does not state CC license explicitly,"XLSX spreadsheet, PDF design report, PDF data dictionary",GNS data-and-resources page with direct XLSX and documentation downloads,https://www.gns.cri.nz/data-and-resources/new-zealand-paleoseismic-site-database-v1-0/,yes,"Litchfield et al. (2022), New Zealand Paleoseismic Site Database: design and overview of version 1.0, GNS Science Report 2021/52, doi:10.21420/VTPT-KB52",Version 1.0 compiled from 2020-2021 work and released 2022 for NSHM 2022,"The overview page states the database groups paleoseismic data into Slip Rate, Earthquake Timings, and Single-Event Displacement worksheets, with Easting/Northing site attributes. The report states 2,136 sites, 68 combined records, 862 slip-rate sites, 304 earthquake-timing sites and 970 single-event-displacement sites.",fault-v005-new-zealand-paleoseismic,"新西兰古地震站点数据库 v1.0 汇总活动断层上的古地震观测站点，分为滑动速率、地震时序/复发间隔和单次事件位移三类工作表。GNS 页面提供 XLSX 数据和设计报告/数据字典，报告记录 2,136 个站点及相关组合记录，可用于约束新西兰活动断层模型和国家地震危险性模型。","The New Zealand Paleoseismic Site Database v1.0 compiles site observations along active faults into slip-rate, earthquake-timing/recurrence, and single-event-displacement worksheets. GNS provides the XLSX database plus design and data-dictionary reports. The overview report documents 2,136 sites and associated combined records, making it a key observational companion to New Zealand active-fault and seismic-hazard models.",open official spreadsheet download; terms should be checked before redistribution,open metadata and download,official institutional dataset,https://www.gns.cri.nz/data-and-resources/new-zealand-paleoseismic-site-database-v1-0/ | https://www.gns.cri.nz/assets/Data-and-Resources/Download-files/NZPaleoeismicSiteDB_v1.0.xlsx | https://www.gns.cri.nz/assets/Data-and-Resources/Download-files/sr_2021-052.pdf | https://www.gns.cri.nz/assets/Data-and-Resources/Download-files/sr_2021-040.pdf,download,national paleoseismic site database linked to active faults,"2,136 sites and 68 combined records reported in GNS report; worksheets include 862 slip-rate sites, 304 earthquake-timing sites and 970 SED sites",XLSX 798.8 kB; overview report PDF 6.2 MB; data dictionary PDF 1.2 MB from HEAD checks
Geology · Faults,Idaho Geological Survey Active Fault Database v202505,Idaho Geological Survey / University of Idaho ArcGIS Online,State active faults,Idaho active or potentially active fault traces,"Idaho, United States",ArcGIS item license not specified; public feature service,"ArcGIS FeatureServer, JSON, GeoJSON, PBF",Public ArcGIS FeatureServer with query and GeoJSON output,https://www.arcgis.com/home/item.html?id=2ec43082c06a4617afee4f1e388b812d,yes,Idaho Geological Survey Active Fault Database v202505 ArcGIS item and FeatureServer,"v202505 service; includes Quaternary, Holocene and other active/potentially active fault attributes where available","ArcGIS item snippet says the layer depicts active or potentially active faults mapped in Idaho. The real FeatureServer layer id is 116, not 0. Query returned 4,290 line features and attributes including fault name, sense of motion, dip direction, slip rate, age, synopsis and USGS fault number.",fault-v005-idaho-arcgis,"Idaho Geological Survey Active Fault Database v202505 是爱达荷州活动或潜在活动断层线要素服务。ArcGIS FeatureServer 可直接查询 JSON/GeoJSON，当前 layer 116 返回 4,290 条线要素，并包含断层名、运动性质、倾向、滑动速率、年龄、摘要和 USGS 断层编号等属性。","The Idaho Geological Survey Active Fault Database v202505 is a public line-feature service for active or potentially active faults in Idaho. The ArcGIS FeatureServer supports JSON and GeoJSON queries; layer 116 currently returns 4,290 line features with fault name, sense of motion, dip direction, slip rate, age, synopsis, and USGS fault-number attributes.",open public feature service; license field empty,"open service, license unspecified",official/state ArcGIS feature service,https://www.arcgis.com/home/item.html?id=2ec43082c06a4617afee4f1e388b812d | https://services.arcgis.com/WLhB60Nqwp4NnHz3/arcgis/rest/services/IGS_Active_Fault_Database_v202505/FeatureServer | https://services.arcgis.com/WLhB60Nqwp4NnHz3/arcgis/rest/services/IGS_Active_Fault_Database_v202505/FeatureServer/116/query?where=1%3D1&returnCountOnly=true&f=json,API/service,state active-fault feature layer,"4,290 line features returned by FeatureServer count query on layer 116","service query, no static package size"
Geology · Faults,Oregon Fault Lines,Oregon Department of Geology and Mineral Industries (DOGAMI) / Oregon GEOHub,State geologic faults,Oregon statewide structural fault lines from geologic data compilation,"Oregon, United States",License not specified on ArcGIS item; public Oregon GEOHub service,"ArcGIS MapServer feature layer, JSON, GeoJSON",Oregon GEOHub item and public MapServer layer query,https://geohub.oregon.gov/datasets/oregon-geo::fault-lines,yes,DOGAMI / Oregon Geologic Data Compilation - 2009; Oregon GEOHub Fault Lines item,Oregon Geologic Data Compilation - 2009; ArcGIS item modified 2024,"Accepted as a general geologic/structural fault layer, not an active-fault inventory. The MapServer layer description says it represents structural faults at original mapping scale and descriptive data. Query returned 52,957 line features with fault type, certainty, planar direction/degree and age fields. Oregon active-fault service found in data.gov was deferred because its DOGAMI StatewideEQ MapServer was not started during v005 checks.",fault-v005-oregon-geohub,"Oregon Fault Lines 是 DOGAMI/Oregon GEOHub 发布的全州结构断层线数据，源自 Oregon Geologic Data Compilation 2009。该图层不是专门的活动断层库，但可作为俄勒冈地质断层背景数据使用；MapServer 查询返回 52,957 条线要素，并含断层类型、确定性、断层面方向和年龄等字段。","Oregon Fault Lines is a statewide DOGAMI/Oregon GEOHub structural-fault layer derived from the Oregon Geologic Data Compilation 2009. It is not an active-fault inventory, but it is useful as general geologic fault context for Oregon. The MapServer query returned 52,957 line features with fields for fault type, certainty, planar direction, planar degree, and age.",open public service; license unspecified,"open service, license unspecified",state open-data portal / ArcGIS service,https://geohub.oregon.gov/datasets/oregon-geo::fault-lines | https://www.arcgis.com/home/item.html?id=96e847f5102345c0b31444002f54f608 | https://navigator.state.or.us/arcgis/rest/services/Framework/Haz_GeneralMap_WM/MapServer/0/query?where=1%3D1&returnCountOnly=true&f=json,API/service,state geologic fault line layer,"52,957 line features returned by MapServer count query","service query, no static package size"
Geology · Faults,Great Basin Quaternary Fault Slip and Dilation Tendency Shapefile,"U.S. Geological Survey Geology, Minerals, Energy, and Geophysics Science Center",Fault mechanical tendency attributes,Slip tendency and dilation tendency calculated for Quaternary faults in the Great Basin,"Great Basin region, including parts of Arizona, California, Idaho, Nevada, Oregon, Utah and Wyoming",CC0 1.0 Universal,"Shapefile ZIP, KMZ ZIP, FGDC/XML metadata via ScienceBase",USGS data release and ScienceBase file downloads,https://www.usgs.gov/data/shapefile-slip-tendency-and-dilation-tendency-calculated-quaternary-faults-great-basin,yes,"Siler (2022), Shapefile for slip tendency and dilation tendency calculated for Quaternary faults in the Great Basin, https://doi.org/10.5066/P9YL58W6",USGS data release 2022; Quaternary faults evaluated under ambient stress conditions,"This is a derived attribute dataset, not an independent active-fault map. It adds slip-tendency and dilation-tendency values to Quaternary fault surfaces in the Great Basin and includes full-study and INGENIOUS-area shapefile/KMZ packages. USGS page marks the work CC0.",fault-v005-great-basin-usgs,该 USGS 数据发布为 Great Basin 区域的第四纪断层计算滑动倾向和张裂倾向，覆盖亚利桑那、加州、爱达荷、内华达、俄勒冈、犹他和怀俄明的部分地区。它不是新的断层制图，而是在第四纪断层基础上增加应力取向相关属性，提供 Shapefile 与 KMZ 下载，适合地热、构造应力和活动断层筛选分析。,"This USGS data release calculates slip tendency and dilation tendency for Quaternary faults in the Great Basin, including parts of Arizona, California, Idaho, Nevada, Oregon, Utah, and Wyoming. It is a derived attribute dataset rather than a new fault map, adding stress-orientation metrics to fault surfaces. Shapefile and KMZ packages make it useful for geothermal, tectonic-stress, and active-fault screening analyses.",open USGS/ScienceBase download,open,official data release,https://www.usgs.gov/data/shapefile-slip-tendency-and-dilation-tendency-calculated-quaternary-faults-great-basin | https://doi.org/10.5066/P9YL58W6 | https://www.sciencebase.gov/catalog/item/6296974dd34ec53d276bb33d | https://www.sciencebase.gov/catalog/file/get/6296974dd34ec53d276bb33d?f=__disk__33%2Fb0%2F91%2F33b091fae2403dcf2f1dd2f698f7368ffdcf000d,download,regional derived Quaternary-fault attribute shapefile,Not stated in USGS summary; package covers full study area and INGENIOUS area subsets,"ScienceBase lists Shapefile_Full Study.zip 35.9 MB, Shapefile_INGENIOUS area.zip 28.7 MB, KMZ packages 5.6-6.9 MB"
Geology · Faults,California Alquist-Priolo Earthquake Fault Zones,California Geological Survey / California Department of Conservation,Regulatory surface-fault rupture zones,Alquist-Priolo Earthquake Fault Zones and associated official fault traces,"California, United States",California Department of Conservation disclaimer / public ArcGIS service,"ArcGIS FeatureServer, JSON, GeoJSON, PBF, metadata XML",ArcGIS Online item and public FeatureServer layer,https://www.arcgis.com/home/item.html?id=a1f74ce1577e4e98854df287d2e84b9d,yes,"California Geological Survey, Seismic Hazards Program, Alquist-Priolo Earthquake Fault Zones ArcGIS item",ArcGIS item publication date 2018-01-11 in metadata; regulatory zones reflect official Alquist-Priolo maps,Accepted as a regulatory surface-rupture hazard zone dataset distinct from the broader California Fault Activity Map already cataloged. The item metadata states the polygons delineate areas where surface fault rupture previously occurred or where conditions indicate potential permanent ground displacement requiring avoidance mitigation. FeatureServer layer id is 1 and count query returned 133 polygon features.,fault-v005-california-ap-zones,California Alquist-Priolo Earthquake Fault Zones 是加州地质调查局发布的法定地表破裂危险区数据，表达官方 Alquist-Priolo 断层带边界。它不同于普通活动断层线图，重点是监管用途的多边形分区；FeatureServer layer 1 可查询 GeoJSON/PBF，当前返回 133 个多边形要素。,California Alquist-Priolo Earthquake Fault Zones is a California Geological Survey regulatory surface-rupture hazard dataset representing official Alquist-Priolo zone boundaries. It differs from a general active-fault line map by emphasizing legally defined polygon zones for fault-rupture avoidance. FeatureServer layer 1 supports GeoJSON/PBF queries and currently returns 133 polygon features.,open public feature service; state disclaimer applies,"open service, use disclaimer",official/state ArcGIS feature service,https://www.arcgis.com/home/item.html?id=a1f74ce1577e4e98854df287d2e84b9d | https://www.arcgis.com/sharing/rest/content/items/a1f74ce1577e4e98854df287d2e84b9d/info/metadata/metadata.xml?format=default&output=html | https://services3.arcgis.com/i2dkYWmb4wHvYPda/arcgis/rest/services/cgs_alquist_priolo_zones/FeatureServer/1/query?where=1%3D1&returnCountOnly=true&f=json,API/service,state regulatory surface-fault rupture zone polygons,133 polygon features returned by FeatureServer count query on layer 1,"service query, no static package size"
Geology · Faults,Fault2SHA Central Apennines Database,"Institute for Risk and Disaster Reduction, University College London; PANGAEA; Fault2SHA authors",Regional active-fault field database,"Central Apennines active fault trace, slip-rate, slip-vector and geometry data for seismic hazard assessment","Central Apennines, central Italy",CC-BY-4.0,"GeoPackage, KML, KMZ, XLSX/XLSB spreadsheets, TXT/map-coordinate ZIPs",PANGAEA DOI landing page and direct file downloads,https://doi.pangaea.de/10.1594/PANGAEA.922582,yes,"Faure Walker et al. (2020), Fault2SHA Central Apennines Database, https://doi.org/10.1594/PANGAEA.922582; Scientific Data 2021 https://doi.org/10.1038/s41597-021-00868-0",Published 2020; companion Scientific Data paper 2021; Central Apennines active fault observations compiled from field and literature data,"Accepted as a high-resolution regional active-fault field database distinct from DISS/ITHACA. PANGAEA abstract states it includes trace, fault and master-fault locations with activity and location certainties, plus slip-rate, slip-vector and surface-geometry data. Textfile metadata lists 10 downloadable data objects including GeoPackage, KML/KMZ and spreadsheets.",fault-v006-pangaea-europe,Fault2SHA Central Apennines Database 是意大利中亚平宁地区面向地震危险性分析的高分辨率活动断层观测数据库。PANGAEA 记录提供 GeoPackage、KML/KMZ、XLSX/XLSB 表格和坐标文件，包含断层迹线、断层/主断层位置、活动性与位置可信度、滑动速率、滑动矢量和地表几何信息，可作为 DISS/ITHACA 之外的更细粒度野外数据源。,"The Fault2SHA Central Apennines Database is a high-resolution active-fault field database for seismic-hazard analysis in the central Apennines of Italy. PANGAEA provides GeoPackage, KML/KMZ, XLSX/XLSB tables, and coordinate files with fault traces, fault and master-fault locations, activity and location certainty, slip-rate, slip-vector, and surface-geometry observations. It complements lower-resolution source models such as DISS and national databases such as ITHACA.",open PANGAEA download,open,DOI research repository record,https://doi.pangaea.de/10.1594/PANGAEA.922582 | https://doi.org/10.1594/PANGAEA.922582 | https://doi.pangaea.de/10.1594/PANGAEA.922582?format=textfile | https://download.pangaea.de/dataset/922582/files/Fault2SHA_CentralApennines_Database_2021_v1.gpkg,download,regional active-fault field database,PANGAEA lists 10 downloadable data objects; feature count varies by GeoPackage/spreadsheet layer,GeoPackage 1.4 MB; KML 2.5 MB; KMZ 456.4 kB; XLSX 1.1 MB; coordinate ZIPs 174.6-214.6 kB per PANGAEA text metadata
Geology · Faults,Slovenia Seismogenic Fault and Area Sources for SHMS21,Slovenian Environment Agency (ARSO); Geological Survey of Slovenia (GeoZS); PANGAEA,National seismogenic source model,Seismogenic fault and area sources for the 2021 Slovenian probabilistic seismic hazard model,Slovenia and surrounding border regions,CC-BY-SA-4.0,"Shapefile ZIPs, Excel parameter tables, PANGAEA ZIP package",PANGAEA DOI landing page and direct ZIP download,https://doi.pangaea.de/10.1594/PANGAEA.940100,yes,"Atanackov et al. (2022), Seismogenic fault and area sources for probabilistic seismic hazard model in Slovenia, https://doi.org/10.1594/PANGAEA.940100",Published 2022 for the 2021 Slovenian PSHA model (SHMS21),"PANGAEA abstract states the database contains 89 seismogenic faults and 18 area sources in Slovenia and surroundings. Data include shapefiles for seismogenic-source geometry and Excel parameter tables linked through source ID and name. This row represents the SHMS21 source model, while Database of Active Faults in Slovenia remains a related literature lead.",fault-v006-pangaea-europe,Slovenia SHMS21 地震源数据集由 ARSO 与 GeoZS 为 2021 年斯洛文尼亚概率地震危险性模型建立，PANGAEA 以 CC-BY-SA-4.0 发布。数据包含 89 个发震断层源和 18 个面源，提供描述发震源几何的 Shapefile 与按源 ID/名称关联的 Excel 参数表，适合国家地震危险性模型和跨境地震源对比。,"The Slovenia SHMS21 seismogenic-source dataset was developed by ARSO and GeoZS for the 2021 Slovenian probabilistic seismic hazard model and is distributed through PANGAEA under CC-BY-SA-4.0. It contains 89 seismogenic faults and 18 area sources, with shapefiles for source geometry and Excel parameter tables linked by source ID and name. It is useful for national seismic-hazard modelling and cross-border source-model comparison.",open PANGAEA download,open,DOI research repository record,https://doi.pangaea.de/10.1594/PANGAEA.940100 | https://doi.org/10.1594/PANGAEA.940100 | https://download.pangaea.de/dataset/940100/files/Probabilistic_seismic_hazard_model_Slovenia.zip,download,national seismogenic fault and area-source model,89 seismogenic faults and 18 area sources reported by PANGAEA,"287.4 kB PANGAEA dataset; ZIP HEAD returned 294,343 bytes"
Geology · Faults,International Database of Glacially Induced Faults,PANGAEA; Geological surveys and glacially induced faulting authors,Glacially induced faults,Confirmed and proposed glacially induced / post-glacial fault GIS inventory,"Northern Fennoscandia, northwestern Russia, and proposed examples in formerly glaciated regions including southern Sweden, Denmark, Germany, Iceland, Canada and Antarctica",CC-BY-4.0,ZIP package with GIS files; PANGAEA metadata,PANGAEA DOI landing page and direct ZIP download,https://doi.pangaea.de/10.1594/PANGAEA.922705,yes,"Munier et al. (2020), International database of Glacially Induced Faults, https://doi.org/10.1594/PANGAEA.922705",Published 2020; database intended for continual updates as new results emerge,"Accepted as a specialized fault class rather than ordinary tectonic active faults. PANGAEA abstract states the GIS inventory includes confirmed and proposed glacially induced faults, with confirmed GIFs in northern Fennoscandia including northwestern Russia and proposed GIFs elsewhere. Direct ZIP file is stable as Glacially-Induced_Faults.zip.",fault-v006-pangaea-europe,International Database of Glacially Induced Faults 汇集冰川加载/卸载诱发或再活化断层的 GIS 库，重点包括北部芬诺斯堪的亚和俄罗斯西北部确认的 GIF，也列入南瑞典、丹麦、德国等地区的拟议案例。它是专门的冰后/冰川诱发断层目录，不能与普通活动构造断层直接等同，但对古地震、冰川均衡调整和稳定大陆区地震危险性研究很有价值。,"The International Database of Glacially Induced Faults is a GIS inventory of faults induced or reactivated by glacial loading and unloading. It emphasizes confirmed GIFs in northern Fennoscandia and northwestern Russia and includes proposed cases in southern Sweden, Denmark, Germany and other formerly glaciated regions. It is a specialized post-glacial fault catalogue rather than a general active-tectonic fault database, but is valuable for paleoseismology, glacial isostatic adjustment, and stable-continental-region hazard studies.",open PANGAEA download,open,DOI research repository record,https://doi.pangaea.de/10.1594/PANGAEA.922705 | https://doi.org/10.1594/PANGAEA.922705 | https://download.pangaea.de/dataset/922705/files/Glacially-Induced_Faults.zip,download,international specialized GIF inventory,PANGAEA size reports one ZIP data object; feature count should be checked from GIS contents,"PANGAEA dataset 161.1 kB; direct ZIP HEAD returned 164,948 bytes"
Geology · Faults,Nevada Quaternary Faults Map Service,"Nevada Bureau of Mines and Geology (NBMG) / University of Nevada, Reno",State Quaternary faults,Nevada Quaternary faults and historical ruptures by age,"Nevada, United States",NBMG public service disclaimer; explicit reuse license not stated,"ArcGIS MapServer, JSON, GeoJSON, PBF",NBMG public MapServer and query endpoints,https://gisweb.unr.edu/QuaternaryFaults/,yes,"Nevada Bureau of Mines and Geology, Quaternary Faults in Nevada / M167-derived public map service",Service reflects Quaternary faults adapted from NBMG M167 and USGS QFFD; service checked 2026-07-09,"Accepted as a state service/derivative view with explicit overlap to USGS QFFD. Service description says the Quaternary faults were adapted and modified from NBMG M167 and the USGS Quaternary Fault and Fold Database, with original traces digitized at 1:250,000 scale. Layers include Historical Ruptures and Quaternary Faults by Age; layer 1 count query returned 30,652 line features.",fault-v006-us-state-services,"Nevada Quaternary Faults Map Service 是 NBMG/UNR 发布的内华达第四纪断层与历史破裂 ArcGIS 服务。服务说明明确其数据改编自 NBMG M167 和 USGS Quaternary Fault and Fold Database，原始迹线按 1:250,000 比例尺数字化；layer 1 可查询 GeoJSON/PBF，返回 30,652 条按最后破裂年龄分类的线要素。该条目应作为州级派生服务使用，而不是独立替代 USGS QFFD。","The Nevada Quaternary Faults Map Service is an NBMG/UNR ArcGIS service for Nevada Quaternary faults and historical ruptures. The service description states that the faults were adapted and modified from NBMG M167 and the USGS Quaternary Fault and Fold Database, with original traces digitized at 1:250,000 scale. Layer 1 supports GeoJSON/PBF queries and returned 30,652 line features symbolized by age of last rupture. It should be treated as a state derivative service, not a replacement for the USGS QFFD backbone.",open public map service; license unspecified,"open service, license unspecified",state geological survey ArcGIS service,https://gisweb.unr.edu/QuaternaryFaults/ | https://gisweb.unr.edu/nbmg/rest/services/Geology/Faults/MapServer | https://gisweb.unr.edu/nbmg/rest/services/Geology/Faults/MapServer/1/query?where=1%3D1&returnCountOnly=true&f=json,API/service,state Quaternary-fault and historical-rupture service,"Layer 1 Quaternary Faults by Age count query returned 30,652 line features; layer 0 Historical Ruptures also returned 30,652 in v006 check","service query, no static package size"
