category,name,provider,theme_canonical,theme_raw,coverage,license,formats,access,url,verified_alive,doi_or_citation,time_span,notes,seen_in_passes,desc_zh,desc_en,access_status,openness,source_type,evidence,access_class,scale,feature_count,file_size
LiDAR · Point Clouds and Elevation,Wisconsin Elevation and LiDAR Data via GeoData@Wisconsin,"State Cartographer's Office, University of Wisconsin-Madison; GeoData@Wisconsin; Wisconsin counties and partners",Wisconsin LiDAR/elevation discovery and download portal,Wisconsin LiDAR/elevation discovery and download portal,"Wisconsin, United States statewide discovery with county, FEMA, USGS 3DEP and partner sources",Public portal access; individual dataset terms vary by source/provider,"LiDAR-derived digital elevation data, topographic lidar, topobathy, DEMs and related elevation products",GeoData@Wisconsin discovery/download workflow linked from SCO page,https://www.sco.wisc.edu/data/elevationlidar/,yes,"State Cartographer's Office, University of Wisconsin-Madison; GeoData@Wisconsin; Wisconsin counties and partners; Wisconsin Elevation and LiDAR Data via GeoData@Wisconsin",current portal with multi-year county/FEMA/3DEP collections,Accepted in v028 U.S. state LiDAR portal expansion.,lidar-v028-us-state-lidar-portals-ii,Wisconsin Elevation/LiDAR Data 页面由 UW-Madison State Cartographer's Office 维护，说明 GeoData@Wisconsin 是查找和下载威斯康星 LiDAR 及其他来源派生数字高程数据的主要门户。由于 Wisconsin 没有集中式 LiDAR 采集项目，页面汇总县级、FEMA、USGS 3DEP 等多来源数据。该条目适合作为威斯康星州 LiDAR/高程发现入口。,"The Wisconsin Elevation/LiDAR Data page is maintained by the UW-Madison State Cartographer's Office and identifies GeoData@Wisconsin as the primary portal for finding and downloading Wisconsin digital elevation data derived from LiDAR and other sources. It aggregates county, FEMA, USGS 3DEP and partner resources because Wisconsin does not have one centralized lidar acquisition program.",open portal/service access,public/open web access; dataset-specific terms may vary,official or institutional U.S. state LiDAR/elevation portal,"The Wisconsin State Cartographer's Office states GeoData@Wisconsin is the primary data portal through which users can find and download Wisconsin digital elevation data derived from LiDAR and other sources, including counties, FEMA and USGS 3DEP.",open,statewide discovery portal,varies by project/tile/service,varies by project/tile/product
LiDAR · Point Clouds and Elevation,Maryland iMAP LiDAR Point Cloud Download,Maryland iMAP; Maryland Geographic Information Office,state enterprise LiDAR point-cloud download and services,state enterprise LiDAR point-cloud download and services,"Maryland, United States statewide/state enterprise GIS lidar services",Public Maryland iMAP portal access; item-level terms not specified on decoded page,"LiDAR point cloud download application, LiDAR download, LiDAR metadata and topography services",Maryland iMAP LiDAR point-cloud download page and related metadata/topography service pages,https://imap.maryland.gov/pages/lidar-point-cloud-download,yes,Maryland iMAP; Maryland Geographic Information Office; Maryland iMAP LiDAR Point Cloud Download,current Maryland iMAP portal; project years vary by item,Accepted in v028 U.S. state LiDAR portal expansion.,lidar-v028-us-state-lidar-portals-ii,Maryland iMAP LiDAR Point Cloud Download 是马里兰州企业级 GIS 门户中的 LiDAR 点云下载入口。解码后的 Hub 页面显示 iMAP 支持 imagery、lidar、geocoding 等服务，并包含 LiDAR Point Cloud Download、LiDAR Download、Lidar Metadata 和 Lidar Topography Server 等页面。该条目记录州级点云下载和服务边界。,"Maryland iMAP LiDAR Point Cloud Download is a Maryland enterprise GIS entry for lidar point-cloud access. Decoded Hub metadata states that MD iMAP supports data, imagery, lidar and geocoding services, and its navigation includes LiDAR Point Cloud Download, LiDAR Download, Lidar Metadata and Lidar Topography Server pages.",open portal/service access,public/open web access; dataset-specific terms may vary,official or institutional U.S. state LiDAR/elevation portal,"Maryland iMAP identifies itself as Maryland's Enterprise GIS with more than 1000 services supporting data, imagery, lidar and geocoding; decoded site navigation includes LiDAR Point Cloud Download, LiDAR Download, Lidar Metadata and Lidar Topography Server pages.",open,statewide enterprise GIS portal,varies by project/tile/service,varies by project/tile/product
LiDAR · Point Clouds and Elevation,Virginia LiDAR Download Application,Virginia Geographic Information Network (VGIN); Virginia Department of Emergency Management,state LiDAR download application,state LiDAR download application,"Virginia, United States statewide LiDAR application coverage",Public VGIN portal/application access; item-level terms not specified on decoded Hub page,"LiDAR point cloud, bare-earth DEMs and project metadata per VGIN/ArcGIS indexed summary; ArcGIS Hub application access",VGIN ArcGIS Hub application,https://vgin.vdem.virginia.gov/datasets/virginia-lidar-download-application,yes,Virginia Geographic Information Network (VGIN); Virginia Department of Emergency Management; Virginia LiDAR Download Application,current VGIN LiDAR download application; project years vary by collection,Accepted in v028 U.S. state LiDAR portal expansion.,lidar-v028-us-state-lidar-portals-ii,Virginia LiDAR Download Application 是 VGIN 的 LiDAR 下载应用入口。页面本身作为公开 Hub 应用可访问，搜索索引摘要说明该应用提供 LiDAR point cloud、bare earth DEMs 和 project metadata 访问。该条目保留为弗吉尼亚州级 LiDAR 下载应用边界，后续可用动态浏览器继续核验应用内部下载层。,"The Virginia LiDAR Download Application is VGIN's public lidar download application. The reachable Hub item is public, and the indexed VGIN/ArcGIS summary states that it provides access to lidar point clouds, bare-earth DEMs and project metadata. This row records the state application boundary, with dynamic layer inspection left for a later pass.",open portal/service access,public/open web access; dataset-specific terms may vary,official or institutional U.S. state LiDAR/elevation portal,"The public VGIN Hub exposes a Virginia LiDAR Download Application item. Search-index summary for the same VGIN application states it provides access to LiDAR point cloud, bare earth DEMs and project metadata; decoded Hub metadata marks the VGIN site public.",open,statewide application,varies by project/tile/service,varies by project/tile/product
LiDAR · Point Clouds and Elevation,Utah UGRC Lidar Elevation Data,Utah Geospatial Resource Center (UGRC); State of Utah; partner agencies,statewide LiDAR-derived elevation and point-cloud access path,statewide LiDAR-derived elevation and point-cloud access path,"Utah, United States statewide and project-level LiDAR coverage",Public UGRC/Raster.utah.gov and National Map access; project-specific metadata and terms vary,"bare-earth DEMs/DTMs, first-return DSMs, LAS point clouds via The National Map, reports, metadata, tile indices and breaklines","UGRC page, Raster.utah.gov, Utah Lidar Coverage application and USGS National Map for LAS",https://gis.utah.gov/products/sgid/elevation/lidar/,yes,Utah Geospatial Resource Center (UGRC); State of Utah; partner agencies; Utah UGRC Lidar Elevation Data,"multi-year Utah projects, with examples through 2025 Moab and 2023 Salt Lake County",Accepted in v028 U.S. state LiDAR portal expansion.,lidar-v028-us-state-lidar-portals-ii,Utah UGRC Lidar elevation data 页面说明 LiDAR 是 UGRC 当前最精确的高程数据集，bare-earth DEM/DTM 和 first-return DSM 覆盖犹他州大部分地区。页面链接 Raster.utah.gov 下载派生产品，并说明 LAS 点云可通过 USGS The National Map 获取且支持批量下载。该条目是犹他州 LiDAR/高程数据的核心官方入口。,"The Utah UGRC Lidar elevation data page states that lidar is UGRC's most accurate elevation dataset, with bare-earth DEMs/DTMs and first-return DSMs available for most of Utah. Raster.utah.gov provides downloads for lidar-derived elevation models, while LAS point clouds are available through the USGS National Map with bulk-download support.",open portal/service access,public/open web access; dataset-specific terms may vary,official or institutional U.S. state LiDAR/elevation portal,"UGRC states Lidar is its most accurate elevation dataset, bare-earth DEMs/DTMs and first-return DSMs are available for most of Utah, Raster.utah.gov provides downloads, and LAS point clouds are available from The National Map with bulk downloads.",open,statewide/project portal,varies by project/tile/service,varies by project/tile/product
LiDAR · Point Clouds and Elevation,South Dakota Geological Survey LiDAR Data,South Dakota Geological Survey; University of South Dakota,state LiDAR file download and metadata portal,state LiDAR file download and metadata portal,"South Dakota, United States most counties/state areas with LiDAR availability map",Public South Dakota Geological Survey web access; item-level terms not specified,"LAS, LAZ and TIFF LiDAR data files plus county metadata folders",South Dakota Geological Survey county download/metadata links and availability maps,https://www.sdgs.usd.edu/digitaldata/LiDAR.aspx,yes,South Dakota Geological Survey; University of South Dakota; South Dakota Geological Survey LiDAR Data,current SDGS portal with county/project datasets varying by collection,Accepted in v028 U.S. state LiDAR portal expansion.,lidar-v028-us-state-lidar-portals-ii,South Dakota Geological Survey 的 LiDAR 页面明确说明 LAS、LAZ 和 TIFF 格式的 LiDAR 数据文件可下载，覆盖南达科他州大部分区域，并按县链接对应元数据文件夹。页面还提供可用数据类型和元数据边界地图，并指向 USGS LidarExplorer。该条目是格式证据非常清晰的州级 LiDAR 下载入口。,"The South Dakota Geological Survey LiDAR page explicitly states that LiDAR data files in LAS, LAZ and TIFF are available for download for most of South Dakota, with county links to metadata folders where available. It also provides maps of data availability and metadata boundaries, plus a link to USGS LidarExplorer.",open portal/service access,public/open web access; dataset-specific terms may vary,official or institutional U.S. state LiDAR/elevation portal,"South Dakota Geological Survey states LiDAR data files in LAS, LAZ and TIFF are available to download for most of South Dakota and each county is linked to a corresponding metadata folder where available.",open,statewide/county portal,varies by project/tile/service,varies by project/tile/product
LiDAR · Point Clouds and Elevation,West Virginia Elevation and LIDAR Download Tool,West Virginia GIS Technical Center; WVU; FEMA; USGS; USACE; WVDEP; WV View and partner counties,interactive state LiDAR/elevation download tool,interactive state LiDAR/elevation download tool,"West Virginia, United States statewide/project LiDAR and elevation coverage",Public download tool access; individual source/provider terms may vary,"LiDAR point cloud files, DEMs, hillshade, contours, intensity images, metadata, county bundles and compressed ZLAS project data",map-based AOI download tool with LAS/DEM options and bulk download support,https://data.wvgis.wvu.edu/elevation/,yes,West Virginia GIS Technical Center; WVU; FEMA; USGS; USACE; WVDEP; WV View and partner counties; West Virginia Elevation and LIDAR Download Tool,"project collections from 2012 and 2016-2020 shown in tool text, with additional data as available",Accepted in v028 U.S. state LiDAR portal expansion.,lidar-v028-us-state-lidar-portals-ii,West Virginia Elevation and LIDAR Download Tool 是 WV GIS Technical Center 维护的交互式下载工具。页面说明用户可选择兴趣区下载 LiDAR point cloud files 和 DEM、hillshade、contours 等派生高程产品，并支持 LiDAR/DEM 瓦片批量下载。数据来源包括 FEMA、USGS、USACE、WVDEP、WV View 等机构。,"The West Virginia Elevation and LIDAR Download Tool lets users select areas of interest and download lidar point-cloud files and derived elevation products such as DEMs, hillshade and contours. It documents classified lidar point data, intensity images, metadata, county bundles and bulk downloads of LiDAR or DEM tiles from FEMA, USGS, USACE, WVDEP, WV View and county sources.",open portal/service access,public/open web access; dataset-specific terms may vary,official or institutional U.S. state LiDAR/elevation portal,"The WV tool states users can identify areas of interest and download LiDAR point cloud files and derived elevation products; it lists classified LiDAR point data, DEMs, contours, intensity images and bulk downloads of LiDAR or DEM tiles.",open,statewide/project download tool,varies by project/tile/service,varies by project/tile/product
LiDAR · Point Clouds and Elevation,North Dakota LiDAR Dissemination MapService,North Dakota Department of Water Resources; North Dakota State Water Commission,state LiDAR tile dissemination map service,state LiDAR tile dissemination map service,"North Dakota, United States statewide/project LiDAR tiles",Provided by ND State Water Commission as-is; public web map access with disclaimer,"LAS/LAZ, DEM ZIP/TIF, bare-earth GeoTIFF, max surface height, swath separation imagery and project tiles",interactive tile selection/download map service,https://lidar.dwr.nd.gov/,yes,North Dakota Department of Water Resources; North Dakota State Water Commission; North Dakota LiDAR Dissemination MapService,"multi-year ND project layers; site metadata last updated March 27, 2026",Accepted in v028 U.S. state LiDAR portal expansion.,lidar-v028-us-state-lidar-portals-ii,North Dakota LiDAR Dissemination MapService 是北达科他州水资源部门的交互式 LiDAR 下载地图。页面脚本和界面列出多个 LiDAR 项目图层、LAS/LAZ、DEM、BareEarth TIF 等数据类型，并提示用户选择要下载的瓦片。该入口适合按项目和瓦片获取北达科他州 LiDAR 数据。,"The North Dakota LiDAR Dissemination MapService is an interactive lidar download map from the state water agency. Its page exposes multiple lidar project layers and data types including LAS/LAZ, DEM ZIP/TIF and bare-earth products, and the interface guides users to select tiles for download.",open portal/service access,public/open web access; dataset-specific terms may vary,official or institutional U.S. state LiDAR/elevation portal,"The ND LiDAR Dissemination MapService exposes project layers with datatypes such as LAS with LAZ extension, BareEarth TIF, DEM ZIP and project tiles; the interface instructs users to choose tiles for download and shows project status/data delivery layers.",open,statewide/project tile service,varies by project/tile/service,varies by project/tile/product
LiDAR · Point Clouds and Elevation,Luxembourg Lidar 2024 3D National Survey BD-L-Lidar2024,"Administration du cadastre et de la topographie, Luxembourg; Portail Open Data Luxembourg",national 2024 high-density COPC LAZ point cloud and elevation products,national 2024 high-density COPC LAZ point cloud and elevation products,Luxembourg national territory,Creative Commons Zero (CC0) according to Portail Open Data metadata,"cloud-optimized COPC LAZ point-cloud tiles, COG DTM/MNT and DSM/MNS GeoTIFFs, GeoPackage assembly index and documentation",Portail Open Data dataset with 1299 files and direct download resources on download.data.public.lu/S3,https://data.public.lu/en/datasets/lidar-2024-releve-3d-du-territoire-luxembourgeois/,yes,"Administration du cadastre et de la topographie, Luxembourg; Portail Open Data Luxembourg; Luxembourg Lidar 2024 3D National Survey BD-L-Lidar2024",2024 acquisition; dataset created November 2024 and updated through 2026 metadata,Accepted in v029 city/national gap portal pass.,lidar-v029-city-national-gap-portals,Luxembourg Lidar 2024 是卢森堡地籍与地形管理机构发布的全国 3D LiDAR 数据集。开放数据页面说明数据包括超过 30 pts/m² 的高分辨率点云、DTM/MNT 和 DSM/MNS 派生产品，点云以 500 m LAZ 瓦片组织并采用 COPC 云优化格式。数据许可证为 CC0，适合直接下载、云端流式访问和国家尺度三维地形分析。,"Luxembourg Lidar 2024 is a national 3D lidar survey from the Administration du cadastre et de la topographie. The open-data page states that it includes a very-high-resolution point cloud above 30 emitted points per square metre, derived DTM/MNT and DSM/MNS products, and 500 m LAZ tiles in cloud-optimized COPC format. The dataset is published under CC0 with documented download files.",open dataset/portal access,open/public web access with stated license or terms,official city/national open LiDAR dataset or cloud archive,The Luxembourg open-data page states BD-L-Lidar2024 includes a very-high-resolution point cloud over 30 emitted points/m2 plus derived DTM and DSM; each file contains nine 500 m LAZ tiles that are cloud optimized as COPC; license is CC0 and files are documented.,open,national dataset,varies by tile/file/service,varies by tile/file/product
LiDAR · Point Clouds and Elevation,"GEO RIGA LiDAR Point Cloud, Reality Model and Orthophoto Map",Riga City Council; Riga City Development Department; GEO RIGA,municipal LiDAR point cloud and 3D reality model portal,municipal LiDAR point cloud and 3D reality model portal,"Riga, Latvia municipal territory",Open Data License / GEO RIGA license conditions referenced on page,"LiDAR point cloud, reality model and orthophoto map downloads via GEO RIGA map nomenclature pages",GEO RIGA open-data page and download icons for available datasets by selected nomenclature page,https://georiga.eu/en/atvertie-dati/lidar-point-cloud/,yes,"Riga City Council; Riga City Development Department; GEO RIGA; GEO RIGA LiDAR Point Cloud, Reality Model and Orthophoto Map","current GEO RIGA portal, with dataset vintages varying by layer",Accepted in v029 city/national gap portal pass.,lidar-v029-city-national-gap-portals,GEO RIGA 的 LiDAR point cloud 页面提供里加市 LiDAR 点云、现实模型和正射影像数据入口。页面说明用户可在地图中选择分幅/页号并点击对应数据集的下载图标获取数据，重用需遵守开放数据许可条件。该条目补充了拉脱维亚国家级 LiDAR 条目之外的城市级开放三维数据来源。,"The GEO RIGA LiDAR point cloud page provides a municipal entry point for Riga lidar point-cloud, reality-model and orthophoto data. It instructs users to select a nomenclature page and use download icons for the relevant datasets, with reuse subject to license conditions. This complements national Latvia lidar records with a city-scale open 3D data source.",open dataset/portal access,open/public web access with stated license or terms,official city/national open LiDAR dataset or cloud archive,"GEO RIGA page title and content identify LiDAR point cloud, reality model and orthophoto map data; the page instructs users to select a nomenclature page and click the download icon for the relevant dataset, with reuse subject to license conditions.",open,city/municipal portal,varies by tile/file/service,varies by tile/file/product
LiDAR · Point Clouds and Elevation,Helsinki Region Infoshare Lidar Datasets of the City of Helsinki,City of Helsinki Urban Environment Division; Helsinki Region Infoshare,citywide LAZ LiDAR point-cloud tiles,citywide LAZ LiDAR point-cloud tiles,"Helsinki, Finland citywide",Creative Commons Attribution 4.0 according to Helsinki Region Infoshare metadata,LAZ tiles in ETRS-GK25 sheet index; all-points and terrain-only versions,HRI dataset page with Data and Resources LAZ downloads and Helsinki Map Service layer access,https://hri.fi/data/en_GB/dataset/helsingin-laserkeilausaineistot,yes,City of Helsinki Urban Environment Division; Helsinki Region Infoshare; Helsinki Region Infoshare Lidar Datasets of the City of Helsinki,"2015, 2017 and 2021 scans available according to HRI page",Accepted in v029 city/national gap portal pass.,lidar-v029-city-national-gap-portals,Helsinki Region Infoshare 的 Helsinki LiDAR 数据集覆盖赫尔辛基全市，页面说明数据是三维激光点云，可用于地形模型、等高线生成、城市规划和自然环境变化监测。数据按 ETRS-GK25 分幅以 LAZ 文件发布，并提供 all points 与 terrain 两个版本，许可证为 CC BY 4.0。该条目是城市级开放 LiDAR 的高质量示例。,"The Helsinki Region Infoshare dataset covers the full city of Helsinki with lidar point clouds. The page states that data are published as LAZ tiles in the ETRS-GK25 sheet index, with both all-points and terrain-only versions, and can be downloaded from the Helsinki Map Service. The dataset is licensed under CC BY 4.0.",open dataset/portal access,open/public web access with stated license or terms,official city/national open LiDAR dataset or cloud archive,"HRI states Helsinki LiDAR data are laser point clouds covering the entire city, published as LAZ files by tile, with all-points and terrain versions; the dataset can be downloaded from Helsinki Map Service and is licensed CC BY 4.0.",open,citywide dataset,varies by tile/file/service,varies by tile/file/product
LiDAR · Point Clouds and Elevation,Open Data DC 2024 LiDAR Classified LAS,District of Columbia Office of the Chief Technology Officer; DC GIS,"2024 classified QL1 LAS point cloud for Washington, DC","2024 classified QL1 LAS point cloud for Washington, DC","District of Columbia, United States",Creative Commons CC0 1.0 Universal License according to ArcGIS item licenseInfo,classified LAS 1.4 point-cloud ImageServer / Open Data DC item; USGS QL1 classified lidar,Open Data DC dataset page and ArcGIS ImageServer endpoint https://imagery.dcgis.dc.gov/dcgis/rest/services/Lidar/Classified_LAS_2024/ImageServer,https://opendata.dc.gov/datasets/2024-lidar-classified-las/about,yes,District of Columbia Office of the Chief Technology Officer; DC GIS; Open Data DC 2024 LiDAR Classified LAS,single-lift acquisition on 2024-03-01,Accepted in v029 city/national gap portal pass.,lidar-v029-city-national-gap-portals,Open Data DC 2024 LiDAR - Classified LAS 是华盛顿特区 2024 年 QL1 LiDAR 分类点云数据。ArcGIS item API 说明该数据于 2024 年 3 月 1 日一次飞行采集，处理为 LAS 1.4 分类文件，覆盖 District of Columbia，并因安全原因对部分区域做了删减处理。该条目许可证为 CC0，可作为最新 DC 官方 LiDAR 数据入口。,"Open Data DC 2024 LiDAR - Classified LAS is the District of Columbia’s 2024 classified lidar point-cloud dataset. The ArcGIS item API states that acquisition was flown on March 1, 2024 and processed as classified LAS 1.4 files at USGS QL1 covering the District, with security redaction in limited areas. The item is public and licensed CC0.",open dataset/portal access,open/public web access with stated license or terms,official city/national open LiDAR dataset or cloud archive,"ArcGIS item API for 2024 LiDAR - Classified LAS states the data were flown March 1, 2024, are processed classified LAS 1.4 files at USGS QL1 covering the District of Columbia, public, and licensed CC0.",open,city/district dataset,varies by tile/file/service,varies by tile/file/product
LiDAR · Point Clouds and Elevation,District of Columbia Classified Point Cloud LiDAR on AWS,Washington DC Government; Office of the Chief Technology Officer; DC GIS; AWS Open Data Registry,"cloud-hosted tiled classified point clouds for Washington, DC","cloud-hosted tiled classified point clouds for Washington, DC","District of Columbia, United States entire district tiled point clouds","Washington, DC Terms of Use according to AWS registry entry",tiled classified point-cloud data on Amazon S3 with associated metadata; 2015 and 2018 data documented,AWS Open Data Registry and public S3 bucket documentation for DC lidar,https://registry.opendata.aws/dc-lidar/,yes,Washington DC Government; Office of the Chief Technology Officer; DC GIS; AWS Open Data Registry; District of Columbia Classified Point Cloud LiDAR on AWS,2015 and 2018 data documented in AWS registry; newer DC data tracked separately,Accepted in v029 city/national gap portal pass.,lidar-v029-city-national-gap-portals,District of Columbia Classified Point Cloud LiDAR on AWS 是 DC GIS/OCTO 管理并通过 AWS Open Data Registry 发布的特区 LiDAR 点云集合。注册表说明数据可供任何人在 Amazon S3 上使用，包含覆盖整个 District 的瓦片化点云和相关元数据，并记录 2015 和 2018 数据。该条目补充 Open Data DC 2024 之外的云端历史 DC 点云访问路径。,"District of Columbia Classified Point Cloud LiDAR on AWS is a public S3-hosted lidar collection managed by OCTO through DC GIS and listed in the AWS Open Data Registry. The registry states that tiled point-cloud data for the entire District and associated metadata are available for anyone to use on Amazon S3, with 2015 and 2018 data documented.",open dataset/portal access,open/public web access with stated license or terms,official city/national open LiDAR dataset or cloud archive,"AWS Open Data Registry states LiDAR point cloud data for Washington, DC is available for anyone to use on Amazon S3, managed by OCTO through DC GIS, containing tiled point cloud data for the entire District with associated metadata.",open,city/district cloud archive,varies by tile/file/service,varies by tile/file/product
