category,name,provider,theme_canonical,theme_raw,coverage,license,formats,access,url,verified_alive,doi_or_citation,time_span,notes,seen_in_passes,desc_zh,desc_en,access_status,openness,source_type,evidence,access_class,scale,feature_count,file_size
LiDAR · Point Clouds and Elevation,Southwestern British Columbia Debris Flow Fan UAV LiDAR Dataset,PANGAEA; Zubrycky et al.,Geomorphic hazard UAV LiDAR dataset,Geomorphic fan mapping and UAV LiDAR over debris-flow fans in southwestern British Columbia,"29 debris-flow fans in southwestern British Columbia, Canada, with UAV LiDAR at three fans",Creative Commons Attribution 4.0 International (CC BY 4.0),Geomorphic mapping geodatabase and UAV LiDAR data for selected fans through PANGAEA,PANGAEA DOI landing page and downloadable dataset objects,https://doi.pangaea.de/10.1594/PANGAEA.932864,yes,DOI 10.1594/PANGAEA.932864,UAV LiDAR collected in fall 2019; published 2021-06-21,"PANGAEA abstract states the dataset includes geomorphic fan mapping for 29 debris-flow fans and UAV LiDAR at three fans, used for hazard and risk assessment and change detection. Licence is CC BY 4.0.",lidar-v019-pangaea-cryosphere-coastal-geomorphology,Southwestern British Columbia Debris Flow Fan UAV LiDAR Dataset 包含加拿大不列颠哥伦比亚西南部 29 个泥石流扇的地貌制图数据，并在其中 3 个扇区采集了 UAV LiDAR。PANGAEA 摘要说明数据用于研究泥石流影响的空间记录、灾害和风险评估以及变化检测。该数据补充了 LiDAR 图谱中的山地灾害/地貌制图类别。,"Southwestern British Columbia Debris Flow Fan UAV LiDAR Dataset contains geomorphic mapping for 29 debris-flow fans in southwestern British Columbia, Canada, and UAV LiDAR for three of those fans. The PANGAEA abstract states that the data were used to study the spatial record of debris-flow impacts for hazard/risk assessment and change detection. It adds a mountain-hazard and geomorphic-mapping dataset to the LiDAR atlas.",open DOI-backed PANGAEA download,cc-by-4.0,DOI-backed PANGAEA geomorphic UAV LiDAR hazard dataset,"PANGAEA page lists title, DOI 10.1594/PANGAEA.932864, 29 fans, UAV LiDAR at 3 fans, hazard/change-detection description, CC BY 4.0 licence and 2021 publication date.",open,29 debris-flow fans mapped; UAV LiDAR for 3 fans,fan mapping plus three UAV LiDAR fan datasets,total binary file size not summarized in parsed fields
LiDAR · Point Clouds and Elevation,Sandhausen Inland Dune UAV and Terrestrial Laser Scanning Point Clouds,PANGAEA; Weiser et al.,Dune UAV and terrestrial laser scanning dataset,"UAV photogrammetry, UAV laser scanning and terrestrial laser scanning point clouds of Sandhausen inland dunes","Pflege Schoenau, Pferdstrieb Sued and Zugmantel-Bandholz nature reserves, Sandhausen, Baden-Wuerttemberg, Germany",Creative Commons Attribution-ShareAlike 4.0 International (CC BY-SA 4.0),"UAV photogrammetric point clouds, orthophotos, UAV-borne laser scanning point clouds and TLS point clouds",PANGAEA DOI landing page and downloadable dataset objects,https://doi.pangaea.de/10.1594/PANGAEA.949228,yes,DOI 10.1594/PANGAEA.949228,UAV photogrammetry February/September/October 2021; UAV laser scanning August/September 2021; TLS May 2022; published 2022-09-29,"PANGAEA abstract states that three Sandhausen inland dune reserves of about 10 ha each were surveyed. UAV laser scanning point clouds have pulse densities between 123 and 227 pts/m2, and one site also has TLS from eight scan positions. Licence is CC BY-SA 4.0.",lidar-v019-pangaea-cryosphere-coastal-geomorphology,Sandhausen Inland Dune UAV and Terrestrial Laser Scanning Point Clouds 提供德国 Baden-Württemberg Sandhausen 内陆沙丘三个自然保护区的 UAV 摄影测量点云、正射影像、UAV 激光扫描点云和 TLS 点云。PANGAEA 摘要说明每个区域约 10 公顷，UAV LiDAR 点云脉冲密度为 123-227 点/平方米，Zugmantel-Bandholz 还包含 8 个扫描站的 TLS 数据。该数据适合沙丘微地形、栖息地结构和多传感器点云比较研究。,"Sandhausen Inland Dune UAV and Terrestrial Laser Scanning Point Clouds provides UAV photogrammetric point clouds, orthophotos, UAV laser scanning point clouds and TLS point clouds for three inland dune reserves in Sandhausen, Baden-Wuerttemberg, Germany. PANGAEA states that each area is about 10 ha, UAV LiDAR pulse densities range from 123 to 227 pts/m2, and the Zugmantel-Bandholz site also has TLS from eight scan positions. The dataset supports dune microtopography, habitat structure and multi-sensor point-cloud comparison studies.",open DOI-backed PANGAEA download with share-alike licence,cc-by-sa-4.0,DOI-backed PANGAEA UAV/TLS dune point-cloud dataset,"PANGAEA page lists title, DOI 10.1594/PANGAEA.949228, UAV/TLS/photogrammetry point-cloud description, 123-227 pts/m2 pulse densities, three reserves, CC BY-SA 4.0 licence and publication dates.",open-download-sharealike,three ~10 ha inland dune reserves; UAV LiDAR and TLS data,three sites plus TLS at one site; object count to inspect in PANGAEA table,total binary file size not summarized in parsed fields
LiDAR · Point Clouds and Elevation,Hundsalm Ice Cave 3D Terrestrial Laser Scanning Point Cloud,"PANGAEA; Pfeiffer, Rutzinger and Spoetl",Ice cave terrestrial laser scanning dataset,3D point cloud of Hundsalm ice cave from Riegl VZ-2000i TLS campaigns in 2020,"Hundsalm ice cave, Austria",Creative Commons Attribution-ShareAlike 4.0 International (CC BY-SA 4.0),Classified 3D TLS point cloud with intensity attribute in ETRS89/UTM zone 32N,PANGAEA DOI landing page and downloadable dataset,https://doi.pangaea.de/10.1594/PANGAEA.945655,yes,DOI 10.1594/PANGAEA.945655,"TLS campaigns on 2020-05-15, 2020-06-23 and 2020-07-03; published 2022-06-27","PANGAEA abstract says the data were acquired with a Riegl VZ-2000i TLS from 255 scan positions and co-registered to reflect 2020-07-03 snow/firn/ice conditions. Average spatial resolution is 2 cm, classes include cave rock and snow/firn/ice surfaces, and PANGAEA reports size 2.9 GBytes. Licence is CC BY-SA 4.0.",lidar-v019-pangaea-cryosphere-coastal-geomorphology,Hundsalm Ice Cave 3D Terrestrial Laser Scanning Point Cloud 是奥地利 Hundsalm 冰洞的三维 TLS 点云。PANGAEA 摘要说明数据由 Riegl VZ-2000i 在 2020 年 5-7 月三次采集，共 255 个扫描站，并配准为反映 2020-07-03 雪、粒雪和冰条件的最终数据集。点云平均空间分辨率约 2 厘米，包含洞外地物、地面、洞壁岩面和雪/冰表面分类。,"Hundsalm Ice Cave 3D Terrestrial Laser Scanning Point Cloud is a TLS point cloud of the Hundsalm ice cave in Austria. PANGAEA states that it was acquired with a Riegl VZ-2000i during three campaigns from May to July 2020, using 255 scan positions, and co-registered to reflect snow, firn and ice conditions on 2020-07-03. The point cloud has about 2 cm average spatial resolution and classes for outside objects, ground, cave rock surfaces and snow/firn/ice surfaces.",open DOI-backed PANGAEA download with share-alike licence,cc-by-sa-4.0,DOI-backed PANGAEA ice cave TLS point-cloud dataset,"PANGAEA page lists title, DOI 10.1594/PANGAEA.945655, Riegl VZ-2000i TLS method, 255 scan positions, 2 cm resolution, classes, 2.9 GBytes size and CC BY-SA 4.0 licence.",open-download-sharealike,Hundsalm ice cave TLS from 255 scan positions,classified 3D TLS point cloud,2.9 GBytes according to PANGAEA
LiDAR · Point Clouds and Elevation,Kijkduin CoastScan Beach-Dune 4D Terrestrial Laser Scan Dataset,PANGAEA; CoastScan project; Vos et al.,Coastal beach-dune terrestrial laser scanning time series,Six-month high-resolution 4D stationary laser scan dataset of the Kijkduin beach-dune system,"Kijkduin beach and dune system, The Netherlands",Creative Commons Attribution 4.0 International (CC BY 4.0),Hourly/daily TLS scans and supporting files for georeferenced/time-corrected point clouds in Dutch national coordinate system,PANGAEA DOI landing page and downloadable dataset objects,https://doi.pangaea.de/10.1594/PANGAEA.934058,yes,DOI 10.1594/PANGAEA.934058; associated Scientific Data 2022 paper DOI 10.1038/s41597-022-01291-9,November 2016 to May 2017; published 2021-07-26,"PANGAEA abstract states that a Riegl terrestrial laser scanner surveyed a kilometer of beach and dune for six months, producing more than 4000 hourly/daily scans with 1-10 million points per epoch, decimeter point spacing and centimeter vertical accuracy. Licence is CC BY 4.0.",lidar-v019-pangaea-cryosphere-coastal-geomorphology,Kijkduin CoastScan Beach-Dune 4D TLS Dataset 是荷兰 Kijkduin 海滩-沙丘系统的高分辨率 4D 地面激光扫描时间序列。PANGAEA 摘要说明 Riegl TLS 在 2016 年 11 月至 2017 年 5 月对约 1 公里海岸进行连续观测，获得 4082 个小时/日尺度扫描，每个时相约 100-1000 万个点，具有分米级点间距和厘米级垂直精度。该数据适合海岸变化、沙丘动力学和 4D 点云方法研究。,"Kijkduin CoastScan Beach-Dune 4D TLS Dataset is a high-resolution terrestrial laser scanning time series of the Kijkduin beach-dune system in the Netherlands. The PANGAEA abstract states that a Riegl TLS surveyed about one kilometer of coast from November 2016 to May 2017, producing 4,082 hourly/daily scans with 1-10 million points per epoch, decimeter-order point spacing and centimeter-order vertical accuracy. The dataset supports coastal-change, dune-dynamics and 4D point-cloud methods research.",open DOI-backed PANGAEA download,cc-by-4.0,DOI-backed PANGAEA coastal TLS time-series dataset,"PANGAEA page lists title, DOI 10.1594/PANGAEA.934058, CoastScan description, 4082 scans, 1-10 million points per epoch, beach-dune coverage, CC BY 4.0 licence and associated Scientific Data paper.",open,1 km beach-dune system; 4082 TLS scans over six months,4082 individual scans according to PANGAEA abstract,PANGAEA parsed field reports 182 table data points; total binary file size not summarized
LiDAR · Point Clouds and Elevation,GEDI L2A Vector Canopy Top Height in Earth Engine Version 2,Google Earth Engine Data Catalog; USFS LARSE; NASA GEDI mission; USGS LP DAAC,GEDI footprint-level elevation and height metrics in Earth Engine,"GEDI L2A Vector Canopy Top Height Version 2, LARSE/GEDI/GEDI02_A_002",Near-global ISS-observed GEDI footprints between 51.6 degrees N and 51.6 degrees S,NASA GEDI data distributed through LP DAAC; Earth Engine catalog access terms and cited DOI 10.5067/GEDI/GEDI02_A.002,Earth Engine table/vector assets; GEDI footprint attributes and RH height metrics; source LP DAAC GEDI02_A granules,Google Earth Engine Data Catalog page with asset path LARSE/GEDI/GEDI02_A_002 and source DOI citation,https://developers.google.com/earth-engine/datasets/catalog/LARSE_GEDI_GEDI02_A_002,yes,DOI 10.5067/GEDI/GEDI02_A.002; Dubayah et al. GEDI L2A Elevation and Height Metrics Data Global Footprint Level V002,2019-03-25 to 2024-11-29 according to Earth Engine catalog,"Earth Engine describes GEDI02_A as 100 Relative Height metrics from GEDI waveforms, with original point-table spatial resolution averaging 25 m footprints.",lidar-v020-google-earth-engine-gedi-lidar-derived-assets,GEDI L2A Vector Canopy Top Height in Earth Engine Version 2 是 Google Earth Engine 中的 GEDI 二级 A 向量足迹资产。目录页说明该产品由 GEDI 波形提取 100 个相对高度指标，原始产品是平均约 25 米足迹尺度的点表，时间范围为 2019-03-25 至 2024-11-29。它适合在 GEE 内直接筛选和分析全球森林结构、地形高程与冠层高度指标。,"GEDI L2A Vector Canopy Top Height in Earth Engine Version 2 is the GEDI Level 2A footprint vector asset in Google Earth Engine. The catalog states that GEDI02_A contains 100 relative-height metrics derived from GEDI waveforms, with an original point-table footprint resolution of about 25 m and availability from 2019-03-25 to 2024-11-29. It supports direct GEE analysis of forest structure, terrain elevation and canopy-height metrics.",open Earth Engine catalog asset with DOI-backed NASA source product,NASA/LP DAAC open data via Earth Engine access terms,Google Earth Engine GEDI vector footprint dataset,"The Earth Engine catalog page names GEDI L2A Vector Canopy Top Height Version 2, lists LARSE/USFS/NASA/LP DAAC provenance, states 100 RH waveform metrics and cites DOI 10.5067/GEDI/GEDI02_A.002.",open,"Near-global GEDI footprint vector asset, average 25 m footprint resolution",Earth Engine collection of GEDI L2A footprint granule assets; catalog page does not summarize feature count,not summarized by Earth Engine catalog
LiDAR · Point Clouds and Elevation,GEDI L2B Vector Canopy Cover Vertical Profile Metrics in Earth Engine Version 2,Google Earth Engine Data Catalog; USFS LARSE; NASA GEDI mission; USGS LP DAAC,GEDI footprint-level canopy cover and vertical profile metrics in Earth Engine,"GEDI L2B Vector Canopy Cover Vertical Profile Metrics Version 2, LARSE/GEDI/GEDI02_B_002",Near-global ISS-observed GEDI footprints between 51.6 degrees N and 51.6 degrees S,NASA GEDI data distributed through LP DAAC; Earth Engine catalog access terms and cited DOI 10.5067/GEDI/GEDI02_B.002,Earth Engine table/vector assets; GEDI footprint canopy cover and vertical-profile metrics; source LP DAAC GEDI02_B granules,Google Earth Engine Data Catalog page with asset path LARSE/GEDI/GEDI02_B_002 and source DOI citation,https://developers.google.com/earth-engine/datasets/catalog/LARSE_GEDI_GEDI02_B_002,yes,DOI 10.5067/GEDI/GEDI02_B.002; Dubayah et al. GEDI L2B Canopy Cover and Vertical Profile Metrics Data Global Footprint Level V002,2019-03-25 to 2024-11-29 according to Earth Engine catalog,Earth Engine states that GEDI02_B extracts biophysical metrics from each GEDI waveform using directional gap probability profiles; the vertical profile step dZ is 5 m.,lidar-v020-google-earth-engine-gedi-lidar-derived-assets,GEDI L2B Vector Canopy Cover Vertical Profile Metrics in Earth Engine Version 2 是 GEE 中的 GEDI 二级 B 足迹向量资产。目录页说明该产品从每个 GEDI 波形提取冠层覆盖和垂直剖面生物物理指标，垂直剖面步长为 5 米，原始足迹平均约 25 米。该资产适合研究冠层覆盖、植物面积指数和森林垂直结构。,"GEDI L2B Vector Canopy Cover Vertical Profile Metrics in Earth Engine Version 2 is the GEDI Level 2B footprint vector asset in GEE. The catalog states that it extracts canopy cover and vertical-profile biophysical metrics from each GEDI waveform, with a 5 m vertical profile step and an original average footprint of about 25 m. It is useful for canopy cover, plant area index and forest vertical-structure analyses.",open Earth Engine catalog asset with DOI-backed NASA source product,NASA/LP DAAC open data via Earth Engine access terms,Google Earth Engine GEDI vector footprint dataset,"The Earth Engine catalog page names GEDI L2B Vector Canopy Cover Vertical Profile Metrics Version 2, states waveform-derived vertical-profile metrics and cites DOI 10.5067/GEDI/GEDI02_B.002.",open,"Near-global GEDI footprint vector asset, average 25 m footprint resolution",Earth Engine collection of GEDI L2B footprint granule assets; catalog page does not summarize feature count,not summarized by Earth Engine catalog
LiDAR · Point Clouds and Elevation,GEDI L4A Footprint Aboveground Biomass Density in Earth Engine Version 2.1,Google Earth Engine Data Catalog; USFS LARSE; NASA GEDI mission; USGS LP DAAC; ORNL DAAC,GEDI footprint-level aboveground biomass density in Earth Engine,"GEDI L4A Aboveground Biomass Density Version 2.1, LARSE/GEDI/GEDI04_A_002",Near-global GEDI sampled footprints between 51.6 degrees N and 51.6 degrees S,NASA GEDI/ORNL DAAC open science data via Earth Engine access terms; DOI-backed source product,Earth Engine vector/table footprint assets with aboveground biomass density prediction and prediction error attributes,Google Earth Engine Data Catalog page with asset path LARSE/GEDI/GEDI04_A_002 and DOI/source citations,https://developers.google.com/earth-engine/datasets/catalog/LARSE_GEDI_GEDI04_A_002,yes,Earth Engine cites GEDI L4A Footprint Level Aboveground Biomass Density Version 2.1 and DOI 10.5067/GEDI/GEDI04_A.002; ORNL DAAC DOI 10.3334/ORNLDAAC/2056 appears in citation text,2019-04-18 to 2024-11-28 according to Earth Engine catalog,Earth Engine describes L4A as GEDI footprint predictions of aboveground biomass density and prediction standard error within sampled geolocated laser footprints.,lidar-v020-google-earth-engine-gedi-lidar-derived-assets,GEDI L4A Footprint Aboveground Biomass Density in Earth Engine Version 2.1 是 GEE 中的 GEDI 足迹级地上生物量密度资产。目录页说明该产品为每个采样激光足迹提供 AGBD 预测及预测标准误差，时间范围为 2019-04-18 至 2024-11-28。它适合在 GEE 内把 GEDI 激光足迹与森林、碳储量和生态结构变量联动分析。,"GEDI L4A Footprint Aboveground Biomass Density in Earth Engine Version 2.1 is the GEDI footprint-level AGBD asset in GEE. The catalog states that it provides aboveground biomass density predictions and prediction standard errors within sampled geolocated laser footprints, available from 2019-04-18 to 2024-11-28. It supports GEE workflows linking GEDI laser footprints with forest biomass, carbon and ecosystem-structure variables.",open Earth Engine catalog asset with DOI-backed NASA/ORNL source product,NASA/ORNL open data via Earth Engine access terms,Google Earth Engine GEDI biomass footprint dataset,"The Earth Engine catalog page names GEDI L4A Aboveground Biomass Density Version 2.1, describes footprint AGBD prediction and standard error, and lists DOI/source citations.",open,Near-global GEDI sampled footprints; footprint-level AGBD product,Earth Engine collection of GEDI L4A footprint granule assets; catalog page does not summarize feature count,not summarized by Earth Engine catalog
LiDAR · Point Clouds and Elevation,GEDI L4A Monthly Raster Aboveground Biomass Density in Earth Engine Version 2.1,Google Earth Engine Data Catalog; Google rasterization; USFS LARSE; NASA GEDI mission; USGS LP DAAC,GEDI monthly raster aboveground biomass density in Earth Engine,"GEDI L4A Raster Aboveground Biomass Density Version 2.1, LARSE/GEDI/GEDI04_A_002_MONTHLY",Near-global GEDI sampled footprint rasterization between 51.6 degrees N and 51.6 degrees S,NASA GEDI/ORNL DAAC source data via Earth Engine access terms,"Earth Engine ImageCollection, 25 m pixels, bands including agbd, prediction intervals and standard-error variables",Google Earth Engine Data Catalog page with ImageCollection path LARSE/GEDI/GEDI04_A_002_MONTHLY,https://developers.google.com/earth-engine/datasets/catalog/LARSE_GEDI_GEDI04_A_002_MONTHLY,yes,GEDI L4A source DOI 10.5067/GEDI/GEDI04_A.002 and ORNL DAAC product citations as listed by Earth Engine,2019-03-25 to 2025-07-01 according to Earth Engine catalog,"Earth Engine lists pixel size 25 m and bands including agbd, agbd_pi_lower, agbd_pi_upper and agbd_se for monthly rasterized GEDI L4A biomass.",lidar-v020-google-earth-engine-gedi-lidar-derived-assets,GEDI L4A Monthly Raster Aboveground Biomass Density in Earth Engine Version 2.1 是 GEDI 足迹级生物量产品的月度栅格化版本。GEE 目录页给出 ImageCollection 资产路径 LARSE/GEDI/GEDI04_A_002_MONTHLY，像元大小为 25 米，并包含 AGBD、预测区间和标准误差等波段。它适合在 GEE 中与其他栅格环境变量进行月尺度叠加分析。,"GEDI L4A Monthly Raster Aboveground Biomass Density in Earth Engine Version 2.1 is the monthly rasterized version of GEDI footprint biomass estimates. The GEE catalog gives the ImageCollection path LARSE/GEDI/GEDI04_A_002_MONTHLY, 25 m pixels, and bands for AGBD, prediction intervals and standard error. It is suitable for monthly raster overlay with other environmental variables inside GEE.",open Earth Engine ImageCollection with DOI-backed GEDI source product,NASA/ORNL open data via Earth Engine access terms,Google Earth Engine GEDI monthly raster biomass dataset,"The Earth Engine catalog page lists LARSE/GEDI/GEDI04_A_002_MONTHLY, 25 m bands for agbd and uncertainty measures, and GEDI L4A source provenance.",open,Near-global monthly 25 m rasterized GEDI footprint biomass asset,ImageCollection; catalog page does not summarize image count in parsed metadata,not summarized by Earth Engine catalog
LiDAR · Point Clouds and Elevation,GEDI L4B Gridded Aboveground Biomass Density in Earth Engine Version 2,Google Earth Engine Data Catalog; USFS LARSE; NASA GEDI mission; USGS LP DAAC; ORNL DAAC,GEDI gridded aboveground biomass density in Earth Engine,"GEDI L4B Gridded Aboveground Biomass Density Version 2, LARSE/GEDI/GEDI04_B_002",Near-global 1 km grid based on GEDI observations,NASA GEDI/ORNL DAAC open data via Earth Engine access terms; DOI 10.3334/ORNLDAAC/2056 cited,"Earth Engine Image, 1 km pixels, mean AGBD and uncertainty component bands",Google Earth Engine Data Catalog page with Image path LARSE/GEDI/GEDI04_B_002,https://developers.google.com/earth-engine/datasets/catalog/LARSE_GEDI_GEDI04_B_002,yes,DOI 10.3334/ORNLDAAC/2056; Dubayah et al. 2022 GEDI L4B Gridded Aboveground Biomass Density Version 2,2019-04-18 to 2021-08-04 according to Earth Engine catalog,Earth Engine states that L4B provides 1 km by 1 km estimates of mean aboveground biomass density based on GEDI observations from mission week 19 to 138.,lidar-v020-google-earth-engine-gedi-lidar-derived-assets,GEDI L4B Gridded Aboveground Biomass Density in Earth Engine Version 2 是 GEE 中的 1 公里格网 GEDI 生物量产品。目录页说明它基于 2019-04-18 至 2021-08-04 的 GEDI 观测估计每个 1 公里网格的平均地上生物量密度，并包含不确定性分量。它适合全球或区域尺度森林碳储量制图与验证。,GEDI L4B Gridded Aboveground Biomass Density in Earth Engine Version 2 is the 1 km gridded GEDI biomass product in GEE. The catalog states that it estimates mean aboveground biomass density for 1 km cells using GEDI observations from 2019-04-18 to 2021-08-04 and includes uncertainty components. It is useful for global and regional forest-carbon mapping and validation.,open Earth Engine Image with DOI-backed ORNL DAAC source product,NASA/ORNL open data via Earth Engine access terms,Google Earth Engine GEDI gridded biomass image dataset,"The Earth Engine catalog page lists image asset LARSE/GEDI/GEDI04_B_002, 1 km pixel bands and DOI 10.3334/ORNLDAAC/2056.",open,Near-global 1 km gridded biomass image,single Earth Engine Image with multiple uncertainty and biomass bands,not summarized by Earth Engine catalog
LiDAR · Point Clouds and Elevation,Gridded GEDI Vegetation Structure Metrics 12KM in Earth Engine,Google Earth Engine Data Catalog; Google rasterization; USFS LARSE; NASA GEDI mission; GEDI Vegetation Structure Metrics team,Gridded GEDI vegetation structure metrics in Earth Engine,"Gridded GEDI Vegetation Structure Metrics and Biomass Density 12KM, LARSE/GEDI/GRIDDEDVEG_002/V1/12KM",Near-global GEDI-observed land between 51.6 degrees N and 51.6 degrees S,"Open Earth Engine catalog dataset; paper citation Burns, Hakkenberg and Goetz 2024 Scientific Data DOI 10.1038/s41597-024-03668-4","Earth Engine ImageCollection, 12 km pixels, GEDI-derived vegetation structure and biomass summary bands",Google Earth Engine Data Catalog page with ImageCollection path LARSE/GEDI/GRIDDEDVEG_002/V1/12KM,https://developers.google.com/earth-engine/datasets/catalog/LARSE_GEDI_GRIDDEDVEG_002_V1_12KM,yes,"Burns, Hakkenberg and Goetz, Multi-resolution gridded maps of vegetation structure from GEDI, Scientific Data 11, 881 (2024), DOI 10.1038/s41597-024-03668-4",2019-04-17 to 2023-03-16 according to Earth Engine catalog,"Earth Engine describes near-global analysis-ready gridded vegetation structure metrics derived from GEDI Level 2 and 4A products associated with 25 m diameter lidar footprints, based solely on GEDI lidar.",lidar-v020-google-earth-engine-gedi-lidar-derived-assets,Gridded GEDI Vegetation Structure Metrics 12KM in Earth Engine 是由 GEDI LiDAR 二级和四级 A 产品汇总得到的近全球植被结构格网数据。GEE 目录页说明该资产为 12 公里像元 ImageCollection，基于 25 米直径 GEDI 激光足迹，提供均值、中位数、标准差、分位数等结构统计。它适合宏观植被结构、生物量和生态模型变量制备。,"Gridded GEDI Vegetation Structure Metrics 12KM in Earth Engine is a near-global vegetation-structure grid derived from GEDI Level 2 and 4A products. The GEE catalog describes it as a 12 km ImageCollection based on 25 m GEDI lidar footprints, with summary statistics such as mean, median, standard deviation and quantiles. It is useful for broad-scale vegetation structure, biomass and ecological modeling variables.",open Earth Engine ImageCollection with literature-backed GEDI source product,open Earth Engine catalog access; scientific publication citation provided,Google Earth Engine GEDI gridded vegetation-structure dataset,"The Earth Engine catalog page lists LARSE/GEDI/GRIDDEDVEG_002/V1/12KM, tags lidar/GEDI, states derivation from GEDI Level 2 and 4A products and cites DOI 10.1038/s41597-024-03668-4.",open,Near-global 12 km gridded vegetation structure ImageCollection,ImageCollection; catalog page does not summarize image count in parsed metadata,not summarized by Earth Engine catalog
